[
  {
    "faculty_id":1,
    "name":"Abhishek gupta",
    "faculty_type":"Faculty",
    "education":"PhD (Electrical and Computer Engineering), Toronto Metropolitan University, Canada",
    "bio":"Dr. Abhishek Gupta received his PhD in Electrical and Computer Engineering from Toronto Metropolitan University, Canada. During his PhD, he worked on the application of Machine Learning techniques for performance optimization in Wireless Communications. He also holds an MS in Electrical, Computer from Ryerson University, Canada where he worked on Computer Vision in Autonomous Vehicles using machine learning techniques. Prior to this, he completed an MS in Intelligent Systems from De Montfort University, UK and BE in Electronics and Telecommunication Engineering from Savitribai Phule Pune University, Pune, India. His research interests are machine learning, signal processing, wireless communications and computer vision.",
    "specialization_list":[
      "machine learning",
      "statistical signal processing",
      "rf communications",
      "computer vision",
      "autonomous vehicles"
    ],
    "research_tags":[
      "vision",
      "signal processing",
      "signal",
      "vehicles",
      "statistical",
      "computer",
      "machine",
      "ai",
      "machine learning",
      "processing",
      "learning",
      "computer vision",
      "communications",
      "autonomous"
    ],
    "email":"abhishek_gupta@dau.ac.in",
    "phone":"07968261598",
    "address":"# 3208, FB-3, DAU, Gandhinagar, Gujarat, India – 382007",
    "combined_text":"Name: Abhishek gupta | Role: Faculty | Education: PhD (Electrical and Computer Engineering), Toronto Metropolitan University, Canada | Biography: Dr. Abhishek Gupta received his PhD in Electrical and Computer Engineering from Toronto Metropolitan University, Canada. During his PhD, he worked on the application of Machine Learning techniques for performance optimization in Wireless Communications. He also holds an MS in Electrical, Computer from Ryerson University, Canada where he worked on Computer Vision in Autonomous Vehicles using machine learning techniques. Prior to this, he completed an MS in Intelligent Systems from De Montfort University, UK and BE in Electronics and Telecommunication Engineering from Savitribai Phule Pune University, Pune, India. His research interests are machine learning, signal processing, wireless communications and computer vision. | Research Areas: machine learning, statistical signal processing, rf communications, computer vision, autonomous vehicles | Research Keywords: vision, signal processing, signal, vehicles, statistical, computer, machine, ai, machine learning, processing, learning, computer vision, communications, autonomous"
  },
  {
    "faculty_id":2,
    "name":"Abhishek jindal",
    "faculty_type":"Faculty",
    "education":"PhD (Electronics & Communication Engineering), IIT Delhi",
    "bio":"I received the B. Tech. and M. Tech. degrees from the Jaypee Institute of Information Technology (JIIT) Noida, India. Thereafter, I obtained my Ph.D. from the Bharti School of Telecommunication Technology and Management at the Indian Institute of Technology Delhi (IIT Delhi), New Delhi, India. I was a postdoctoral research associate in the Department of Computer Science, University of Texas at Dallas, USA during 2017-2018. For a brief duration, I was a research assistant professor at the Atria Institute of Technology (affiliated to Visvesvaraya Technological University (VTU), Belagavi) in Bengaluru, India. Since June, 2019, I am a faculty at DA-IICT. My tenure details are as follows. Assistant Professor: June 2019 - April 2025 Associate Professor: May 2025 - Present",
    "specialization_list":[
      "reinforcement learning",
      "deep learning for finance and cyber security",
      "wireless communication",
      "cyber-physical systems",
      "information security"
    ],
    "research_tags":[
      "systems",
      "reinforcement",
      "communication",
      "cyber-physical",
      "cyber",
      "ai",
      "security",
      "information",
      "wireless",
      "deep",
      "for",
      "learning",
      "and",
      "finance"
    ],
    "email":"abhishek_jindal@dau.ac.in",
    "phone":"07968261654",
    "address":"# 4101, FB-4, DA-IICT, Gandhinagar, Gujarat, India – 382007",
    "combined_text":"Name: Abhishek jindal | Role: Faculty | Education: PhD (Electronics & Communication Engineering), IIT Delhi | Biography: I received the B. Tech. and M. Tech. degrees from the Jaypee Institute of Information Technology (JIIT) Noida, India. Thereafter, I obtained my Ph.D. from the Bharti School of Telecommunication Technology and Management at the Indian Institute of Technology Delhi (IIT Delhi), New Delhi, India. I was a postdoctoral research associate in the Department of Computer Science, University of Texas at Dallas, USA during 2017-2018. For a brief duration, I was a research assistant professor at the Atria Institute of Technology (affiliated to Visvesvaraya Technological University (VTU), Belagavi) in Bengaluru, India. Since June, 2019, I am a faculty at DA-IICT. My tenure details are as follows. Assistant Professor: June 2019 - April 2025 Associate Professor: May 2025 - Present | Research Areas: reinforcement learning, deep learning for finance and cyber security, wireless communication, cyber-physical systems, information security | Research Keywords: systems, reinforcement, communication, cyber-physical, cyber, ai, security, information, wireless, deep, for, learning, and, finance"
  },
  {
    "faculty_id":3,
    "name":"Abhishek tilva",
    "faculty_type":"Faculty",
    "education":"PhD (Statistics), Columbia University, New York, USA",
    "bio":"Abhishek Tilva currently serves as an Assistant Professor at DAU. He holds M.A., M.Phil. and Ph.D. degrees in Statistics from Columbia University, New York and B.S. and M.S. degrees in Mathematics from Indian Institute of Science Education and Research (IISER), Pune.",
    "specialization_list":[
      "arbitrage theory",
      "stochastic portfolio theory",
      "stochastic analysis"
    ],
    "research_tags":[
      "arbitrage",
      "analysis",
      "stochastic",
      "portfolio",
      "theory"
    ],
    "email":"abhishek_tilva@dau.ac.in",
    "phone":"07968261549",
    "address":"# 2209, FB-2, DA-IICT, Gandhinagar, Gujarat, India – 382007",
    "combined_text":"Name: Abhishek tilva | Role: Faculty | Education: PhD (Statistics), Columbia University, New York, USA | Biography: Abhishek Tilva currently serves as an Assistant Professor at DAU. He holds M.A., M.Phil. and Ph.D. degrees in Statistics from Columbia University, New York and B.S. and M.S. degrees in Mathematics from Indian Institute of Science Education and Research (IISER), Pune. | Research Areas: arbitrage theory, stochastic portfolio theory, stochastic analysis | Research Keywords: arbitrage, analysis, stochastic, portfolio, theory"
  },
  {
    "faculty_id":4,
    "name":"Aditya tatu",
    "faculty_type":"Faculty",
    "education":"PhD (Computer Science), University of Copenhagen, Denmark",
    "bio":"Aditya Tatu received his Phd from the Department of Computer Science, University of Copenhagen, Denmark in 2010, after which he joined DAIICT, Gandhinagar. He is an Associate Professor at DAIICT since January 2019. His research interests lie in the areas of Image, Signal and Geometry Processing, often relying on Variational methods, Differential Geometry, Linear algebra and (convex) optimization.",
    "specialization_list":[
      "computer vision",
      "image processing",
      "pattern recognition",
      "signal processing"
    ],
    "research_tags":[
      "vision",
      "signal",
      "pattern",
      "ai",
      "computer",
      "recognition",
      "image",
      "processing"
    ],
    "email":"aditya_tatu@dau.ac.in",
    "phone":"07968261540",
    "address":"#1206, FB-1, DA-IICT, Gandhinagar, Gujarat, India – 382007",
    "combined_text":"Name: Aditya tatu | Role: Faculty | Education: PhD (Computer Science), University of Copenhagen, Denmark | Biography: Aditya Tatu received his Phd from the Department of Computer Science, University of Copenhagen, Denmark in 2010, after which he joined DAIICT, Gandhinagar. He is an Associate Professor at DAIICT since January 2019. His research interests lie in the areas of Image, Signal and Geometry Processing, often relying on Variational methods, Differential Geometry, Linear algebra and (convex) optimization. | Research Areas: computer vision, image processing, pattern recognition, signal processing | Research Keywords: vision, signal, pattern, ai, computer, recognition, image, processing"
  },
  {
    "faculty_id":5,
    "name":"Ajay beniwal",
    "faculty_type":"Faculty",
    "education":"PhD (Electronics and Communication Engineering), IIIT Allahabad",
    "bio":"Dr. Ajay Beniwal is currently serving as an Assistant Professor at Dhirubhai Ambani University (Formerly DA-IICT) - Gandhinagar, India. Prior to this, he worked as a Postdoctoral Research Fellow at University College London (UCL), UK and held the prestigious Marie Curie Postdoctoral Fellowship (UKRI funded) at the University of Glasgow, UK. He holds ongoing visiting and research affiliate positions at the UCL and University of Glasgow, respectively. He completed his PhD in Electronics and Communication Engineering from Indian Institute of Information Technology (IIIT) – Allahabad, India, where he was recognized with the Emerging Researcher Award. He has been awarded with University Gold Medal during his Master’s degree. Dr. Beniwal is also a recipient of DST INSPIRE Faculty Fellowship awarded by Ministry of Science & Technology, Government of India. His research interests include flexible and printed electronics, smart sensing technologies, sensor materials, sustainable and green electronics.",
    "specialization_list":[
      "flexible and printable electronics for healthcare and digital agricultural applications",
      "smart sensing technologies with wireless connectivity",
      "sensor materials and nanocomposites",
      "sustainable and green electronics."
    ],
    "research_tags":[
      "with",
      "applications",
      "healthcare",
      "flexible",
      "printable",
      "sensing",
      "sustainable",
      "digital",
      "and",
      "connectivity",
      "materials",
      "electronics.",
      "agricultural",
      "wireless",
      "green",
      "for",
      "smart",
      "electronics",
      "ai",
      "technologies",
      "nanocomposites",
      "sensor"
    ],
    "email":"ajay_beniwal@dau.ac.in",
    "phone":"07968261745",
    "address":"# 3211, FB-3, DA-IICT, Gandhinagar, Gujarat, India – 382007",
    "combined_text":"Name: Ajay beniwal | Role: Faculty | Education: PhD (Electronics and Communication Engineering), IIIT Allahabad | Biography: Dr. Ajay Beniwal is currently serving as an Assistant Professor at Dhirubhai Ambani University (Formerly DA-IICT) - Gandhinagar, India. Prior to this, he worked as a Postdoctoral Research Fellow at University College London (UCL), UK and held the prestigious Marie Curie Postdoctoral Fellowship (UKRI funded) at the University of Glasgow, UK. He holds ongoing visiting and research affiliate positions at the UCL and University of Glasgow, respectively. He completed his PhD in Electronics and Communication Engineering from Indian Institute of Information Technology (IIIT) – Allahabad, India, where he was recognized with the Emerging Researcher Award. He has been awarded with University Gold Medal during his Master’s degree. Dr. Beniwal is also a recipient of DST INSPIRE Faculty Fellowship awarded by Ministry of Science & Technology, Government of India. His research interests include flexible and printed electronics, smart sensing technologies, sensor materials, sustainable and green electronics. | Research Areas: flexible and printable electronics for healthcare and digital agricultural applications, smart sensing technologies with wireless connectivity, sensor materials and nanocomposites, sustainable and green electronics. | Research Keywords: with, applications, healthcare, flexible, printable, sensing, sustainable, digital, and, connectivity, materials, electronics., agricultural, wireless, green, for, smart, electronics, ai, technologies, nanocomposites, sensor"
  },
  {
    "faculty_id":6,
    "name":"Amit mankodi",
    "faculty_type":"Faculty",
    "education":"PhD, DA-IICT Gandhinagar",
    "bio":"Not Available",
    "specialization_list":[
      "embedded systems",
      "computer networks",
      "high performance computing",
      "machine learning"
    ],
    "research_tags":[
      "systems",
      "computing",
      "high",
      "computer",
      "machine",
      "performance",
      "embedded",
      "learning",
      "networks"
    ],
    "email":"amit_mankodi@dau.ac.in",
    "phone":"Not Available",
    "address":"# 4205, FB-4, DA-IICT, Gandhinagar, Gujarat, India – 382007",
    "combined_text":"Name: Amit mankodi | Role: Faculty | Education: PhD, DA-IICT Gandhinagar | Biography: Not Available | Research Areas: embedded systems, computer networks, high performance computing, machine learning | Research Keywords: systems, computing, high, computer, machine, performance, embedded, learning, networks"
  },
  {
    "faculty_id":7,
    "name":"Anil roy (on leave)",
    "faculty_type":"Faculty",
    "education":"PhD (Physics), IIT Delhi",
    "bio":"I am a faculty of DA-IICT, Gandhinagar (India) and am an alumnus of IIT Delhi and IIT Roorkee. I obtained my PhD degree in Physics from IIT Delhi in 1993. Prior to joining DA-IICT in 2003, I worked at Centre for Theoretical Studies at Indian Institute of Science, Bangalore (India) during 1993-94 followed by the Optical Fiber Group at IIT Delhi (India) till 1996. My main academic interest areas are sensors, Internet of Things, image processing, fiber optics, semiconductor physics, applications of technologies for humanitarian challenges. I am a senior member of IEEE, a member of Optica (formerly Optical Society of America) and a member of Optical Society of India. After serving two terms as VP Technical Operations (2020-2023), I am currently the President-elect of IEEE Sensors Council (2024-2025). I was also the Chair of IEEE Conference Publications Committee (2019-2020). I have been the General co-Chair of many international conferences, such as: IEEE APSCON 2023, IEEE R10 HTC 2023, IEEE SENSORS 2018, INDICON 2009 and the Technical Program Committee co-Chair of IEEE APSCON 2025, IEEE APSCON 2024, IEEE International Symposium on Smart Electronic Systems (iSES 2023), INDICON 2019. Some of the notable awards which I won are: 2019 IEEE India Council Section Chair Lifetime Achievement Award, 2017 IEEE Sensors Council Meritorious Service Award, 2012 IEEE MGA Leadership Award and 2010 IEEE Region 10 Outstanding Volunteer Award. KNOW MORE",
    "specialization_list":[
      "applications of image processing",
      "fiber optics and optical communication",
      "high speed semiconductor devices",
      "nanoscience and nanotechnology",
      "quantum optics",
      "technologies for humanitarian challenges."
    ],
    "research_tags":[
      "communication",
      "devices",
      "fiber",
      "nanoscience",
      "applications",
      "speed",
      "nanotechnology",
      "high",
      "and",
      "optics",
      "semiconductor",
      "quantum",
      "humanitarian",
      "image",
      "processing",
      "for",
      "optical",
      "ai",
      "technologies",
      "challenges."
    ],
    "email":"anil_roy@dau.ac.in",
    "phone":"07968261613",
    "address":"# 1104, FB-1, DA-IICT, Gandhinagar, Gujarat, India – 382007",
    "combined_text":"Name: Anil roy (on leave) | Role: Faculty | Education: PhD (Physics), IIT Delhi | Biography: I am a faculty of DA-IICT, Gandhinagar (India) and am an alumnus of IIT Delhi and IIT Roorkee. I obtained my PhD degree in Physics from IIT Delhi in 1993. Prior to joining DA-IICT in 2003, I worked at Centre for Theoretical Studies at Indian Institute of Science, Bangalore (India) during 1993-94 followed by the Optical Fiber Group at IIT Delhi (India) till 1996. My main academic interest areas are sensors, Internet of Things, image processing, fiber optics, semiconductor physics, applications of technologies for humanitarian challenges. I am a senior member of IEEE, a member of Optica (formerly Optical Society of America) and a member of Optical Society of India. After serving two terms as VP Technical Operations (2020-2023), I am currently the President-elect of IEEE Sensors Council (2024-2025). I was also the Chair of IEEE Conference Publications Committee (2019-2020). I have been the General co-Chair of many international conferences, such as: IEEE APSCON 2023, IEEE R10 HTC 2023, IEEE SENSORS 2018, INDICON 2009 and the Technical Program Committee co-Chair of IEEE APSCON 2025, IEEE APSCON 2024, IEEE International Symposium on Smart Electronic Systems (iSES 2023), INDICON 2019. Some of the notable awards which I won are: 2019 IEEE India Council Section Chair Lifetime Achievement Award, 2017 IEEE Sensors Council Meritorious Service Award, 2012 IEEE MGA Leadership Award and 2010 IEEE Region 10 Outstanding Volunteer Award. KNOW MORE | Research Areas: applications of image processing, fiber optics and optical communication, high speed semiconductor devices, nanoscience and nanotechnology, quantum optics, technologies for humanitarian challenges. | Research Keywords: communication, devices, fiber, nanoscience, applications, speed, nanotechnology, high, and, optics, semiconductor, quantum, humanitarian, image, processing, for, optical, ai, technologies, challenges."
  },
  {
    "faculty_id":8,
    "name":"Anish mathuria",
    "faculty_type":"Faculty",
    "education":"PhD (Computer Science), University of Wollongong, Australia",
    "bio":"Anish Mathuria is a Professor at DA-IICT. His research interests are in information security and cryptography. Anish is currently an Associate Editor for Sadhana, a journal published by Indian Academy of Sciences. He has served on the program committees of ICISS, Indocrypt, and SPACE conferences. Anish was an invited speaker at the CIMPA-UNESCO-INDIA School on Security for Computer Systems and Networks held in 2005. He has served on the committee for “e-Authentication standards” constituted by the Ministry of Communications and Information Technology. Anish has a Bachelor’s degree in Electronics from University of Bombay, and Master’s and PhD degrees in Computer Science from University of Wollongong, Australia. Prior to joining the faculty at DA-IICT, he was at IBM Tokyo Research Laboratory, and University of Massachusetts Dartmouth, USA",
    "specialization_list":[
      "network security",
      "privacy-preserving computation",
      "system and software security"
    ],
    "research_tags":[
      "software",
      "system",
      "security",
      "privacy-preserving",
      "computation",
      "and",
      "network"
    ],
    "email":"anish_mathuria@dau.ac.in",
    "phone":"07968261541",
    "address":"# 1105, FB-1, DA-IICT, Gandhinagar, Gujarat, India – 382007",
    "combined_text":"Name: Anish mathuria | Role: Faculty | Education: PhD (Computer Science), University of Wollongong, Australia | Biography: Anish Mathuria is a Professor at DA-IICT. His research interests are in information security and cryptography. Anish is currently an Associate Editor for Sadhana, a journal published by Indian Academy of Sciences. He has served on the program committees of ICISS, Indocrypt, and SPACE conferences. Anish was an invited speaker at the CIMPA-UNESCO-INDIA School on Security for Computer Systems and Networks held in 2005. He has served on the committee for “e-Authentication standards” constituted by the Ministry of Communications and Information Technology. Anish has a Bachelor’s degree in Electronics from University of Bombay, and Master’s and PhD degrees in Computer Science from University of Wollongong, Australia. Prior to joining the faculty at DA-IICT, he was at IBM Tokyo Research Laboratory, and University of Massachusetts Dartmouth, USA | Research Areas: network security, privacy-preserving computation, system and software security | Research Keywords: software, system, security, privacy-preserving, computation, and, network"
  },
  {
    "faculty_id":9,
    "name":"Ankit vijayvargiya",
    "faculty_type":"Faculty",
    "education":"PhD (Biomedical Signals), Malaviya National Institute of Technology, Jaipur",
    "bio":"Dr. Ankit Vijayvargiya is currently serving as an Assistant Professor at DAU. He holds a Ph.D. in Artificial Intelligence in Healthcare from Malaviya National Institute of Technology (MNIT), Jaipur, where his research focused on AI-enabled solutions for human health, particularly in biomedical signal processing and human activity recognition. He was awarded the prestigious NeuroInsight Marie Skłodowska-Curie Actions (MSCA) Postdoctoral Fellowship hosted at Dublin City University (DCU), Ireland, where he conducted advanced research on data-driven practices for robotic rehabilitation in individuals with incomplete spinal cord injuries. He has also gained valuable international exposure as a Visiting Researcher at Khalifa University, UAE. Dr. Vijayvargiya’s research interests include biomedical signal processing, machine learning, human robot interaction, wearable systems, and assistive healthcare technologies. He has authored more than 50 research publications, including peer-reviewed journal articles, conference proceedings, and book chapters. He has been the recipient of several research grants and awards, with funding support from the Department of Science and Technology, the Ministry of MSME, and the Institution of Engineers (India). He has delivered invited talks and expert lectures at various premier academic and research institutions. He is a reviewer for various scientific and engineering journals. He is a Senior Member of IEEE and an Associate Member of the Institution of Engineers (India).",
    "specialization_list":[
      "biomedical signals",
      "machine learning",
      "neural rehabilitation",
      "gait analysis"
    ],
    "research_tags":[
      "signal processing",
      "ai",
      "rehabilitation",
      "machine",
      "neural",
      "signals",
      "gait",
      "analysis",
      "biomedical",
      "machine learning",
      "artificial intelligence",
      "learning"
    ],
    "email":"ankit_vijayvargiya@dau.ac.in",
    "phone":"07968261628",
    "address":"# 4205, FB-4, DAU, Gandhinagar, Gujarat, India – 382007",
    "combined_text":"Name: Ankit vijayvargiya | Role: Faculty | Education: PhD (Biomedical Signals), Malaviya National Institute of Technology, Jaipur | Biography: Dr. Ankit Vijayvargiya is currently serving as an Assistant Professor at DAU. He holds a Ph.D. in Artificial Intelligence in Healthcare from Malaviya National Institute of Technology (MNIT), Jaipur, where his research focused on AI-enabled solutions for human health, particularly in biomedical signal processing and human activity recognition. He was awarded the prestigious NeuroInsight Marie Skłodowska-Curie Actions (MSCA) Postdoctoral Fellowship hosted at Dublin City University (DCU), Ireland, where he conducted advanced research on data-driven practices for robotic rehabilitation in individuals with incomplete spinal cord injuries. He has also gained valuable international exposure as a Visiting Researcher at Khalifa University, UAE. Dr. Vijayvargiya’s research interests include biomedical signal processing, machine learning, human robot interaction, wearable systems, and assistive healthcare technologies. He has authored more than 50 research publications, including peer-reviewed journal articles, conference proceedings, and book chapters. He has been the recipient of several research grants and awards, with funding support from the Department of Science and Technology, the Ministry of MSME, and the Institution of Engineers (India). He has delivered invited talks and expert lectures at various premier academic and research institutions. He is a reviewer for various scientific and engineering journals. He is a Senior Member of IEEE and an Associate Member of the Institution of Engineers (India). | Research Areas: biomedical signals, machine learning, neural rehabilitation, gait analysis | Research Keywords: signal processing, ai, rehabilitation, machine, neural, signals, gait, analysis, biomedical, machine learning, artificial intelligence, learning"
  },
  {
    "faculty_id":10,
    "name":"Ankush chander",
    "faculty_type":"Faculty",
    "education":"M.Tech. (ICT), DA-IICT Gandhinagar",
    "bio":"Not Available",
    "specialization_list":[
      "natural language processing",
      "information retrieval",
      "operating systems"
    ],
    "research_tags":[
      "systems",
      "operating",
      "retrieval",
      "information",
      "natural",
      "processing",
      "language"
    ],
    "email":"ankush_chander@dau.ac.in",
    "phone":"07968261581",
    "address":"# 3209, FB-3, DA-IICT, Gandhinagar, Gujarat, India – 382007",
    "combined_text":"Name: Ankush chander | Role: Faculty | Education: M.Tech. (ICT), DA-IICT Gandhinagar | Biography: Not Available | Research Areas: natural language processing, information retrieval, operating systems | Research Keywords: systems, operating, retrieval, information, natural, processing, language"
  },
  {
    "faculty_id":11,
    "name":"Anupam rana",
    "faculty_type":"Faculty",
    "education":"PhD (Design Management) - Retails Experience-CX, Indus University, Ahmedabad",
    "bio":"Dr. Anupam Rana is an académicien with over 22 years of experience, including 20 years in design education. He holds a B.Tech. in Mechanical Engineering and a Ph.D. in Experience Design. He spent 17 years at NIFT Gandhinagar & Shillong, where he was a founding member of Accessory Design and Experience Design program. Dr. Rana’s expertise Spans, Product Design Human-Centric Design, Exhibition Design, and Multidisciplinary Research. He also serves as an expert consultant to the industry & govt. organisation, bringing practical insights to academic and professional design challenges.",
    "specialization_list":[
      "design education",
      "experience design",
      "multidisciplinary research",
      "uiux",
      "design thinking."
    ],
    "research_tags":[
      "research",
      "education",
      "design",
      "experience",
      "multidisciplinary",
      "thinking.",
      "uiux"
    ],
    "email":"anupam_rana@dau.ac.in",
    "phone":"07968261538",
    "address":"#3210, FB-3, DA-IICT, Gandhinagar, Gujarat, India – 382007",
    "combined_text":"Name: Anupam rana | Role: Faculty | Education: PhD (Design Management) - Retails Experience-CX, Indus University, Ahmedabad | Biography: Dr. Anupam Rana is an académicien with over 22 years of experience, including 20 years in design education. He holds a B.Tech. in Mechanical Engineering and a Ph.D. in Experience Design. He spent 17 years at NIFT Gandhinagar & Shillong, where he was a founding member of Accessory Design and Experience Design program. Dr. Rana’s expertise Spans, Product Design Human-Centric Design, Exhibition Design, and Multidisciplinary Research. He also serves as an expert consultant to the industry & govt. organisation, bringing practical insights to academic and professional design challenges. | Research Areas: design education, experience design, multidisciplinary research, uiux, design thinking. | Research Keywords: research, education, design, experience, multidisciplinary, thinking., uiux"
  },
  {
    "faculty_id":12,
    "name":"Arnab bhabak",
    "faculty_type":"Faculty",
    "education":"PhD (Mathematics), IIT Guwahati",
    "bio":"Myself Dr. Arnab Bhabak. I obtained my PhD degree in Mathematics from Indian Institute of Technology Guwahati, India. During my PhD, I worked on the Stochastic Control and Stochastic Game Theory. I did my Master’s from Indian Institute of Technology Kanpur, India. Prior to this, I completed my Graduation in Mathematics as a Major from St. Xavier’s College Kolkata, India. My primary work includes zero sum and non zero sum game problems for different dynamics viz., Markov chains, semi Markov processes, piecewise deterministic Markov chains.",
    "specialization_list":[
      "stochastic control",
      "stochastic game theory",
      "probability theory"
    ],
    "research_tags":[
      "game",
      "ai",
      "probability",
      "control",
      "stochastic",
      "theory"
    ],
    "email":"arnab_bhabak@dau.ac.in",
    "phone":"07968261619",
    "address":"# 4204, FB-4, DAU, Gandhinagar, Gujarat, India – 382007",
    "combined_text":"Name: Arnab bhabak | Role: Faculty | Education: PhD (Mathematics), IIT Guwahati | Biography: Myself Dr. Arnab Bhabak. I obtained my PhD degree in Mathematics from Indian Institute of Technology Guwahati, India. During my PhD, I worked on the Stochastic Control and Stochastic Game Theory. I did my Master’s from Indian Institute of Technology Kanpur, India. Prior to this, I completed my Graduation in Mathematics as a Major from St. Xavier’s College Kolkata, India. My primary work includes zero sum and non zero sum game problems for different dynamics viz., Markov chains, semi Markov processes, piecewise deterministic Markov chains. | Research Areas: stochastic control, stochastic game theory, probability theory | Research Keywords: game, ai, probability, control, stochastic, theory"
  },
  {
    "faculty_id":13,
    "name":"Arnab kumar ray",
    "faculty_type":"Faculty",
    "education":"PhD (Physics), Jadavpur University, Kolkata",
    "bio":"I hold a doctorate in astrophysical fluid dynamics. My research methods are theoretical in nature, with my present research interests being astrophysical accretion, fluid dynamics and nonlinear systems. I have publications in peer-reviewed journals of astrophysics, gravitation, nonlinear dynamics, condensed matter physics, nuclear physics, complex systems and geophysics. I also have research experience in the seismic processing industry. I have interest in designing curriculum and exploring new pedagogic approaches to aid the teaching-learning process.",
    "specialization_list":[
      "astrophysical accretion",
      "fluid dynamics",
      "nonlinear systems"
    ],
    "research_tags":[
      "nonlinear",
      "systems",
      "fluid",
      "ai",
      "dynamics",
      "astrophysical",
      "accretion"
    ],
    "email":"arnab_kumar@dau.ac.in",
    "phone":"07968261612",
    "address":"# 2210, FB-2, DA-IICT, Gandhinagar, Gujarat, India – 382007",
    "combined_text":"Name: Arnab kumar ray | Role: Faculty | Education: PhD (Physics), Jadavpur University, Kolkata | Biography: I hold a doctorate in astrophysical fluid dynamics. My research methods are theoretical in nature, with my present research interests being astrophysical accretion, fluid dynamics and nonlinear systems. I have publications in peer-reviewed journals of astrophysics, gravitation, nonlinear dynamics, condensed matter physics, nuclear physics, complex systems and geophysics. I also have research experience in the seismic processing industry. I have interest in designing curriculum and exploring new pedagogic approaches to aid the teaching-learning process. | Research Areas: astrophysical accretion, fluid dynamics, nonlinear systems | Research Keywords: nonlinear, systems, fluid, ai, dynamics, astrophysical, accretion"
  },
  {
    "faculty_id":14,
    "name":"Arpit rana",
    "faculty_type":"Faculty",
    "education":"PhD (Computer Science), University College Cork, Ireland",
    "bio":"Dr. Arpit Rana did his Ph.D. from University College Cork, Ireland, in 2020. Before joining DA-IICT, He worked as a Postdoctoral Researcher at the Department of Industrial Engineering, University of Toronto (U of T), Canada.",
    "specialization_list":[
      "applied machine learning",
      "recommendation systems",
      "multimodality",
      "and their applications in digital innovation and transformation"
    ],
    "research_tags":[
      "transformation",
      "systems",
      "innovation",
      "machine",
      "applied",
      "their",
      "multimodality",
      "learning",
      "digital",
      "applications",
      "and",
      "recommendation"
    ],
    "email":"arpit_rana@dau.ac.in",
    "phone":"07968261687",
    "address":"#3105, FB-3, DA-IICT, Gandhinagar, Gujarat, India – 382007",
    "combined_text":"Name: Arpit rana | Role: Faculty | Education: PhD (Computer Science), University College Cork, Ireland | Biography: Dr. Arpit Rana did his Ph.D. from University College Cork, Ireland, in 2020. Before joining DA-IICT, He worked as a Postdoctoral Researcher at the Department of Industrial Engineering, University of Toronto (U of T), Canada. | Research Areas: applied machine learning, recommendation systems, multimodality, and their applications in digital innovation and transformation | Research Keywords: transformation, systems, innovation, machine, applied, their, multimodality, learning, digital, applications, and, recommendation"
  },
  {
    "faculty_id":15,
    "name":"Arpita mal",
    "faculty_type":"Faculty",
    "education":"PhD (Mathematics), Jadavpur University, Kolkata",
    "bio":"Dr. Arpita Mal is an assistant professor at DA-IICT since December 2023. Prior to joining DA-IICT, she was an INSPIRE Faculty Fellow at IISc Bangalore. She completed her PhD from Jadavpur University in 2021. Her research interest is broadly in Functional Analysis, Operator Theory and Linear Algebra. In particular, it includes Geometry of Banach space, Birkohff-James orthogonality, Numerical radius etc.",
    "specialization_list":[

    ],
    "research_tags":[
      "dl"
    ],
    "email":"arpita_mal@dau.ac.in",
    "phone":"07968261660",
    "address":"# 3104, FB-3, DA-IICT, Gandhinagar, Gujarat, India – 382007",
    "combined_text":"Name: Arpita mal | Role: Faculty | Education: PhD (Mathematics), Jadavpur University, Kolkata | Biography: Dr. Arpita Mal is an assistant professor at DA-IICT since December 2023. Prior to joining DA-IICT, she was an INSPIRE Faculty Fellow at IISc Bangalore. She completed her PhD from Jadavpur University in 2021. Her research interest is broadly in Functional Analysis, Operator Theory and Linear Algebra. In particular, it includes Geometry of Banach space, Birkohff-James orthogonality, Numerical radius etc. | Research Areas:  | Research Keywords: dl"
  },
  {
    "faculty_id":16,
    "name":"Arunava chakravarty",
    "faculty_type":"Faculty",
    "education":"PhD (Computer Science and Engineering), IIIT Hyderabad",
    "bio":"Arunava Chakravarty is currently serving as an Assistant Professor at Dhirubhai Ambani University (formerly DA-IICT), Gandhinagar, India. Prior to joining DAU, he was a Postdoctoral Researcher at the Ophthalmic Image Analysis (OPTIMA) Lab, Medical University of Vienna, Austria, under Prof. Hrovoje Bogunović. His work focused on developing deep learning frameworks for self-supervised learning over longitudinal medical data and survival analysis to model disease progression in retinal OCT, with a particular emphasis on Age-Related Macular Degeneration (AMD). During 2019–2020, he served as a Postdoctoral Research Consultant at the Kharagpur Learning Imaging and Visualization (KLIV) Group, Indian Institute of Technology Kharagpur, India, under Prof. Debdoot Sheet, where he worked on the analysis and automated detection of abnormalities in musculoskeletal X-ray images, chest radiographs, and mammograms. Dr. Chakravarty obtained his Ph.D. in Computer Science (2019) from the Center for Visual Information Technology, International Institute of Information Technology Hyderabad, India, where he worked on retinal image analysis for glaucoma detection from color fundus images and intra-retinal layer segmentation in OCT volumes. He received his M.Tech. (2011) from the Indian Institute of Technology (Indian School of Mines), Dhanbad, India, and his B.Tech. (2009) from the West Bengal University of Technology, India. His research interests broadly include medical image analysis, deep learning for longitudinal and survival modeling, self-supervised representation learning, retinal imaging, and disease progression forecasting.",
    "specialization_list":[
      "medical image analysis",
      "machine learning for healthcare",
      "computer vision"
    ],
    "research_tags":[
      "vision",
      "healthcare",
      "ai",
      "computer",
      "machine",
      "analysis",
      "image",
      "dl",
      "learning",
      "for",
      "deep learning",
      "medical"
    ],
    "email":"arunava_chakravarty@dau.ac.in",
    "phone":"07968261542",
    "address":"# 1201, FB-1, DAU, Gandhinagar, Gujarat, India – 382007",
    "combined_text":"Name: Arunava chakravarty | Role: Faculty | Education: PhD (Computer Science and Engineering), IIIT Hyderabad | Biography: Arunava Chakravarty is currently serving as an Assistant Professor at Dhirubhai Ambani University (formerly DA-IICT), Gandhinagar, India. Prior to joining DAU, he was a Postdoctoral Researcher at the Ophthalmic Image Analysis (OPTIMA) Lab, Medical University of Vienna, Austria, under Prof. Hrovoje Bogunović. His work focused on developing deep learning frameworks for self-supervised learning over longitudinal medical data and survival analysis to model disease progression in retinal OCT, with a particular emphasis on Age-Related Macular Degeneration (AMD). During 2019–2020, he served as a Postdoctoral Research Consultant at the Kharagpur Learning Imaging and Visualization (KLIV) Group, Indian Institute of Technology Kharagpur, India, under Prof. Debdoot Sheet, where he worked on the analysis and automated detection of abnormalities in musculoskeletal X-ray images, chest radiographs, and mammograms. Dr. Chakravarty obtained his Ph.D. in Computer Science (2019) from the Center for Visual Information Technology, International Institute of Information Technology Hyderabad, India, where he worked on retinal image analysis for glaucoma detection from color fundus images and intra-retinal layer segmentation in OCT volumes. He received his M.Tech. (2011) from the Indian Institute of Technology (Indian School of Mines), Dhanbad, India, and his B.Tech. (2009) from the West Bengal University of Technology, India. His research interests broadly include medical image analysis, deep learning for longitudinal and survival modeling, self-supervised representation learning, retinal imaging, and disease progression forecasting. | Research Areas: medical image analysis, machine learning for healthcare, computer vision | Research Keywords: vision, healthcare, ai, computer, machine, analysis, image, dl, learning, for, deep learning, medical"
  },
  {
    "faculty_id":17,
    "name":"Bharani kollipara",
    "faculty_type":"Faculty",
    "education":"PhD (English), The English and Foreign Languages University, Hyderabad",
    "bio":"I write and teach in the areas of modern philosophy, political theory and South Asian Studies. I am interested in the phenomenological tradition and its wider ramifications in the 20th century as Hermeneutics et al, particularly with reference to phenomenology’s approach to questions in metaphysics. My general research focus is organized around questions pertaining, broadly speaking, to the ontology of tradition in view of its complicated relation to the notion history. Currently I am interested in unraveling the relations between Phenomenology and Hermeneutics. As a trained scholar in literature (Modernism), I bring to bear my literary training on closely reading canonical philosophical texts of the Western tradition. Students interested in working at the intersection between literature and philosophy are encouraged to contact me.",
    "specialization_list":[
      "modern philosophy",
      "phenomenology and hermeneutics",
      "literary modernism"
    ],
    "research_tags":[
      "modern",
      "literary",
      "ai",
      "phenomenology",
      "modernism",
      "dl",
      "philosophy",
      "hermeneutics",
      "and"
    ],
    "email":"bharani_kollipara@dau.ac.in",
    "phone":"07968261558",
    "address":"# 2102, FB-2, DA-IICT, Gandhinagar, Gujarat, India – 382007",
    "combined_text":"Name: Bharani kollipara | Role: Faculty | Education: PhD (English), The English and Foreign Languages University, Hyderabad | Biography: I write and teach in the areas of modern philosophy, political theory and South Asian Studies. I am interested in the phenomenological tradition and its wider ramifications in the 20th century as Hermeneutics et al, particularly with reference to phenomenology’s approach to questions in metaphysics. My general research focus is organized around questions pertaining, broadly speaking, to the ontology of tradition in view of its complicated relation to the notion history. Currently I am interested in unraveling the relations between Phenomenology and Hermeneutics. As a trained scholar in literature (Modernism), I bring to bear my literary training on closely reading canonical philosophical texts of the Western tradition. Students interested in working at the intersection between literature and philosophy are encouraged to contact me. | Research Areas: modern philosophy, phenomenology and hermeneutics, literary modernism | Research Keywords: modern, literary, ai, phenomenology, modernism, dl, philosophy, hermeneutics, and"
  },
  {
    "faculty_id":18,
    "name":"Bhaskar chaudhury",
    "faculty_type":"Faculty",
    "education":"PhD (Computational Plasma Physics), IPR, Gandhinagar",
    "bio":"Bhaskar Chaudhury completed his Ph.D. at Institute for Plasma Research, India (an R & D organization under the Department of Atomic Energy). Currently he serves as a Professor at DA-IICT. Prior to joining the faculty at DA-IICT, he worked as a researcher for around six years at LAPLACE Laboratory, CNRS, Toulouse, France. He has been involved in active research in the areas of Computational Data Science, Computational Plasma Physics, High Performance Computing, and applications of Artificial Intelligence and Machine Learning. He has been the Principal Investigator for several research projects sponsored by the Department of Atomic Energy, Department of Science and Technology, Indian Space Research Organization, National Supercomputing Mission, GUJCOST, National Science Foundation, USA and NVIDIA Corporation, USA. He has authored more than 100 research papers in reputed peer reviewed journals\/ conference proceedings\/ book chapters. He has delivered various talks\/presentations worldwide and has received several international\/national awards in the area of Computational Science such as prestigious Oscar Buneman Award for the most insightful scientific visualization at 21st ICNSP, Lisbon, Portugal; Swarnajayanti Purashkar 2005 by the National Academy of Sciences, India at 75th Annual Session of NASI; Best Presentation Prize awarded by IOP, at International Workshop on Frontiers of Plasma Physics at International Center for Theoretical Physics (ICTP), Trieste, Italy, 2006. Dr. Chaudhury is a reviewer of various scientific\/engineering journals and has also Co-edited special issues in reputed Journals. He has served as a member of the technical program committee of many international conferences. He has served as an External Expert in Faculty\/Scientist Selection\/Promotion Committees, PhD progress review committees and as External PhD Thesis Examiner of various Research and Academic Institutes\/Universities.",
    "specialization_list":[
      "computational plasma physics",
      "computational data science",
      "high performance scientific meet prof. bhaskar chaudhury! computing",
      "parallel prog…"
    ],
    "research_tags":[
      "science",
      "meet",
      "computing",
      "data",
      "prog…",
      "bhaskar",
      "high",
      "parallel",
      "data science",
      "prof.",
      "scientific",
      "computational",
      "plasma",
      "machine learning",
      "artificial intelligence",
      "chaudhury!",
      "physics",
      "performance"
    ],
    "email":"bhaskar_chaudhury@dau.ac.in",
    "phone":"07968261590",
    "address":"# 2204, FB-2, DA-IICT, Gandhinagar, Gujarat, India – 382007",
    "combined_text":"Name: Bhaskar chaudhury | Role: Faculty | Education: PhD (Computational Plasma Physics), IPR, Gandhinagar | Biography: Bhaskar Chaudhury completed his Ph.D. at Institute for Plasma Research, India (an R & D organization under the Department of Atomic Energy). Currently he serves as a Professor at DA-IICT. Prior to joining the faculty at DA-IICT, he worked as a researcher for around six years at LAPLACE Laboratory, CNRS, Toulouse, France. He has been involved in active research in the areas of Computational Data Science, Computational Plasma Physics, High Performance Computing, and applications of Artificial Intelligence and Machine Learning. He has been the Principal Investigator for several research projects sponsored by the Department of Atomic Energy, Department of Science and Technology, Indian Space Research Organization, National Supercomputing Mission, GUJCOST, National Science Foundation, USA and NVIDIA Corporation, USA. He has authored more than 100 research papers in reputed peer reviewed journals\/ conference proceedings\/ book chapters. He has delivered various talks\/presentations worldwide and has received several international\/national awards in the area of Computational Science such as prestigious Oscar Buneman Award for the most insightful scientific visualization at 21st ICNSP, Lisbon, Portugal; Swarnajayanti Purashkar 2005 by the National Academy of Sciences, India at 75th Annual Session of NASI; Best Presentation Prize awarded by IOP, at International Workshop on Frontiers of Plasma Physics at International Center for Theoretical Physics (ICTP), Trieste, Italy, 2006. Dr. Chaudhury is a reviewer of various scientific\/engineering journals and has also Co-edited special issues in reputed Journals. He has served as a member of the technical program committee of many international conferences. He has served as an External Expert in Faculty\/Scientist Selection\/Promotion Committees, PhD progress review committees and as External PhD Thesis Examiner of various Research and Academic Institutes\/Universities. | Research Areas: computational plasma physics, computational data science, high performance scientific meet prof. bhaskar chaudhury! computing, parallel prog… | Research Keywords: science, meet, computing, data, prog…, bhaskar, high, parallel, data science, prof., scientific, computational, plasma, machine learning, artificial intelligence, chaudhury!, physics, performance"
  },
  {
    "faculty_id":19,
    "name":"Biswajit mishra",
    "faculty_type":"Faculty",
    "education":"PhD (Electrical & Electronics Engineering), University of Southampton, UK",
    "bio":"Not Available",
    "specialization_list":[
      "ultra low power and sub-threshold circuit methodologies",
      "very low voltage circuits for wireless sensor networks",
      "digital ic design",
      "power management for energy harvesters",
      "signal processing hardware for color image processing",
      "geometric algebra an…"
    ],
    "research_tags":[
      "management",
      "low",
      "harvesters",
      "circuits",
      "very",
      "energy",
      "methodologies",
      "power",
      "circuit",
      "color",
      "design",
      "ultra",
      "digital",
      "and",
      "geometric",
      "voltage",
      "algebra",
      "image",
      "wireless",
      "processing",
      "for",
      "an…",
      "hardware",
      "signal",
      "sensor",
      "sub-threshold",
      "networks"
    ],
    "email":"biswajit_mishra@dau.ac.in",
    "phone":"07968261561",
    "address":"# 2104, FB-2, DA-IICT, Gandhinagar, Gujarat, India – 382007",
    "combined_text":"Name: Biswajit mishra | Role: Faculty | Education: PhD (Electrical & Electronics Engineering), University of Southampton, UK | Biography: Not Available | Research Areas: ultra low power and sub-threshold circuit methodologies, very low voltage circuits for wireless sensor networks, digital ic design, power management for energy harvesters, signal processing hardware for color image processing, geometric algebra an… | Research Keywords: management, low, harvesters, circuits, very, energy, methodologies, power, circuit, color, design, ultra, digital, and, geometric, voltage, algebra, image, wireless, processing, for, an…, hardware, signal, sensor, sub-threshold, networks"
  },
  {
    "faculty_id":20,
    "name":"Gautam dutta",
    "faculty_type":"Faculty",
    "education":"PhD (Physics), Physical Research Laboratory, Ahmedabad",
    "bio":"I did particle physics, neutrino physics, to be precise for research work. Presently I explore anything that can be touched upon by the general principles of physics and mathematics. I am interested in areas of quantum mechanics, quantum computation and information and certain aspects of general relativity.",
    "specialization_list":[
      "theoretical physics"
    ],
    "research_tags":[
      "physics",
      "ai",
      "theoretical"
    ],
    "email":"gautam_dutta@dau.ac.in",
    "phone":"07968261631",
    "address":"# 1110, FB-1, DA-IICT, Gandhinagar, Gujarat, India – 382007",
    "combined_text":"Name: Gautam dutta | Role: Faculty | Education: PhD (Physics), Physical Research Laboratory, Ahmedabad | Biography: I did particle physics, neutrino physics, to be precise for research work. Presently I explore anything that can be touched upon by the general principles of physics and mathematics. I am interested in areas of quantum mechanics, quantum computation and information and certain aspects of general relativity. | Research Areas: theoretical physics | Research Keywords: physics, ai, theoretical"
  },
  {
    "faculty_id":21,
    "name":"Gopinath panda",
    "faculty_type":"Faculty",
    "education":"PhD (Mathematics), IIT Bhubaneswar",
    "bio":"I have been an assistant professor at DA-IICT since July 2022. Before my current role, I was an adjunct faculty at the College of Aeronautics , Florida Tech, USA. I continued as a collaborative researcher in the Electrical and Computer Engineering department at the University of Central Florida, USA. I have over five years of postdoctoral research & teaching experience across institutions like NISER , SUTD , UCF , and FIT . My research interests lie at the intersection of stochastic modeling and computer science, focusing on the intricacies of software-defined networks (SDN). In collaboration with researchers from the Networking and Wireless Systems Lab at UCF, I am actively engaged in advancing our understanding of SDN architectures and protocols. Additionally, I am deeply invested in exploring decision-making under uncertainty, leveraging principles from applied probability, stochastic modeling, and game theory. My research seeks to unravel the complexities of decision processes in stochastic environments. I have collaborated on research projects ranging from queueing games to modeling healthcare services, cloud computing to SDNs, and inventory to actuarial modeling, reflecting the breadth and depth of my scholarly engagement. In my academic pursuits, I rely on diverse software tools like Maple, Matlab, and Mathematica for numerical computation and Python and SPSS for statistical data analysis.",
    "specialization_list":[
      "probability and statistics"
    ],
    "research_tags":[
      "ai",
      "cloud computing",
      "probability",
      "and",
      "statistics"
    ],
    "email":"gopinath_panda@dau.ac.in",
    "phone":"07968261716",
    "address":"# 3203, FB-3, DA-IICT, Gandhinagar, Gujarat, India – 382007",
    "combined_text":"Name: Gopinath panda | Role: Faculty | Education: PhD (Mathematics), IIT Bhubaneswar | Biography: I have been an assistant professor at DA-IICT since July 2022. Before my current role, I was an adjunct faculty at the College of Aeronautics , Florida Tech, USA. I continued as a collaborative researcher in the Electrical and Computer Engineering department at the University of Central Florida, USA. I have over five years of postdoctoral research & teaching experience across institutions like NISER , SUTD , UCF , and FIT . My research interests lie at the intersection of stochastic modeling and computer science, focusing on the intricacies of software-defined networks (SDN). In collaboration with researchers from the Networking and Wireless Systems Lab at UCF, I am actively engaged in advancing our understanding of SDN architectures and protocols. Additionally, I am deeply invested in exploring decision-making under uncertainty, leveraging principles from applied probability, stochastic modeling, and game theory. My research seeks to unravel the complexities of decision processes in stochastic environments. I have collaborated on research projects ranging from queueing games to modeling healthcare services, cloud computing to SDNs, and inventory to actuarial modeling, reflecting the breadth and depth of my scholarly engagement. In my academic pursuits, I rely on diverse software tools like Maple, Matlab, and Mathematica for numerical computation and Python and SPSS for statistical data analysis. | Research Areas: probability and statistics | Research Keywords: ai, cloud computing, probability, and, statistics"
  },
  {
    "faculty_id":22,
    "name":"Hemant patil",
    "faculty_type":"Faculty",
    "education":"PhD (Computer Science), IIT Kharagpur",
    "bio":"Hemant A. Patil received Ph.D. degree from the Indian Institute of Technology (IIT), Kharagpur, India, in July 2006. Since 2007, he has been a faculty member at DA-IICT Gandhinagar, India and developed Speech Research Lab at DA-IICT, which is recognized as ISCA speech labs. Dr. Patil is member of IEEE, IEEE Signal Processing Society, IEEE Circuits and Systems Society, International Speech Communication Association (ISCA), EURASIP and an affiliate member of IEEE SLTC. He is regular reviewer for ICASSP and INTERSPEECH, Speech Communication, Elsevier, Computer Speech and Language, Elsevier and Int. J. Speech Tech, Springer, Circuits, Systems and Signal Processing, Springer. He has published around 226 research publications in national and international conferences\/journals\/book chapters. He visited department of ECE, University of Minnesota, Minneapolis, USA (May-July, 2009) as short term scholar. He has been associated (as PI) with three MeitY sponsored projects in ASR, TTS and QbE-STD. He was co-PI for DST sponsored project on India-Digital Heritage (IDH)-Hampi. His research interests include speech and speaker recognition, TTS, infant cry analysis. He has received DST Fast Track Award for Young Scientists for infant cry analysis. He has coedited a book on Forensic Speaker Recognition with Dr. Amy Neustein (EIC, IJST Springer). Presently, he is coediting two books in speech technology for medical-domain. Dr. Patil has taken a lead role in organizing several ISCA supported events, such as summer\/winter schools\/CEP workshops (such as speaker and language recognition, speech source modeling, text-to-speech synthesis, speech production-perception link, advances in speech processing) and progress review meetings for two MeitY consortia project all at DA-IICT Gandhingagar. Dr. Patil has supervised 04 doctoral (including doctoral thesis supervision in spoofing attacks) and 42 M.Tech. theses. Presently, he is supervising 03 doctoral students. Recently, he offered a joint tutorial with Prof. Haizhou Li during Asia Pacific Signal and Information Processing Association Annual Summit and Conference (APSIPA ASC) 2017 and also during INTERSPEECH 2018. He will be offfering joint tutorial with Prof. H. Kawahar during APSIPA ASC 2018, Honolulu, USA, Nov. 12-15, 2018. He has been selected as APSIPA Distinguished Lecturer (DL) for 2018-2019. He has delivered 11 APSIPA DLs in three countries, India, China and Canada.",
    "specialization_list":[
      "speech signal processing",
      "speech and speaker recognition (voice biometrics)",
      "development of countermeasures for spoofing attacks on automatic speaker verification",
      "voice conversion"
    ],
    "research_tags":[
      "conversion",
      "(voice",
      "verification",
      "automatic",
      "attacks",
      "and",
      "countermeasures",
      "development",
      "voice",
      "signal processing",
      "processing",
      "for",
      "speaker",
      "speech",
      "signal",
      "ai",
      "recognition",
      "dl",
      "spoofing",
      "biometrics)"
    ],
    "email":"hemant_patil@dau.ac.in,hemant_patil1977@yahoo.com",
    "phone":"0796826165007968261587",
    "address":"Office: # 4103, FB-4, DA-IICT, Gandhinagar, Gujarat, India – 382007. Lab: CEP 006, Speech Lb, DA-IICT, Gandhinagar, Gujarat, India – 382007",
    "combined_text":"Name: Hemant patil | Role: Faculty | Education: PhD (Computer Science), IIT Kharagpur | Biography: Hemant A. Patil received Ph.D. degree from the Indian Institute of Technology (IIT), Kharagpur, India, in July 2006. Since 2007, he has been a faculty member at DA-IICT Gandhinagar, India and developed Speech Research Lab at DA-IICT, which is recognized as ISCA speech labs. Dr. Patil is member of IEEE, IEEE Signal Processing Society, IEEE Circuits and Systems Society, International Speech Communication Association (ISCA), EURASIP and an affiliate member of IEEE SLTC. He is regular reviewer for ICASSP and INTERSPEECH, Speech Communication, Elsevier, Computer Speech and Language, Elsevier and Int. J. Speech Tech, Springer, Circuits, Systems and Signal Processing, Springer. He has published around 226 research publications in national and international conferences\/journals\/book chapters. He visited department of ECE, University of Minnesota, Minneapolis, USA (May-July, 2009) as short term scholar. He has been associated (as PI) with three MeitY sponsored projects in ASR, TTS and QbE-STD. He was co-PI for DST sponsored project on India-Digital Heritage (IDH)-Hampi. His research interests include speech and speaker recognition, TTS, infant cry analysis. He has received DST Fast Track Award for Young Scientists for infant cry analysis. He has coedited a book on Forensic Speaker Recognition with Dr. Amy Neustein (EIC, IJST Springer). Presently, he is coediting two books in speech technology for medical-domain. Dr. Patil has taken a lead role in organizing several ISCA supported events, such as summer\/winter schools\/CEP workshops (such as speaker and language recognition, speech source modeling, text-to-speech synthesis, speech production-perception link, advances in speech processing) and progress review meetings for two MeitY consortia project all at DA-IICT Gandhingagar. Dr. Patil has supervised 04 doctoral (including doctoral thesis supervision in spoofing attacks) and 42 M.Tech. theses. Presently, he is supervising 03 doctoral students. Recently, he offered a joint tutorial with Prof. Haizhou Li during Asia Pacific Signal and Information Processing Association Annual Summit and Conference (APSIPA ASC) 2017 and also during INTERSPEECH 2018. He will be offfering joint tutorial with Prof. H. Kawahar during APSIPA ASC 2018, Honolulu, USA, Nov. 12-15, 2018. He has been selected as APSIPA Distinguished Lecturer (DL) for 2018-2019. He has delivered 11 APSIPA DLs in three countries, India, China and Canada. | Research Areas: speech signal processing, speech and speaker recognition (voice biometrics), development of countermeasures for spoofing attacks on automatic speaker verification, voice conversion | Research Keywords: conversion, (voice, verification, automatic, attacks, and, countermeasures, development, voice, signal processing, processing, for, speaker, speech, signal, ai, recognition, dl, spoofing, biometrics)"
  },
  {
    "faculty_id":23,
    "name":"Jenson joseph",
    "faculty_type":"Faculty",
    "education":"PhD (Communication), University of Hyderabad, Hyderabad",
    "bio":"My research work probes the links between media practices and the political-cultural forms they engender under historical conditions. For my PhD project, I studied a range of commercial-aesthetic practices of cinema in Kerala between the late 1940s and the mid 1960s, by examining their relationship to the political imaginaries that they gave expressions to. My current research attempts to make contributions to the studies on contemporary transformations in media cultures across the globe, especially with the peaking of digital media cultures, by generating cultural histories of the shifts in practices of media forms in india post 1990s. Media Theory, Cultural Studies, and Film Studies are my main areas of interest. I have taught courses in Media Research Methods, Introduction to Cinema, History of Media, Media Laws and Ethics, Writing for Print Media and Communication Theories.",
    "specialization_list":[
      "history and theory of media",
      "film studies",
      "cultural studies",
      "malayalam cinema",
      "popular culture"
    ],
    "research_tags":[
      "cinema",
      "ai",
      "malayalam",
      "film",
      "theory",
      "culture",
      "history",
      "popular",
      "media",
      "and",
      "cultural",
      "studies"
    ],
    "email":"jenson_joseph@dau.ac.in",
    "phone":"07968261536",
    "address":"# 3205, FB-3, DA-IICT, Gandhinagar, Gujarat, India – 382007",
    "combined_text":"Name: Jenson joseph | Role: Faculty | Education: PhD (Communication), University of Hyderabad, Hyderabad | Biography: My research work probes the links between media practices and the political-cultural forms they engender under historical conditions. For my PhD project, I studied a range of commercial-aesthetic practices of cinema in Kerala between the late 1940s and the mid 1960s, by examining their relationship to the political imaginaries that they gave expressions to. My current research attempts to make contributions to the studies on contemporary transformations in media cultures across the globe, especially with the peaking of digital media cultures, by generating cultural histories of the shifts in practices of media forms in india post 1990s. Media Theory, Cultural Studies, and Film Studies are my main areas of interest. I have taught courses in Media Research Methods, Introduction to Cinema, History of Media, Media Laws and Ethics, Writing for Print Media and Communication Theories. | Research Areas: history and theory of media, film studies, cultural studies, malayalam cinema, popular culture | Research Keywords: cinema, ai, malayalam, film, theory, culture, history, popular, media, and, cultural, studies"
  },
  {
    "faculty_id":24,
    "name":"Madhu kant sharma",
    "faculty_type":"Faculty",
    "education":"PhD (Mathematics), IIT Madras",
    "bio":"Dr. Madhu Kant Sharma received his M.Sc. (Mathematics) degree (2008-2010) from the Indian Institute of Technology Kanpur and his Ph.D. degree in Mathematics (2011-2015) from the Indian Institute of Technology Madras. He has held academic positions as an Assistant Professor at the Mahindra Ecole Centrale Hyderabad (Aug. 2015 – Jul. 2018) and at the Indian Institute of Information Technology Dharwad (Aug. 2018 – May 2020). From June 2020 to April 2025, he was an Assistant Professor at the Dhirubhai Ambani Institute of Information and Communication Technology (DA-IICT) in Gandhinagar. Since May 2025, he has been serving as an Associate Professor at DA-IICT. His current research interests include the analytical and numerical study of Fractional Differential Equations (FDEs), Applications of FDEs, Optimization Techniques, and Signal Processing.",
    "specialization_list":[
      "fractional differential equations (fdes)",
      "optimization",
      "numerical methods for fdes",
      "signal processing"
    ],
    "research_tags":[
      "differential",
      "signal processing",
      "signal",
      "ai",
      "(fdes)",
      "optimization",
      "equations",
      "methods",
      "numerical",
      "processing",
      "for",
      "fractional",
      "fdes"
    ],
    "email":"madhukant_sharma@dau.ac.in",
    "phone":"07968261554",
    "address":"# 1109, FB-1 , DA-IICT, Gandhinagar, Gujarat, India – 382007",
    "combined_text":"Name: Madhu kant sharma | Role: Faculty | Education: PhD (Mathematics), IIT Madras | Biography: Dr. Madhu Kant Sharma received his M.Sc. (Mathematics) degree (2008-2010) from the Indian Institute of Technology Kanpur and his Ph.D. degree in Mathematics (2011-2015) from the Indian Institute of Technology Madras. He has held academic positions as an Assistant Professor at the Mahindra Ecole Centrale Hyderabad (Aug. 2015 – Jul. 2018) and at the Indian Institute of Information Technology Dharwad (Aug. 2018 – May 2020). From June 2020 to April 2025, he was an Assistant Professor at the Dhirubhai Ambani Institute of Information and Communication Technology (DA-IICT) in Gandhinagar. Since May 2025, he has been serving as an Associate Professor at DA-IICT. His current research interests include the analytical and numerical study of Fractional Differential Equations (FDEs), Applications of FDEs, Optimization Techniques, and Signal Processing. | Research Areas: fractional differential equations (fdes), optimization, numerical methods for fdes, signal processing | Research Keywords: differential, signal processing, signal, ai, (fdes), optimization, equations, methods, numerical, processing, for, fractional, fdes"
  },
  {
    "faculty_id":25,
    "name":"Madhumita mazumdar",
    "faculty_type":"Faculty",
    "education":"PhD (Modern History), University of Calcutta, Calcutta",
    "bio":"Prof. Madhumita Mazumdar is a senior faculty in the Humanities and Social Sciences. She teaches courses in the BTech, MDes ( CD) and PhD programmes. Prof. Mazumdar holds a doctorate in History from the University of Calcutta. Her research interests are in social and cultural histories of Science, Technology and Design. She also does collaborative research with Prof. Vishvajit Pandya in colonial and post- colonial histories of the Andaman Islands. She is co- author of the book titled, \"New Histories of the Andaman Islands: Place, Space and Identity in the Bay of Bengal, 1790-2012\" published in 2016 by the Cambridge University Press, UK 2016 https:\/\/doi.org\/10.1017\/CBO9781139924641 Currently she has a book contract with Bloomsbury Press, UK to work on the early career of design pedagogy and progressive education at the National Institute of Design, India. She has published several articles and chapters in peer- reviewed journals and books and has participated in numerous national and international conferences.",
    "specialization_list":[
      "social and cultural history science",
      "technology and design",
      "history of modernity and developmental practice in colonial and post-colonial india",
      "economic and social history of gujarat"
    ],
    "research_tags":[
      "social",
      "science",
      "practice",
      "developmental",
      "india",
      "gujarat",
      "design",
      "economic",
      "technology",
      "history",
      "colonial",
      "post-colonial",
      "and",
      "modernity",
      "cultural"
    ],
    "email":"madhumita_mazumdar@dau.ac.in",
    "phone":"07968261562",
    "address":"# 2111, FB-2, DA-IICT, Gandhinagar, Gujarat, India – 382007",
    "combined_text":"Name: Madhumita mazumdar | Role: Faculty | Education: PhD (Modern History), University of Calcutta, Calcutta | Biography: Prof. Madhumita Mazumdar is a senior faculty in the Humanities and Social Sciences. She teaches courses in the BTech, MDes ( CD) and PhD programmes. Prof. Mazumdar holds a doctorate in History from the University of Calcutta. Her research interests are in social and cultural histories of Science, Technology and Design. She also does collaborative research with Prof. Vishvajit Pandya in colonial and post- colonial histories of the Andaman Islands. She is co- author of the book titled, \"New Histories of the Andaman Islands: Place, Space and Identity in the Bay of Bengal, 1790-2012\" published in 2016 by the Cambridge University Press, UK 2016 https:\/\/doi.org\/10.1017\/CBO9781139924641 Currently she has a book contract with Bloomsbury Press, UK to work on the early career of design pedagogy and progressive education at the National Institute of Design, India. She has published several articles and chapters in peer- reviewed journals and books and has participated in numerous national and international conferences. | Research Areas: social and cultural history science, technology and design, history of modernity and developmental practice in colonial and post-colonial india, economic and social history of gujarat | Research Keywords: social, science, practice, developmental, india, gujarat, design, economic, technology, history, colonial, post-colonial, and, modernity, cultural"
  },
  {
    "faculty_id":26,
    "name":"Maniklal das",
    "faculty_type":"Faculty",
    "education":"PhD (Computer Science), IIT Bombay",
    "bio":"Maniklal Das is Professor of Computer Science at Dhirubhai Ambani Institute of Information and Communication Technology (DA-IICT), Gandhinagar, India. Prior to joining DA-IICT in 2006, he worked with Institute for Development and Research in Banking Technology (IDRBT), Hyderabad, India. He has over 22 years of research and teaching experience in Information Security and Information Technology. His research works broadly cover all areas of Cyber Security and IT security management. He has served as a member of the technical program committee for many international conferences, and he is a regular reviewer of IEEE\/ACM\/Springer\/Elsevier journals. He is currently on Editorial Board of IEEE Transactions on Dependable and Secure Computing. During his professional service, he has served as investigator of many sponsored research projects with national and international collaborators in the area of Security and Privacy. Dr. Das received his Ph.D. degree from Indian Institute of Technology, Bombay and M.Tech. degree from Indian School of Mines, Dhanbad, India. He is a senior member of the IEEE and Life member of Cryptology Research Society of India.",
    "specialization_list":[
      "cyber security",
      "privacy",
      "cryptography",
      "algorithms"
    ],
    "research_tags":[
      "algorithms",
      "cyber",
      "ai",
      "security",
      "cyber security",
      "privacy",
      "dl",
      "cryptography"
    ],
    "email":"maniklal_das@dau.ac.in",
    "phone":"079682616179107968261710",
    "address":"# 2103, FB-2, DA-IICT, Gandhinagar, Gujarat, India – 382007",
    "combined_text":"Name: Maniklal das | Role: Faculty | Education: PhD (Computer Science), IIT Bombay | Biography: Maniklal Das is Professor of Computer Science at Dhirubhai Ambani Institute of Information and Communication Technology (DA-IICT), Gandhinagar, India. Prior to joining DA-IICT in 2006, he worked with Institute for Development and Research in Banking Technology (IDRBT), Hyderabad, India. He has over 22 years of research and teaching experience in Information Security and Information Technology. His research works broadly cover all areas of Cyber Security and IT security management. He has served as a member of the technical program committee for many international conferences, and he is a regular reviewer of IEEE\/ACM\/Springer\/Elsevier journals. He is currently on Editorial Board of IEEE Transactions on Dependable and Secure Computing. During his professional service, he has served as investigator of many sponsored research projects with national and international collaborators in the area of Security and Privacy. Dr. Das received his Ph.D. degree from Indian Institute of Technology, Bombay and M.Tech. degree from Indian School of Mines, Dhanbad, India. He is a senior member of the IEEE and Life member of Cryptology Research Society of India. | Research Areas: cyber security, privacy, cryptography, algorithms | Research Keywords: algorithms, cyber, ai, security, cyber security, privacy, dl, cryptography"
  },
  {
    "faculty_id":27,
    "name":"Manish chaturvedi",
    "faculty_type":"Faculty",
    "education":"PhD (ICT), DA-IICT, Gandhinagar",
    "bio":"I have joined Dhirubhai Ambani University (DA-IICT), Gandhinagar as an Assistant Professor in May 2025. Previously, I worked at Institute of Infrastructure Technology Research And Management (IITRAM), Pandit Deendayal Petroleum University, and Nirma University. I did M.Tech. (ICT) and Ph.D. (ICT) from Dhirubhai Ambani Institute of ICT (DA-IICT) in year 2009 and 2016, respectively. My Research interests include the design of Intelligent Transportation Systems, Embedded Systems and IoT, Scalable protocol design for large distributed systems, and the ICT system design in general. I am also interested in studying distributed data structures, peer to peer content sharing, and the use cases of Blockchain framework. Please refer https:\/\/sites.google.com\/site\/manishacademics\/research for more information about my research.",
    "specialization_list":[
      "design of intelligent transportation systems",
      "communication protocol design",
      "embedded systems and internet of things"
    ],
    "research_tags":[
      "systems",
      "communication",
      "ai",
      "things",
      "design",
      "iot",
      "transportation",
      "blockchain",
      "internet",
      "embedded",
      "protocol",
      "and",
      "intelligent"
    ],
    "email":"Not Available",
    "phone":"07968261645",
    "address":"# 1111, FB-1, DA-IICT, Gandhinagar, Gujarat, India – 382007",
    "combined_text":"Name: Manish chaturvedi | Role: Faculty | Education: PhD (ICT), DA-IICT, Gandhinagar | Biography: I have joined Dhirubhai Ambani University (DA-IICT), Gandhinagar as an Assistant Professor in May 2025. Previously, I worked at Institute of Infrastructure Technology Research And Management (IITRAM), Pandit Deendayal Petroleum University, and Nirma University. I did M.Tech. (ICT) and Ph.D. (ICT) from Dhirubhai Ambani Institute of ICT (DA-IICT) in year 2009 and 2016, respectively. My Research interests include the design of Intelligent Transportation Systems, Embedded Systems and IoT, Scalable protocol design for large distributed systems, and the ICT system design in general. I am also interested in studying distributed data structures, peer to peer content sharing, and the use cases of Blockchain framework. Please refer https:\/\/sites.google.com\/site\/manishacademics\/research for more information about my research. | Research Areas: design of intelligent transportation systems, communication protocol design, embedded systems and internet of things | Research Keywords: systems, communication, ai, things, design, iot, transportation, blockchain, internet, embedded, protocol, and, intelligent"
  },
  {
    "faculty_id":28,
    "name":"Manish kumar",
    "faculty_type":"Faculty",
    "education":"PhD (Electrical Engineering), IIT Patna",
    "bio":"Currently, I am an Associate Professor at Dhirubhai Ambani University (Formerly DA-IICT). Before joining here, I worked as a Lead Engineer in the 5G System Engineering Research & Development Team at Radisys, a wholly-owned subsidiary of Reliance Jio Platforms. I worked towards the proposal and development of algorithms for the downlink and uplink of 5G wireless cellular systems, and validating their feasibility with respect to the 3GPP technical specifications. Prior to this, I worked as a Researcher at Ben-Gurion University, Israel, where I worked on research assignments of Heron 5G consortium and Israel Science Foundation. I received my PhD in Electrical Engineering with specialization in wireless communications from Indian Institute of Technology, Patna, India. I worked towards blind parameter estimation, synchronization of wireless communication systems, and implementation of a practical testbed for a blind wireless transceiver system.",
    "specialization_list":[
      "algorithm development and performance optimization in uav networks",
      "sensor & ad-hoc networks; applications of ai\/ml",
      "blockchain in networks; internet of things; next generation wireless networks: 5g\/6g"
    ],
    "research_tags":[
      "networks:",
      "networks;",
      "applications",
      "internet",
      "blockchain",
      "next",
      "things;",
      "ai\/ml",
      "generation",
      "and",
      "development",
      "optimization",
      "ad-hoc",
      "wireless",
      "performance",
      "uav",
      "ai",
      "sensor",
      "networks",
      "5g\/6g",
      "algorithm"
    ],
    "email":"manish_kumar@dau.ac.in",
    "phone":"07968261678",
    "address":"# 3102, FB-3, DA-IICT, Gandhinagar, Gujarat, India – 382007",
    "combined_text":"Name: Manish kumar | Role: Faculty | Education: PhD (Electrical Engineering), IIT Patna | Biography: Currently, I am an Associate Professor at Dhirubhai Ambani University (Formerly DA-IICT). Before joining here, I worked as a Lead Engineer in the 5G System Engineering Research & Development Team at Radisys, a wholly-owned subsidiary of Reliance Jio Platforms. I worked towards the proposal and development of algorithms for the downlink and uplink of 5G wireless cellular systems, and validating their feasibility with respect to the 3GPP technical specifications. Prior to this, I worked as a Researcher at Ben-Gurion University, Israel, where I worked on research assignments of Heron 5G consortium and Israel Science Foundation. I received my PhD in Electrical Engineering with specialization in wireless communications from Indian Institute of Technology, Patna, India. I worked towards blind parameter estimation, synchronization of wireless communication systems, and implementation of a practical testbed for a blind wireless transceiver system. | Research Areas: algorithm development and performance optimization in uav networks, sensor & ad-hoc networks; applications of ai\/ml, blockchain in networks; internet of things; next generation wireless networks: 5g\/6g | Research Keywords: networks:, networks;, applications, internet, blockchain, next, things;, ai\/ml, generation, and, development, optimization, ad-hoc, wireless, performance, uav, ai, sensor, networks, 5g\/6g, algorithm"
  },
  {
    "faculty_id":29,
    "name":"Manjunath v. joshi",
    "faculty_type":"Faculty",
    "education":"PhD (Electrical Engineering), IIT Bombay",
    "bio":"Manjunath V. Joshi received the B.E. degree from the University of Mysore, Mysore, India, and the M.Tech. and Ph.D. degrees from the Indian Institute of Technology Bombay (IIT Bombay), Mumbai, India. Currently, he is serving as a Professor with the Dhirubhai Ambani Institute of Information and Communication Technology, Gandhinagar, India. He has been involved in active research in the areas of signal and Image Processing, Computer Vision, and Machine Learning and has several publications in quality journals and conferences. He has co-authored four books entitled Motion-Free Super Resolution (Springer, New York-2005), Digital Heritage Reconstruction using Super-resolution and Inpainting (Morgan and Claypool-2016), Regularization in Hyperspectral Unmixing (SPIE Press-2016) and the book entitled Multi-resolution Image Fusion in Remote Sensing (Cambridge University Press, UK-2019). So far nine PhD students have been graduated under his supervision. Dr. Joshi was a recipient of the Outstanding Researcher Award in Engineering Section by the Research Scholars Forum of IIT Bombay in 2005. He was also a recipient of the Best Ph.D. Thesis Award by Infineon India and the Dr. Vikram Sarabhai Award for the year 2006-2007 in the field of information technology constituted by the Government of Gujarat, India. He served as a Program Co-Chair for the 3rd ACCV Workshop on E-Heritage, 2014 held at Singapore. He was honoured with a plaque of appreciation on achieving excellence in teaching and research at DA-IICT on the occasion of Teacher’s Day 5th September 2015. Dr. Joshi has successfully conducted two Continuing Education Programs (CEPs) for scientists of ISRO, Ahmedabad during August 2012 and March 2016, respectively. He has also served as Visiting Professor at Gandhinar and IIIT Vadodara. He has visited Germany, Italy, France, Hong Kong, USA, Canada, South Korea, Indonesia and contributed to research in his area of expertise. For more information visit: http:\/\/intranet.daiict.ac.in\/~mv_joshi\/",
    "specialization_list":[
      "signal and image processing",
      "digital communication",
      "computer vision",
      "machine learning"
    ],
    "research_tags":[
      "vision",
      "communication",
      "signal",
      "ai",
      "computer",
      "machine",
      "machine learning",
      "image",
      "processing",
      "learning",
      "digital",
      "and",
      "computer vision"
    ],
    "email":"mv_joshi@dau.ac.in",
    "phone":"07968261611",
    "address":"# 1203, FB-1, DA-IICT, Gandhinagar, Gujarat, India – 382007",
    "combined_text":"Name: Manjunath v. joshi | Role: Faculty | Education: PhD (Electrical Engineering), IIT Bombay | Biography: Manjunath V. Joshi received the B.E. degree from the University of Mysore, Mysore, India, and the M.Tech. and Ph.D. degrees from the Indian Institute of Technology Bombay (IIT Bombay), Mumbai, India. Currently, he is serving as a Professor with the Dhirubhai Ambani Institute of Information and Communication Technology, Gandhinagar, India. He has been involved in active research in the areas of signal and Image Processing, Computer Vision, and Machine Learning and has several publications in quality journals and conferences. He has co-authored four books entitled Motion-Free Super Resolution (Springer, New York-2005), Digital Heritage Reconstruction using Super-resolution and Inpainting (Morgan and Claypool-2016), Regularization in Hyperspectral Unmixing (SPIE Press-2016) and the book entitled Multi-resolution Image Fusion in Remote Sensing (Cambridge University Press, UK-2019). So far nine PhD students have been graduated under his supervision. Dr. Joshi was a recipient of the Outstanding Researcher Award in Engineering Section by the Research Scholars Forum of IIT Bombay in 2005. He was also a recipient of the Best Ph.D. Thesis Award by Infineon India and the Dr. Vikram Sarabhai Award for the year 2006-2007 in the field of information technology constituted by the Government of Gujarat, India. He served as a Program Co-Chair for the 3rd ACCV Workshop on E-Heritage, 2014 held at Singapore. He was honoured with a plaque of appreciation on achieving excellence in teaching and research at DA-IICT on the occasion of Teacher’s Day 5th September 2015. Dr. Joshi has successfully conducted two Continuing Education Programs (CEPs) for scientists of ISRO, Ahmedabad during August 2012 and March 2016, respectively. He has also served as Visiting Professor at Gandhinar and IIIT Vadodara. He has visited Germany, Italy, France, Hong Kong, USA, Canada, South Korea, Indonesia and contributed to research in his area of expertise. For more information visit: http:\/\/intranet.daiict.ac.in\/~mv_joshi\/ | Research Areas: signal and image processing, digital communication, computer vision, machine learning | Research Keywords: vision, communication, signal, ai, computer, machine, machine learning, image, processing, learning, digital, and, computer vision"
  },
  {
    "faculty_id":30,
    "name":"Manoj raut",
    "faculty_type":"Faculty",
    "education":"PhD (Mathematics), IIT Madras",
    "bio":"Not Available",
    "specialization_list":[
      "mathematical logic"
    ],
    "research_tags":[
      "logic",
      "mathematical"
    ],
    "email":"manoj_raut@dau.ac.in",
    "phone":"07968261585",
    "address":"# 4112, FB-4, DA-IICT, Gandhinagar, Gujarat, India – 382007",
    "combined_text":"Name: Manoj raut | Role: Faculty | Education: PhD (Mathematics), IIT Madras | Biography: Not Available | Research Areas: mathematical logic | Research Keywords: logic, mathematical"
  },
  {
    "faculty_id":31,
    "name":"Minal bhise",
    "faculty_type":"Faculty",
    "education":"PhD (Computer Science), BITS Pilani",
    "bio":"Not Available",
    "specialization_list":[
      "distributed databases - query processing",
      "application development for biodiversity domain",
      "software system analysis and design"
    ],
    "research_tags":[
      "software",
      "biodiversity",
      "design",
      "application",
      "system",
      "databases",
      "analysis",
      "query",
      "processing",
      "for",
      "domain",
      "distributed",
      "and",
      "development"
    ],
    "email":"minal_bhise@dau.ac.in",
    "phone":"07968261548",
    "address":"# 1209, FB-1, DA-IICT, Gandhinagar, Gujarat, India – 382007",
    "combined_text":"Name: Minal bhise | Role: Faculty | Education: PhD (Computer Science), BITS Pilani | Biography: Not Available | Research Areas: distributed databases - query processing, application development for biodiversity domain, software system analysis and design | Research Keywords: software, biodiversity, design, application, system, databases, analysis, query, processing, for, domain, distributed, and, development"
  },
  {
    "faculty_id":32,
    "name":"Mukesh tiwari",
    "faculty_type":"Faculty",
    "education":"PhD (Optical Science & Engineering), University of New Mexico, USA",
    "bio":"Mukesh Tiwari is currently working as an Associate Professor at DA-IICT. He joined the institute in 2009. Before this, he completed his M.Sc. in Physics from the Indian Institute of Technology, Delhi, and PhD from the University of New Mexico, working with Nitant Kenkre. His primary research interest is in complex networks, nonequilibrium statistical mechanics, and nonlinear dynamics. His current research directions focus on interdisciplinary sciences. He uses models and techniques originating in physics to understand phenomena and processes in social systems and complex time series arising in finance and physiology. His research also involves studying the properties of highly nonlinear waves in granular systems and transport phenomena in quantum and classical systems.",
    "specialization_list":[
      "nonequilibrium statistical mechanics and nonlinear dynamics"
    ],
    "research_tags":[
      "nonlinear",
      "nonequilibrium",
      "dynamics",
      "statistical",
      "mechanics",
      "and"
    ],
    "email":"mukesh_tiwari@dau.ac.in",
    "phone":"07968261614",
    "address":"# 1112, FB-1, DA-IICT, Gandhinagar, Gujarat, India – 382007",
    "combined_text":"Name: Mukesh tiwari | Role: Faculty | Education: PhD (Optical Science & Engineering), University of New Mexico, USA | Biography: Mukesh Tiwari is currently working as an Associate Professor at DA-IICT. He joined the institute in 2009. Before this, he completed his M.Sc. in Physics from the Indian Institute of Technology, Delhi, and PhD from the University of New Mexico, working with Nitant Kenkre. His primary research interest is in complex networks, nonequilibrium statistical mechanics, and nonlinear dynamics. His current research directions focus on interdisciplinary sciences. He uses models and techniques originating in physics to understand phenomena and processes in social systems and complex time series arising in finance and physiology. His research also involves studying the properties of highly nonlinear waves in granular systems and transport phenomena in quantum and classical systems. | Research Areas: nonequilibrium statistical mechanics and nonlinear dynamics | Research Keywords: nonlinear, nonequilibrium, dynamics, statistical, mechanics, and"
  },
  {
    "faculty_id":33,
    "name":"Nabin kumar sahu",
    "faculty_type":"Faculty",
    "education":"PhD (Mathematics), IIT Kharagpur",
    "bio":"As a person from Pure Mathematics group, I work in the Theory of Optimization and the Theory of Frames. The theory of frames is largely applied in Signal Processing and Image processing. Optimization also plays a significant role in Machine learning and Data analysis. So although I belong to Pure Mathematics group, I extend my research area towards applications.",
    "specialization_list":[
      "frame theory",
      "optimization theory and applications",
      "variational inequalities"
    ],
    "research_tags":[
      "signal processing",
      "frame",
      "optimization",
      "machine learning",
      "inequalities",
      "variational",
      "applications",
      "and",
      "theory"
    ],
    "email":"nabinkumar_sahu@dau.ac.in",
    "phone":"07968261642",
    "address":"# 4212, FB-4, DA-IICT, Gandhinagar, Gujarat, India – 382007",
    "combined_text":"Name: Nabin kumar sahu | Role: Faculty | Education: PhD (Mathematics), IIT Kharagpur | Biography: As a person from Pure Mathematics group, I work in the Theory of Optimization and the Theory of Frames. The theory of frames is largely applied in Signal Processing and Image processing. Optimization also plays a significant role in Machine learning and Data analysis. So although I belong to Pure Mathematics group, I extend my research area towards applications. | Research Areas: frame theory, optimization theory and applications, variational inequalities | Research Keywords: signal processing, frame, optimization, machine learning, inequalities, variational, applications, and, theory"
  },
  {
    "faculty_id":34,
    "name":"P m jat",
    "faculty_type":"Faculty",
    "education":"PhD (Computer Science and Engineering), ML Sukhadia University, Udaipur",
    "bio":"Not Available",
    "specialization_list":[
      "databases"
    ],
    "research_tags":[
      "databases"
    ],
    "email":"pm_jat@dau.ac.in",
    "phone":"07968261641",
    "address":"# 2203, FB-2, DA-IICT, Gandhinagar, Gujarat, India – 382007",
    "combined_text":"Name: P m jat | Role: Faculty | Education: PhD (Computer Science and Engineering), ML Sukhadia University, Udaipur | Biography: Not Available | Research Areas: databases | Research Keywords: databases"
  },
  {
    "faculty_id":35,
    "name":"P s kalyan sasidhar",
    "faculty_type":"Faculty",
    "education":"PhD (Computer Science and Engineering), University of North Texas-Denton, USA",
    "bio":"Kalyan Sasidhar is currently an Associate Professor. Prior to this, he worked as assistant professor in the Wireless Networks and Applications group at Amrita Vishwa Vidhyapeetham (Amrita University, Kerala). He was a postdoctoral researcher at Nanyang Technological University after completing his PhD in Computer Science from University of North Texas in 2011. He has 25 plus publications in top journals and international conferences with citations of over 650 and hIndex of 11.",
    "specialization_list":[
      "meet dr. kalyan sasidhar : pioneering mobile computing and network sensing mobile and pervasive computing which include wireless sensor networks",
      "mo…"
    ],
    "research_tags":[
      "include",
      "computing",
      "meet",
      "pioneering",
      "wireless networks",
      "mo…",
      "mobile",
      "sensor",
      "which",
      "sasidhar",
      "wireless",
      "network",
      "networks",
      "sensing",
      "pervasive",
      "and",
      "kalyan",
      "dr."
    ],
    "email":"kalyan_sasidhar@dau.ac.in",
    "phone":"07968261560",
    "address":"# 2109, FB-2, DA-IICT, Gandhinagar, Gujarat, India – 382007",
    "combined_text":"Name: P s kalyan sasidhar | Role: Faculty | Education: PhD (Computer Science and Engineering), University of North Texas-Denton, USA | Biography: Kalyan Sasidhar is currently an Associate Professor. Prior to this, he worked as assistant professor in the Wireless Networks and Applications group at Amrita Vishwa Vidhyapeetham (Amrita University, Kerala). He was a postdoctoral researcher at Nanyang Technological University after completing his PhD in Computer Science from University of North Texas in 2011. He has 25 plus publications in top journals and international conferences with citations of over 650 and hIndex of 11. | Research Areas: meet dr. kalyan sasidhar : pioneering mobile computing and network sensing mobile and pervasive computing which include wireless sensor networks, mo… | Research Keywords: include, computing, meet, pioneering, wireless networks, mo…, mobile, sensor, which, sasidhar, wireless, network, networks, sensing, pervasive, and, kalyan, dr."
  },
  {
    "faculty_id":36,
    "name":"Pankaj kumar",
    "faculty_type":"Faculty",
    "education":"PhD (RF & Microwave), NIT Patna",
    "bio":"Pankaj Kumar received the B.Tech. degree in Electronics and Communication Engineering from Ujjain Engineering College, Ujjain, India in 2011; his M.Tech degree from PDPM Indian Institute of Information Technology Design and Manufacturing, Jabalpur, India in 2014; his Ph.D. from National Institute of Technology Patna, Bihar, India in 2021 under the supervision of Prof. P. K. Jain (IIT BHU) and Prof. Akhlesh Lakhtakia (The Pennsylvania State University, USA). He has worked at NIT Patna as Assistant Professor almost for five years.",
    "specialization_list":[
      "bio-inspired metasurface\/metamaterial devices",
      "terahertz devices",
      "semiconductor device modeling and simulation",
      "emerging devices",
      "jlt",
      "ofet",
      "tfet",
      "fin-fet",
      "vlsi design."
    ],
    "research_tags":[
      "vlsi",
      "emerging",
      "devices",
      "modeling",
      "semiconductor",
      "terahertz",
      "ai",
      "fin-fet",
      "ofet",
      "simulation",
      "device",
      "tfet",
      "bio-inspired",
      "and",
      "metasurface\/metamaterial",
      "jlt",
      "design."
    ],
    "email":"pankaj_kumar@dau.ac.in",
    "phone":"07968261705",
    "address":"# 3201, FB-3, DA-IICT, Gandhinagar, Gujarat, India – 382007",
    "combined_text":"Name: Pankaj kumar | Role: Faculty | Education: PhD (RF & Microwave), NIT Patna | Biography: Pankaj Kumar received the B.Tech. degree in Electronics and Communication Engineering from Ujjain Engineering College, Ujjain, India in 2011; his M.Tech degree from PDPM Indian Institute of Information Technology Design and Manufacturing, Jabalpur, India in 2014; his Ph.D. from National Institute of Technology Patna, Bihar, India in 2021 under the supervision of Prof. P. K. Jain (IIT BHU) and Prof. Akhlesh Lakhtakia (The Pennsylvania State University, USA). He has worked at NIT Patna as Assistant Professor almost for five years. | Research Areas: bio-inspired metasurface\/metamaterial devices, terahertz devices, semiconductor device modeling and simulation, emerging devices, jlt, ofet, tfet, fin-fet, vlsi design. | Research Keywords: vlsi, emerging, devices, modeling, semiconductor, terahertz, ai, fin-fet, ofet, simulation, device, tfet, bio-inspired, and, metasurface\/metamaterial, jlt, design."
  },
  {
    "faculty_id":37,
    "name":"Parul gupta",
    "faculty_type":"Faculty",
    "education":"PhD (Economics), IIT Delhi",
    "bio":"Dr. Parul Gupta is an Assistant Professor of Economics at Dhirubhai Ambani University. Previously, she has taught economics at the Shiv Nadar University (Delhi NCR), Indian School of Business and Finance and Lady Shri Ram College. She has also worked at Sattva Consulting and World Bank. Her current research explores the drivers of education access and quality in developing regions. Outside of academics, her interests lie in music, dance and fine arts. She is trained in Indian Classical Vocal Music and Bharatnatyam dance and she enjoys working on art and crafts in her free time.",
    "specialization_list":[
      "economic development",
      "education policy",
      "economics of gender"
    ],
    "research_tags":[
      "education",
      "ai",
      "economics",
      "economic",
      "policy",
      "gender",
      "development"
    ],
    "email":"parul_gupta@dau.ac.in",
    "phone":"07968261744",
    "address":"# 4102, FB-4, DAU, Gandhinagar, Gujarat, India – 382007",
    "combined_text":"Name: Parul gupta | Role: Faculty | Education: PhD (Economics), IIT Delhi | Biography: Dr. Parul Gupta is an Assistant Professor of Economics at Dhirubhai Ambani University. Previously, she has taught economics at the Shiv Nadar University (Delhi NCR), Indian School of Business and Finance and Lady Shri Ram College. She has also worked at Sattva Consulting and World Bank. Her current research explores the drivers of education access and quality in developing regions. Outside of academics, her interests lie in music, dance and fine arts. She is trained in Indian Classical Vocal Music and Bharatnatyam dance and she enjoys working on art and crafts in her free time. | Research Areas: economic development, education policy, economics of gender | Research Keywords: education, ai, economics, economic, policy, gender, development"
  },
  {
    "faculty_id":38,
    "name":"Prasenjit majumder (on leave)",
    "faculty_type":"Faculty",
    "education":"PhD (Computer Science), Jadavpur University",
    "bio":"Not Available",
    "specialization_list":[
      "natural language processing",
      "information retrieval",
      "cognitive science"
    ],
    "research_tags":[
      "science",
      "cognitive",
      "retrieval",
      "information",
      "natural",
      "processing",
      "language"
    ],
    "email":"p_majumder@dau.ac.in,prasenjit.majumder@gmail.com",
    "phone":"07968261605",
    "address":"# 4209, FB-4, DA-IICT, Gandhinagar, Gujarat, India – 382007",
    "combined_text":"Name: Prasenjit majumder (on leave) | Role: Faculty | Education: PhD (Computer Science), Jadavpur University | Biography: Not Available | Research Areas: natural language processing, information retrieval, cognitive science | Research Keywords: science, cognitive, retrieval, information, natural, processing, language"
  },
  {
    "faculty_id":39,
    "name":"Pratim roy",
    "faculty_type":"Faculty",
    "education":"PhD (Physics),  IIT Kanpur",
    "bio":"Pratim Roy is an Assistant Professor at DA-IICT, Gandhinagar. He received a PhD degree in Physics from the Indian Institute of Technology, Kanpur. His interests are broadly in Theoretical Physics, including the ADS\/CFT Duality and the investigation of quantum information theoretic concepts such as Entanglement in Quantum Field Theories.",
    "specialization_list":[
      "theoretical physics",
      "ads\/cft duality",
      "quantum field theory"
    ],
    "research_tags":[
      "quantum",
      "theoretical",
      "duality",
      "physics",
      "dl",
      "field",
      "ads\/cft",
      "theory"
    ],
    "email":"pratim_roy@dau.ac.in",
    "phone":"07968261627",
    "address":"# 4211, FB-4, DA-IICT, Gandhinagar, Gujarat, India – 382007",
    "combined_text":"Name: Pratim roy | Role: Faculty | Education: PhD (Physics),  IIT Kanpur | Biography: Pratim Roy is an Assistant Professor at DA-IICT, Gandhinagar. He received a PhD degree in Physics from the Indian Institute of Technology, Kanpur. His interests are broadly in Theoretical Physics, including the ADS\/CFT Duality and the investigation of quantum information theoretic concepts such as Entanglement in Quantum Field Theories. | Research Areas: theoretical physics, ads\/cft duality, quantum field theory | Research Keywords: quantum, theoretical, duality, physics, dl, field, ads\/cft, theory"
  },
  {
    "faculty_id":40,
    "name":"Pritam anand",
    "faculty_type":"Faculty",
    "education":"PhD (Computer Science), South Asian University, New Delhi",
    "bio":"Pritam Anand is currently Assistant Professor at DAIICT. His research interest moves around the Support Vector Machine Algorithms. He has obtained his Master degree in Computer Science from South Asian University, New Delhi (An international university established by SAARC countries). He has obtained his Ph.D. degree in Computer Science from South Asian University, New Delhi. He was the recipient of the prestigious Visvesvaraya Ph.D. fellowship during his doctoral degree.",
    "specialization_list":[
      "support vector machines",
      "loss functions",
      "regression",
      "extreme learning machine",
      "quantile regression"
    ],
    "research_tags":[
      "loss",
      "ai",
      "regression",
      "machine",
      "functions",
      "machines",
      "learning",
      "quantile",
      "support",
      "extreme",
      "vector"
    ],
    "email":"pritam_anand@dau.ac.in",
    "phone":"07968261657",
    "address":"# 3103, FB-3, DA-IICT, Gandhinagar, Gujarat, India – 382007",
    "combined_text":"Name: Pritam anand | Role: Faculty | Education: PhD (Computer Science), South Asian University, New Delhi | Biography: Pritam Anand is currently Assistant Professor at DAIICT. His research interest moves around the Support Vector Machine Algorithms. He has obtained his Master degree in Computer Science from South Asian University, New Delhi (An international university established by SAARC countries). He has obtained his Ph.D. degree in Computer Science from South Asian University, New Delhi. He was the recipient of the prestigious Visvesvaraya Ph.D. fellowship during his doctoral degree. | Research Areas: support vector machines, loss functions, regression, extreme learning machine, quantile regression | Research Keywords: loss, ai, regression, machine, functions, machines, learning, quantile, support, extreme, vector"
  },
  {
    "faculty_id":41,
    "name":"Prosenjit kundu",
    "faculty_type":"Faculty",
    "education":"PhD (Mathematics), National Institute of Technology, Durgapur",
    "bio":"Prosenjit Kundu is an Assistant Professor at DAIICT, Gandhinagar. Before joining here at DAIICT he was a Visiting Assistant Professor at State University of New York (SUNY) at Buffalo, USA. Prior to that he was a postdoctoral fellow at Bar-Ilan University, Israel. Formerly he was a Visiting Scientist at Indian Statistical Institute (ISI), Kolkata. Prosenjit received his PhD degree in 2019 from National Institute of Technology, Durgapur and M.Sc in Mathematics with Computer Applications in 2013. The research interest of Prosenjit mainly focuses on collective behavior of networked dynamical systems which include studying synchronization, dimension reduction of networked dynamical systems etc. Prosenjit is also interested in data science. He is interested in studying the empirical water distribution networks. He has collaborators in countries like India, USA, France, Italy, Israel, Japan, China and look forward to make many more. Prosenjit is a potential reviewer of many internationally reputed journals like Communications Physics, Chaos, Complexity, Physica D, Frontiers in Computational Neuroscience, Physical Review etc. He has presented my research works in many international conferences in India, France, Italy, Israel, USA.",
    "specialization_list":[
      "physics and mathematical sciences",
      "applied mathematics",
      "complex networks",
      "dynamical systems"
    ],
    "research_tags":[
      "systems",
      "sciences",
      "data science",
      "dynamical",
      "ai",
      "applied",
      "complex",
      "physics",
      "networks",
      "mathematical",
      "and",
      "mathematics"
    ],
    "email":"prosenjit_kundu@dau.ac.in,jitprosen.math@gmail.com",
    "phone":"07968261559",
    "address":"# 2211, FB-2, DA-IICT, Gandhinagar, Gujarat, India – 382007",
    "combined_text":"Name: Prosenjit kundu | Role: Faculty | Education: PhD (Mathematics), National Institute of Technology, Durgapur | Biography: Prosenjit Kundu is an Assistant Professor at DAIICT, Gandhinagar. Before joining here at DAIICT he was a Visiting Assistant Professor at State University of New York (SUNY) at Buffalo, USA. Prior to that he was a postdoctoral fellow at Bar-Ilan University, Israel. Formerly he was a Visiting Scientist at Indian Statistical Institute (ISI), Kolkata. Prosenjit received his PhD degree in 2019 from National Institute of Technology, Durgapur and M.Sc in Mathematics with Computer Applications in 2013. The research interest of Prosenjit mainly focuses on collective behavior of networked dynamical systems which include studying synchronization, dimension reduction of networked dynamical systems etc. Prosenjit is also interested in data science. He is interested in studying the empirical water distribution networks. He has collaborators in countries like India, USA, France, Italy, Israel, Japan, China and look forward to make many more. Prosenjit is a potential reviewer of many internationally reputed journals like Communications Physics, Chaos, Complexity, Physica D, Frontiers in Computational Neuroscience, Physical Review etc. He has presented my research works in many international conferences in India, France, Italy, Israel, USA. | Research Areas: physics and mathematical sciences, applied mathematics, complex networks, dynamical systems | Research Keywords: systems, sciences, data science, dynamical, ai, applied, complex, physics, networks, mathematical, and, mathematics"
  },
  {
    "faculty_id":42,
    "name":"Puneet bhateja",
    "faculty_type":"Faculty",
    "education":"PhD (Computer Science), Chennai Mathematical Institute",
    "bio":"Dr. Puneet Bhateja obtained his PhD in Theoretical Computer Sc from Chennai Mathematical Institute in year 2009 under the supervision of Prof Madhavan Mukund. In his doctoral thesis, he proposed a mathematical theory for testing distributed systems. Immediately after his PhD, he moved to INT-Paris (France). He worked there as a research engineer from 2009 to 2010. Subsequently he held post doctoral positions at INRIA-Rennes (France) from 2010-2011, and CRIM (Canada) from 2011-2012. He joined DA-IICT in year 2013, and since then he is working here.",
    "specialization_list":[
      "theoretical computer science"
    ],
    "research_tags":[
      "computer",
      "science",
      "ai",
      "theoretical"
    ],
    "email":"puneet_bhateja@dau.ac.in",
    "phone":"07968261647",
    "address":"# 2101, FB-2, DA-IICT, Gandhinagar, Gujarat, India – 382007",
    "combined_text":"Name: Puneet bhateja | Role: Faculty | Education: PhD (Computer Science), Chennai Mathematical Institute | Biography: Dr. Puneet Bhateja obtained his PhD in Theoretical Computer Sc from Chennai Mathematical Institute in year 2009 under the supervision of Prof Madhavan Mukund. In his doctoral thesis, he proposed a mathematical theory for testing distributed systems. Immediately after his PhD, he moved to INT-Paris (France). He worked there as a research engineer from 2009 to 2010. Subsequently he held post doctoral positions at INRIA-Rennes (France) from 2010-2011, and CRIM (Canada) from 2011-2012. He joined DA-IICT in year 2013, and since then he is working here. | Research Areas: theoretical computer science | Research Keywords: computer, science, ai, theoretical"
  },
  {
    "faculty_id":43,
    "name":"Purbasha das",
    "faculty_type":"Faculty",
    "education":"PhD (History), Jawaharlal Nehru University, New Delhi",
    "bio":"Purbasha Das completed her PhD at the Centre for Historical Studies, Jawaharlal Nehru University in 2023. Her doctoral dissertation, Transport in India: A Tale of Three Cities (c. 1900-c.1960), examines how modern transport such as cars, buses, trams interact with older modes of technology such as bullock carts, tongas and rickshaws. There are many axes along which this interaction can be plotted. Some of these are congestion, town planning and the changing nature of the streets and roads. She has also completed her Masters and MPhil degree in Modern Indian History from Jawaharlal Nehru University. She is the recipient of the 2019-2020 Fulbright Nehru Doctoral Research Fellowship. As a Fulbright Nehru Doctoral researcher, she was affiliated with the Centre for the History and Ethics of Public Health at Columbia University, New York City. Her role as archives associate at the Archives of Contemporary India, Ashoka University enabled her to understand the significance of archival preservation which she wishes to share with students and the teaching community.",
    "specialization_list":[
      "history of transport and communication",
      "urban history",
      "legal and social history"
    ],
    "research_tags":[
      "social",
      "communication",
      "transport",
      "urban",
      "history",
      "and",
      "legal"
    ],
    "email":"purbasha_das@daiict.ac.in",
    "phone":"07968261653",
    "address":"# 4210, FB-4, DA-IICT, Gandhinagar, Gujarat, India – 382007",
    "combined_text":"Name: Purbasha das | Role: Faculty | Education: PhD (History), Jawaharlal Nehru University, New Delhi | Biography: Purbasha Das completed her PhD at the Centre for Historical Studies, Jawaharlal Nehru University in 2023. Her doctoral dissertation, Transport in India: A Tale of Three Cities (c. 1900-c.1960), examines how modern transport such as cars, buses, trams interact with older modes of technology such as bullock carts, tongas and rickshaws. There are many axes along which this interaction can be plotted. Some of these are congestion, town planning and the changing nature of the streets and roads. She has also completed her Masters and MPhil degree in Modern Indian History from Jawaharlal Nehru University. She is the recipient of the 2019-2020 Fulbright Nehru Doctoral Research Fellowship. As a Fulbright Nehru Doctoral researcher, she was affiliated with the Centre for the History and Ethics of Public Health at Columbia University, New York City. Her role as archives associate at the Archives of Contemporary India, Ashoka University enabled her to understand the significance of archival preservation which she wishes to share with students and the teaching community. | Research Areas: history of transport and communication, urban history, legal and social history | Research Keywords: social, communication, transport, urban, history, and, legal"
  },
  {
    "faculty_id":44,
    "name":"Pushpendra kumar",
    "faculty_type":"Faculty",
    "education":"PhD (Mathematics), National Institute of Technology Puducherry",
    "bio":"Dr. Pushpendra Kumar is a dedicated researcher and academic specializing in fractional calculus, mathematical modeling, numerical analysis, and neural networks. He has worked as a postdoctoral researcher at Jeonbuk National University, South Korea. He has also served as a visiting professor at Istanbul Okan University, Turkey; as a research associate at Near East University, Cyprus; and as a research professor at the University of Johannesburg, South Africa, reflecting his global academic footprint. Recognized among the \"World’s Top 2% Scientists\" by Elsevier and Stanford University in 2023 and 2024, Dr. Kumar has also been a recipient of the prestigious IMU Breakout Graduate Fellowship from the International Mathematical Union (Germany) and London Mathematical Society. He has published more than 100 research papers in reputed international journals and has edited a book entitled “Recent Developments in Fractional Calculus: Theory, Applications, and Numerical Simulations.”",
    "specialization_list":[
      "fractional calculus",
      "mathematical modeling",
      "numerical analysis",
      "and neural networks"
    ],
    "research_tags":[
      "calculus",
      "neural",
      "analysis",
      "numerical",
      "networks",
      "mathematical",
      "and",
      "fractional",
      "modeling"
    ],
    "email":"pushpendra_kumar@dau.ac.in",
    "phone":"07968261649",
    "address":"# 4109, FB-4, DAU, Gandhinagar, Gujarat, India – 382007",
    "combined_text":"Name: Pushpendra kumar | Role: Faculty | Education: PhD (Mathematics), National Institute of Technology Puducherry | Biography: Dr. Pushpendra Kumar is a dedicated researcher and academic specializing in fractional calculus, mathematical modeling, numerical analysis, and neural networks. He has worked as a postdoctoral researcher at Jeonbuk National University, South Korea. He has also served as a visiting professor at Istanbul Okan University, Turkey; as a research associate at Near East University, Cyprus; and as a research professor at the University of Johannesburg, South Africa, reflecting his global academic footprint. Recognized among the \"World’s Top 2% Scientists\" by Elsevier and Stanford University in 2023 and 2024, Dr. Kumar has also been a recipient of the prestigious IMU Breakout Graduate Fellowship from the International Mathematical Union (Germany) and London Mathematical Society. He has published more than 100 research papers in reputed international journals and has edited a book entitled “Recent Developments in Fractional Calculus: Theory, Applications, and Numerical Simulations.” | Research Areas: fractional calculus, mathematical modeling, numerical analysis, and neural networks | Research Keywords: calculus, neural, analysis, numerical, networks, mathematical, and, fractional, modeling"
  },
  {
    "faculty_id":45,
    "name":"Rachit chhaya",
    "faculty_type":"Faculty",
    "education":"PhD (Computer Science), IIT Gandhinagar",
    "bio":"I am Rachit Chhaya. I have recently joined as An Assistant Professor at DA-IICT. Prior to that I was a Ph.D. scholar in Computer Science and Engineering at IIT Gandhinagar, working with my advisor Prof. Anirban Dasgupta. I am currently waiting for my thesis defense. I work in areas of Machine Learning and Data Science. My chief research interests lie constructing coresets for Machine Learning Problems Involving Regularization, Fairness Constraints etc. I am fortunate to collaborate with my advisor and friends, Jayesh Choudhari and Supratim Shit. Prior to joining Ph.D., I did by M.Tech. in ICT from DA-IICT Gandhinagar, working with Prof. Prasenjit Majumder and B.Tech. in I.T. from Nirma University. I am passionate about teaching. Apart from research and academia, my hobbies include Reading (Mostly Fiction), Quizzing and Watching Tennis, Cricket and Football.",
    "specialization_list":[
      "coresets for machine learning"
    ],
    "research_tags":[
      "data science",
      "ai",
      "machine",
      "machine learning",
      "learning",
      "for",
      "coresets"
    ],
    "email":"rachit_chhaya@dau.ac.in",
    "phone":"07968261708",
    "address":"# 3109, FB-3, DA-IICT, Gandhinagar, Gujarat, India – 382007",
    "combined_text":"Name: Rachit chhaya | Role: Faculty | Education: PhD (Computer Science), IIT Gandhinagar | Biography: I am Rachit Chhaya. I have recently joined as An Assistant Professor at DA-IICT. Prior to that I was a Ph.D. scholar in Computer Science and Engineering at IIT Gandhinagar, working with my advisor Prof. Anirban Dasgupta. I am currently waiting for my thesis defense. I work in areas of Machine Learning and Data Science. My chief research interests lie constructing coresets for Machine Learning Problems Involving Regularization, Fairness Constraints etc. I am fortunate to collaborate with my advisor and friends, Jayesh Choudhari and Supratim Shit. Prior to joining Ph.D., I did by M.Tech. in ICT from DA-IICT Gandhinagar, working with Prof. Prasenjit Majumder and B.Tech. in I.T. from Nirma University. I am passionate about teaching. Apart from research and academia, my hobbies include Reading (Mostly Fiction), Quizzing and Watching Tennis, Cricket and Football. | Research Areas: coresets for machine learning | Research Keywords: data science, ai, machine, machine learning, learning, for, coresets"
  },
  {
    "faculty_id":46,
    "name":"Rahul muthu",
    "faculty_type":"Faculty",
    "education":"PhD (Mathematics), Homi Bhabha National Institute, Mumbai",
    "bio":"I obtained my Ph.D. (2008) in the field of Theoretical Computer Science. The title of my thesis is “Acyclic Edge Colouring: Bounds and Algorithms”. I carried out the research towards my Ph.D. at The Institute of Mathematical Sciences, Chennai, India under the guidance of Prof. C.R. Subramanian. I worked under a post-doctoral fellowship at Laboratoire de Recherche en Informatique, Universite Paris Sud, Orsay, France (2009). I worked in a team headed by Prof. Yannis Manoussakis and conducted research in the field of Structures in Edge Coloured Graphs. I currently work at DA-IICT and my broad research interests lie in the field of Graph Algorithms. I have guided one Ph.D. student, Mahipal Jadeja who defended his thesis (2018) titled “Set Labelling of Vertices and Study of Auxiliary Graphs”. I have also guided around ten M.Tech. Theses and several B.Tech. Projects. My current research problems include: -Defining auxiliary or other graph classes and\/or obtaining mathematical characterizations and algorithms for them; -Weight assignment to edges of complete graphs to yield a prespecified number of minimum weight spanning trees. I teach courses in Theoretical Computer Science and Mathematics.",
    "specialization_list":[
      "graph theory",
      "data structures",
      "algorithms",
      "automata theory"
    ],
    "research_tags":[
      "algorithms",
      "data",
      "ai",
      "automata",
      "structures",
      "graph",
      "theory"
    ],
    "email":"rahul_muthu@dau.ac.in",
    "phone":"079682615649586478239",
    "address":"# 1202, FB-1, DA-IICT, Gandhinagar, Gujarat, India – 382007",
    "combined_text":"Name: Rahul muthu | Role: Faculty | Education: PhD (Mathematics), Homi Bhabha National Institute, Mumbai | Biography: I obtained my Ph.D. (2008) in the field of Theoretical Computer Science. The title of my thesis is “Acyclic Edge Colouring: Bounds and Algorithms”. I carried out the research towards my Ph.D. at The Institute of Mathematical Sciences, Chennai, India under the guidance of Prof. C.R. Subramanian. I worked under a post-doctoral fellowship at Laboratoire de Recherche en Informatique, Universite Paris Sud, Orsay, France (2009). I worked in a team headed by Prof. Yannis Manoussakis and conducted research in the field of Structures in Edge Coloured Graphs. I currently work at DA-IICT and my broad research interests lie in the field of Graph Algorithms. I have guided one Ph.D. student, Mahipal Jadeja who defended his thesis (2018) titled “Set Labelling of Vertices and Study of Auxiliary Graphs”. I have also guided around ten M.Tech. Theses and several B.Tech. Projects. My current research problems include: -Defining auxiliary or other graph classes and\/or obtaining mathematical characterizations and algorithms for them; -Weight assignment to edges of complete graphs to yield a prespecified number of minimum weight spanning trees. I teach courses in Theoretical Computer Science and Mathematics. | Research Areas: graph theory, data structures, algorithms, automata theory | Research Keywords: algorithms, data, ai, automata, structures, graph, theory"
  },
  {
    "faculty_id":47,
    "name":"Rajib lochan das",
    "faculty_type":"Faculty",
    "education":"PhD (Electronics & Electrical Communication Engineering), IIT Kharagpur",
    "bio":"Rajib Lochan Das received the bachelor’s degree in electronics and communication engineering from the National Institute of Technology, Durgapur, India, in 2000, the master’s degree in control system engineering from Jadavpur University, Kolkata, India, in 2003, and the Ph.D. degree in electronics and electrical communication engineering from IIT, Kharagpur, India, in 2015. He is currently an Assistant Professor with the Dhirubhai Ambani Institute of Information and Communication Technology, Gandhinagar, India. His research interests include adaptive signal processing, compressive sensing, and image processing. He has published several IEEE Transaction papers.",
    "specialization_list":[
      "adaptive signal processing",
      "compressive sensing",
      "machine learning",
      "image processing",
      "graph signal processing"
    ],
    "research_tags":[
      "signal processing",
      "signal",
      "ai",
      "machine",
      "adaptive",
      "compressive",
      "image",
      "processing",
      "sensing",
      "learning",
      "graph"
    ],
    "email":"rajib_das@dau.ac.in",
    "phone":"07968261597",
    "address":"# 4202, FB-4, DA-IICT, Gandhinagar, Gujarat, India – 382007",
    "combined_text":"Name: Rajib lochan das | Role: Faculty | Education: PhD (Electronics & Electrical Communication Engineering), IIT Kharagpur | Biography: Rajib Lochan Das received the bachelor’s degree in electronics and communication engineering from the National Institute of Technology, Durgapur, India, in 2000, the master’s degree in control system engineering from Jadavpur University, Kolkata, India, in 2003, and the Ph.D. degree in electronics and electrical communication engineering from IIT, Kharagpur, India, in 2015. He is currently an Assistant Professor with the Dhirubhai Ambani Institute of Information and Communication Technology, Gandhinagar, India. His research interests include adaptive signal processing, compressive sensing, and image processing. He has published several IEEE Transaction papers. | Research Areas: adaptive signal processing, compressive sensing, machine learning, image processing, graph signal processing | Research Keywords: signal processing, signal, ai, machine, adaptive, compressive, image, processing, sensing, learning, graph"
  },
  {
    "faculty_id":48,
    "name":"Ratna bharati bhamidipati",
    "faculty_type":"Faculty",
    "education":"PhD (Sociology), Dr B R Ambedkar University, Delhi",
    "bio":"Ratna Bharati B recently submitted her PhD thesis in the Sociology programme, at the School of Liberal Studies at Dr B R Ambedkar University Delhi. Her doctoral research project is based on the dynamics of migrant and non-migrant relationships, and the formation of migrant subjectivities among the Gujarati Diaspora from Dharmaj, Gujarat. She holds a Master of Philosophy degree in Indian Diaspora from the University of Hyderabad, India. Her study investigated the social aspect of remittances and the patterns of transnational engagement through investment in property by the Telugu Diaspora. She obtained her master’s degree in Society and Culture from Indian Institute of Technology Gandhinagar. Her thesis analysed the transnational networks maintained by the Gujarati diaspora from the United Kingdom.",
    "specialization_list":[
      "diaspora",
      "transnationalism",
      "migrant subjectivity"
    ],
    "research_tags":[
      "ai",
      "diaspora",
      "transnationalism",
      "migrant",
      "subjectivity"
    ],
    "email":"ratna_bharati@dau.ac.in",
    "phone":"07968261589",
    "address":"# 2202, FB-2, DA-IICT, Gandhinagar, Gujarat, India – 382007",
    "combined_text":"Name: Ratna bharati bhamidipati | Role: Faculty | Education: PhD (Sociology), Dr B R Ambedkar University, Delhi | Biography: Ratna Bharati B recently submitted her PhD thesis in the Sociology programme, at the School of Liberal Studies at Dr B R Ambedkar University Delhi. Her doctoral research project is based on the dynamics of migrant and non-migrant relationships, and the formation of migrant subjectivities among the Gujarati Diaspora from Dharmaj, Gujarat. She holds a Master of Philosophy degree in Indian Diaspora from the University of Hyderabad, India. Her study investigated the social aspect of remittances and the patterns of transnational engagement through investment in property by the Telugu Diaspora. She obtained her master’s degree in Society and Culture from Indian Institute of Technology Gandhinagar. Her thesis analysed the transnational networks maintained by the Gujarati diaspora from the United Kingdom. | Research Areas: diaspora, transnationalism, migrant subjectivity | Research Keywords: ai, diaspora, transnationalism, migrant, subjectivity"
  },
  {
    "faculty_id":49,
    "name":"Rutu parekh",
    "faculty_type":"Faculty",
    "education":"PhD (Electrical Engineering), Sherbrooke University, Canada",
    "bio":"Dr. Rutu Parekh is an Associate Professor at School of Technology, DAU, Gandhinagar, India, with over a decade of experience in VLSI design, nanoelectronics, embedded systems, and IoT applications. She completed her M.Tech in Electrical Engineering from Concordia University, Canada, her Ph.D. in Electrical Engineering from Université de Sherbrooke, Canada, and was a Postdoctoral Fellow at the Centre of Excellence in Nanoelectronics, IIT Bombay. Her research focuses on high-voltage ASIC design for space applications, long-distance wireless sensor networks, and IoT-enabled smart agriculture and environmental monitoring systems, including soil moisture and irrigation prediction, forestation tracking, and real-time GUI-based monitoring. She has led sponsored projects on long-distance military communication systems and developed innovative prototypes integrating advanced sensors and secure data transmission. She has industrial experience with eInfochips, Ahmedabad and HP Karkland, Montreal, Canada, research experience with Ecole Polytechnic, Quebec, Canada, and teaching experience with Nirma University of Science and Technology, Ahmedabad. Presently, she is also associated with The Inter-University Centre for Astronomy and Astrophysics, Pune, India, as a Visiting Associate. She has authored book, published numerous international papers, filed patents, and contributes as semiconductor board member, editorial board and technical committee member. She actively mentors Ph.D. and postgraduate students and supports semiconductor workforce development in India.",
    "specialization_list":[
      "high-voltage asic design for space applications",
      "nanoelectronics and emerging devices",
      "embedded systems and iot applications",
      "long-distance wireless communication systems",
      "smart agriculture and environmental monitoring",
      "memristor-based neuromorphi…"
    ],
    "research_tags":[
      "neuromorphi…",
      "space",
      "systems",
      "communication",
      "devices",
      "applications",
      "agriculture",
      "long-distance",
      "design",
      "iot",
      "embedded",
      "and",
      "monitoring",
      "wireless",
      "environmental",
      "for",
      "smart",
      "emerging",
      "high-voltage",
      "asic",
      "nanoelectronics",
      "memristor-based"
    ],
    "email":"rutu_parekh@dau.ac.in",
    "phone":"07968261553",
    "address":"# 2112, FB-2, DA-IICT, Gandhinagar, Gujarat, India – 382007",
    "combined_text":"Name: Rutu parekh | Role: Faculty | Education: PhD (Electrical Engineering), Sherbrooke University, Canada | Biography: Dr. Rutu Parekh is an Associate Professor at School of Technology, DAU, Gandhinagar, India, with over a decade of experience in VLSI design, nanoelectronics, embedded systems, and IoT applications. She completed her M.Tech in Electrical Engineering from Concordia University, Canada, her Ph.D. in Electrical Engineering from Université de Sherbrooke, Canada, and was a Postdoctoral Fellow at the Centre of Excellence in Nanoelectronics, IIT Bombay. Her research focuses on high-voltage ASIC design for space applications, long-distance wireless sensor networks, and IoT-enabled smart agriculture and environmental monitoring systems, including soil moisture and irrigation prediction, forestation tracking, and real-time GUI-based monitoring. She has led sponsored projects on long-distance military communication systems and developed innovative prototypes integrating advanced sensors and secure data transmission. She has industrial experience with eInfochips, Ahmedabad and HP Karkland, Montreal, Canada, research experience with Ecole Polytechnic, Quebec, Canada, and teaching experience with Nirma University of Science and Technology, Ahmedabad. Presently, she is also associated with The Inter-University Centre for Astronomy and Astrophysics, Pune, India, as a Visiting Associate. She has authored book, published numerous international papers, filed patents, and contributes as semiconductor board member, editorial board and technical committee member. She actively mentors Ph.D. and postgraduate students and supports semiconductor workforce development in India. | Research Areas: high-voltage asic design for space applications, nanoelectronics and emerging devices, embedded systems and iot applications, long-distance wireless communication systems, smart agriculture and environmental monitoring, memristor-based neuromorphi… | Research Keywords: neuromorphi…, space, systems, communication, devices, applications, agriculture, long-distance, design, iot, embedded, and, monitoring, wireless, environmental, for, smart, emerging, high-voltage, asic, nanoelectronics, memristor-based"
  },
  {
    "faculty_id":50,
    "name":"Sandip modha",
    "faculty_type":"Faculty",
    "education":"PhD, DA-IICT Gandhinagar",
    "bio":"Dr. Sandip Modha has joined Dhirubhai Ambani University (DAU) as an Assistant Professor. His primary research interests lie in the domains of Natural Language Processing (NLP) and Information Retrieval (IR), with a particular emphasis on Hate speech detection, Misinformation analysis, Text Summarization, Fact verification and Assessment, evaluation methodologies, and computational approaches to social media data. Prior to joining DAU, Dr. Modha served as a Post-Doctoral Research Fellow at the University of Milano-Bicocca, Italy, where he contributed to the European Union–funded projects on misinformation detection and evaluation frameworks. He also held a contractual faculty position in the course on Human-Centered Artificial Intelligence, jointly run by the Universities of Milan, Milano-Bicocca, and Pavia. He is actively engaged in the global research community as the Founder and Co-Organizer of the HASOC (Hate Speech and Offensive Content) track and the Indian Language Summarization (ILSUM) track at the Forum for Information Retrieval Evaluation (FIRE) Dr. Modha holds a Ph.D. from the Dhirubhai Ambani Institute of Information and Communication Technology (DA-IICT). He obtained his M.Tech. in Computer Science and Engineering from Nirma University and a B.E. in Computer Engineering from Nirma Institute of Technology, which was formerly affiliated with Gujarat University.",
    "specialization_list":[
      "natural language processing (nlp)",
      "information retrieval (ir)",
      "evaluation methodologies",
      "and computational approaches to social media data."
    ],
    "research_tags":[
      "computational",
      "nlp",
      "methodologies",
      "(nlp)",
      "evaluation",
      "retrieval",
      "(ir)",
      "natural",
      "data.",
      "and",
      "natural language processing",
      "language",
      "social",
      "approaches",
      "information",
      "processing",
      "media",
      "ai",
      "artificial intelligence"
    ],
    "email":"sandip_modha@dau.ac.in",
    "phone":"07968261672",
    "address":"# 2201, FB-2, DAU, Gandhinagar, Gujarat, India – 382007",
    "combined_text":"Name: Sandip modha | Role: Faculty | Education: PhD, DA-IICT Gandhinagar | Biography: Dr. Sandip Modha has joined Dhirubhai Ambani University (DAU) as an Assistant Professor. His primary research interests lie in the domains of Natural Language Processing (NLP) and Information Retrieval (IR), with a particular emphasis on Hate speech detection, Misinformation analysis, Text Summarization, Fact verification and Assessment, evaluation methodologies, and computational approaches to social media data. Prior to joining DAU, Dr. Modha served as a Post-Doctoral Research Fellow at the University of Milano-Bicocca, Italy, where he contributed to the European Union–funded projects on misinformation detection and evaluation frameworks. He also held a contractual faculty position in the course on Human-Centered Artificial Intelligence, jointly run by the Universities of Milan, Milano-Bicocca, and Pavia. He is actively engaged in the global research community as the Founder and Co-Organizer of the HASOC (Hate Speech and Offensive Content) track and the Indian Language Summarization (ILSUM) track at the Forum for Information Retrieval Evaluation (FIRE) Dr. Modha holds a Ph.D. from the Dhirubhai Ambani Institute of Information and Communication Technology (DA-IICT). He obtained his M.Tech. in Computer Science and Engineering from Nirma University and a B.E. in Computer Engineering from Nirma Institute of Technology, which was formerly affiliated with Gujarat University. | Research Areas: natural language processing (nlp), information retrieval (ir), evaluation methodologies, and computational approaches to social media data. | Research Keywords: computational, nlp, methodologies, (nlp), evaluation, retrieval, (ir), natural, data., and, natural language processing, language, social, approaches, information, processing, media, ai, artificial intelligence"
  },
  {
    "faculty_id":51,
    "name":"Sanjay srivastava",
    "faculty_type":"Faculty",
    "education":"PhD (Physics), University of California, Los Angeles, USA",
    "bio":"Not Available",
    "specialization_list":[
      "internet of things",
      "protocol modelling and analysis",
      "simulation"
    ],
    "research_tags":[
      "things",
      "simulation",
      "analysis",
      "protocol",
      "and",
      "internet",
      "modelling"
    ],
    "email":"sanjay_srivastava@dau.ac.in",
    "phone":"07968261547",
    "address":"# 1205, FB-1, DA-IICT, Gandhinagar, Gujarat, India – 382007",
    "combined_text":"Name: Sanjay srivastava | Role: Faculty | Education: PhD (Physics), University of California, Los Angeles, USA | Biography: Not Available | Research Areas: internet of things, protocol modelling and analysis, simulation | Research Keywords: things, simulation, analysis, protocol, and, internet, modelling"
  },
  {
    "faculty_id":52,
    "name":"Satvik gupta",
    "faculty_type":"Faculty",
    "education":"PhD (English Literature), IIT Ropar",
    "bio":"Dr. Satvik Gupta is an Assistant Professor of English Literature at the Dhirubhai Ambani University, Gandhinagar, India. He received his doctoral degree in November 2024 from the Indian Institute of Technology (IIT) Ropar. His research focuses on the Lovecraftian aesthetics of cosmic horror fiction. Specifically, he investigates the essence of existential horror latent in non-human experiences such as cosmic horror and weird fiction. He is also interested in exploring the intersection of literature and architecture across supernatural narratives. His research has been published in Textual Practice, Horror Studies and Critique: Studies in Contemporary Fiction. He has presented his work at conferences across Germany, Spain and Romania",
    "specialization_list":[
      "weird fiction",
      "horror fiction",
      "speculative fiction",
      "world literature",
      "existentialism",
      "absurdism"
    ],
    "research_tags":[
      "fiction",
      "literature",
      "ai",
      "weird",
      "existentialism",
      "absurdism",
      "horror",
      "speculative",
      "world"
    ],
    "email":"satvik_gupta@dau.ac.in",
    "phone":"07968261655",
    "address":"# 4105, FB-4, DA-IICT, Gandhinagar, Gujarat, India – 382007",
    "combined_text":"Name: Satvik gupta | Role: Faculty | Education: PhD (English Literature), IIT Ropar | Biography: Dr. Satvik Gupta is an Assistant Professor of English Literature at the Dhirubhai Ambani University, Gandhinagar, India. He received his doctoral degree in November 2024 from the Indian Institute of Technology (IIT) Ropar. His research focuses on the Lovecraftian aesthetics of cosmic horror fiction. Specifically, he investigates the essence of existential horror latent in non-human experiences such as cosmic horror and weird fiction. He is also interested in exploring the intersection of literature and architecture across supernatural narratives. His research has been published in Textual Practice, Horror Studies and Critique: Studies in Contemporary Fiction. He has presented his work at conferences across Germany, Spain and Romania | Research Areas: weird fiction, horror fiction, speculative fiction, world literature, existentialism, absurdism | Research Keywords: fiction, literature, ai, weird, existentialism, absurdism, horror, speculative, world"
  },
  {
    "faculty_id":53,
    "name":"Saurabh tiwari",
    "faculty_type":"Faculty",
    "education":"PhD (Computer Science & Engineering), IIITDM, Jabalpur",
    "bio":"Saurabh Tiwari is an Associate Professor at DA-IICT, Gandhinagar (India). Previously, he worked as a Postdoc Researcher at Mälardalen University (Sweden) and worked with Volvo Construction Equipments AB in the Model-Based System Engineering (MBT, MBD) area. His research interests are Requirements Engineering, Empirical Software Engineering, Mining Software Repositories, Green Computing, AI for SE, and HCI. He is also doing research in Software Engineering Education and Training to identify\/devise innovative teaching methodologies to teach Software Engineering concepts. He received a research grant from the Science and Engineering Research Board (SERB, Government of India) under the Early Career Research Award scheme. He received two best paper awards at the 20th APSEC 2013 and 25th APSEC 2018 conferences, respectively. His PhD thesis was indexed in the ACM (Association for Computing Machinery) SIGSOFT (Special Interest Group on Software Engineering) list of PhD Dissertations in the area of Software Engineering (2016). He is a professional Senior Member of the ACM and IEEE.",
    "specialization_list":[
      "meet prof. saurabh tiwari: the realm of software engineering and innovation! software engineering (se)",
      "mining software repositories",
      "natural langua…"
    ],
    "research_tags":[
      "realm",
      "meet",
      "mining",
      "engineering",
      "software",
      "ai",
      "saurabh",
      "prof.",
      "the",
      "tiwari:",
      "repositories",
      "innovation!",
      "natural",
      "(se)",
      "and",
      "langua…"
    ],
    "email":"saurabh_t@dau.ac.in",
    "phone":"07968261618",
    "address":"# 1102, FB-1, DA-IICT, Gandhinagar, Gujarat, India – 382007",
    "combined_text":"Name: Saurabh tiwari | Role: Faculty | Education: PhD (Computer Science & Engineering), IIITDM, Jabalpur | Biography: Saurabh Tiwari is an Associate Professor at DA-IICT, Gandhinagar (India). Previously, he worked as a Postdoc Researcher at Mälardalen University (Sweden) and worked with Volvo Construction Equipments AB in the Model-Based System Engineering (MBT, MBD) area. His research interests are Requirements Engineering, Empirical Software Engineering, Mining Software Repositories, Green Computing, AI for SE, and HCI. He is also doing research in Software Engineering Education and Training to identify\/devise innovative teaching methodologies to teach Software Engineering concepts. He received a research grant from the Science and Engineering Research Board (SERB, Government of India) under the Early Career Research Award scheme. He received two best paper awards at the 20th APSEC 2013 and 25th APSEC 2018 conferences, respectively. His PhD thesis was indexed in the ACM (Association for Computing Machinery) SIGSOFT (Special Interest Group on Software Engineering) list of PhD Dissertations in the area of Software Engineering (2016). He is a professional Senior Member of the ACM and IEEE. | Research Areas: meet prof. saurabh tiwari: the realm of software engineering and innovation! software engineering (se), mining software repositories, natural langua… | Research Keywords: realm, meet, mining, engineering, software, ai, saurabh, prof., the, tiwari:, repositories, innovation!, natural, (se), and, langua…"
  },
  {
    "faculty_id":54,
    "name":"Sayantan paul",
    "faculty_type":"Faculty",
    "education":"PhD (Statistics) - Thesis Submitted",
    "bio":"I completed my Bachelor's degree in Statistics from Presidency University, Kolkata in 2017. Next, I completed my Master’s degree in Statistics from Indian Institute of Technology, Kanpur, in 2019. Later, in the same year, I joined ISI as a research scholar, where I was working on some problems related to High-dimensional inference involving sparsity. In 2025, I joined Dhirubhai Ambani Institute of Information and Communication Technology, Gandhinagar as an Assistant Professor.",
    "specialization_list":[
      "high-dimensional inference",
      "multiple testing",
      "posterior concentration",
      "variable selection",
      "sparse signal recovery"
    ],
    "research_tags":[
      "posterior",
      "inference",
      "testing",
      "signal",
      "ai",
      "high-dimensional",
      "concentration",
      "variable",
      "multiple",
      "sparse",
      "selection",
      "recovery"
    ],
    "email":"sayantan_paul@dau.ac.in",
    "phone":"07968261752",
    "address":"# 3202, FB-3, DAU, Gandhinagar, Gujarat, India – 382007",
    "combined_text":"Name: Sayantan paul | Role: Faculty | Education: PhD (Statistics) - Thesis Submitted | Biography: I completed my Bachelor's degree in Statistics from Presidency University, Kolkata in 2017. Next, I completed my Master’s degree in Statistics from Indian Institute of Technology, Kanpur, in 2019. Later, in the same year, I joined ISI as a research scholar, where I was working on some problems related to High-dimensional inference involving sparsity. In 2025, I joined Dhirubhai Ambani Institute of Information and Communication Technology, Gandhinagar as an Assistant Professor. | Research Areas: high-dimensional inference, multiple testing, posterior concentration, variable selection, sparse signal recovery | Research Keywords: posterior, inference, testing, signal, ai, high-dimensional, concentration, variable, multiple, sparse, selection, recovery"
  },
  {
    "faculty_id":55,
    "name":"Shefali jha",
    "faculty_type":"Faculty",
    "education":"PhD (Anthropology), University of Chicago, USA",
    "bio":"Not Available",
    "specialization_list":[
      "political anthropology",
      "cultural studies",
      "feminist theory",
      "film studies",
      "literary and visual cultures in south asia"
    ],
    "research_tags":[
      "cultures",
      "literary",
      "film",
      "theory",
      "south",
      "political",
      "feminist",
      "asia",
      "anthropology",
      "and",
      "visual",
      "cultural",
      "studies"
    ],
    "email":"shefali_jha@dau.ac.in",
    "phone":"07968261709",
    "address":"# 3112, FB-3 , DA-IICT, Gandhinagar, Gujarat, India – 382007",
    "combined_text":"Name: Shefali jha | Role: Faculty | Education: PhD (Anthropology), University of Chicago, USA | Biography: Not Available | Research Areas: political anthropology, cultural studies, feminist theory, film studies, literary and visual cultures in south asia | Research Keywords: cultures, literary, film, theory, south, political, feminist, asia, anthropology, and, visual, cultural, studies"
  },
  {
    "faculty_id":56,
    "name":"Shruti bhilare",
    "faculty_type":"Faculty",
    "education":"PhD (Computer Science and Engineering), IIT Indore",
    "bio":"Dr. Shruti Bhilare is an assistant professor in Dhirubhai Ambani Institute of Information and Communication Technology, Gandhinagar since July 2019. She received her Ph.D. degree in Computer Science and Engineering from Indian Institute of Technology Indore, India. Her research interests include pattern recognition and image processing with focus on biometric applications. She received her B.E. and M.E. (with specialization in Software Engineering) degrees in Computer Engineering from Institute of Engineering and Technology, Devi Ahilya university Indore, India, in 2009 and 2011, respectively.",
    "specialization_list":[
      "biometrics",
      "pattern recognition",
      "image processing"
    ],
    "research_tags":[
      "biometrics",
      "ai",
      "pattern",
      "recognition",
      "image",
      "processing"
    ],
    "email":"shruti_bhilare@dau.ac.in",
    "phone":"07968261651",
    "address":"# 4208, FB-4, DA-IICT, Gandhinagar, Gujarat, India – 382007",
    "combined_text":"Name: Shruti bhilare | Role: Faculty | Education: PhD (Computer Science and Engineering), IIT Indore | Biography: Dr. Shruti Bhilare is an assistant professor in Dhirubhai Ambani Institute of Information and Communication Technology, Gandhinagar since July 2019. She received her Ph.D. degree in Computer Science and Engineering from Indian Institute of Technology Indore, India. Her research interests include pattern recognition and image processing with focus on biometric applications. She received her B.E. and M.E. (with specialization in Software Engineering) degrees in Computer Engineering from Institute of Engineering and Technology, Devi Ahilya university Indore, India, in 2009 and 2011, respectively. | Research Areas: biometrics, pattern recognition, image processing | Research Keywords: biometrics, ai, pattern, recognition, image, processing"
  },
  {
    "faculty_id":57,
    "name":"Sourish dasgupta",
    "faculty_type":"Faculty",
    "education":"PhD (Computer Science), University of Missouri - Kansas City, USA",
    "bio":"Prof. Sourish Dasgupta is an ever-curious researcher and educator. His deep interest in the role of AI in research methodologies led him to take a break from academia and set on an entrepreneurial journey for five years, which resulted in the founding of RAx Labs Inc., Delaware, USA. With some bright ex-students of DA-IICT, Prof. Dasgupta built RAx (https:\/\/raxter.io) - an AI-powered online assistant for making literature-review faster and more enriching for young researchers. Coming back from his entrepreneurial stint, Prof. Dasgupta is currently actively engaged in the analysis of less explored but important aspects of \"intelligence\" in LLMs, such as their personalization capabilities, and also designing personalized models that are a lot smaller and more eco-friendly than contemporary LLMs. In his pastime, Prof. Dasgupta loves to cook and debate with students. Prof. Dasgupta did his Ph.D. in Computer Science from the University of Missouri – Kansas City, USA.",
    "specialization_list":[
      "natural language processing",
      "knowledge graphs",
      "analysis of large language models"
    ],
    "research_tags":[
      "large",
      "models",
      "ai",
      "graphs",
      "knowledge",
      "analysis",
      "dl",
      "natural",
      "processing",
      "language"
    ],
    "email":"sourish_dasgupta@dau.ac.in",
    "phone":"079682616249624106109",
    "address":"# 4102, FB-4, DA-IICT, Gandhinagar, Gujarat, India – 382007",
    "combined_text":"Name: Sourish dasgupta | Role: Faculty | Education: PhD (Computer Science), University of Missouri - Kansas City, USA | Biography: Prof. Sourish Dasgupta is an ever-curious researcher and educator. His deep interest in the role of AI in research methodologies led him to take a break from academia and set on an entrepreneurial journey for five years, which resulted in the founding of RAx Labs Inc., Delaware, USA. With some bright ex-students of DA-IICT, Prof. Dasgupta built RAx (https:\/\/raxter.io) - an AI-powered online assistant for making literature-review faster and more enriching for young researchers. Coming back from his entrepreneurial stint, Prof. Dasgupta is currently actively engaged in the analysis of less explored but important aspects of \"intelligence\" in LLMs, such as their personalization capabilities, and also designing personalized models that are a lot smaller and more eco-friendly than contemporary LLMs. In his pastime, Prof. Dasgupta loves to cook and debate with students. Prof. Dasgupta did his Ph.D. in Computer Science from the University of Missouri – Kansas City, USA. | Research Areas: natural language processing, knowledge graphs, analysis of large language models | Research Keywords: large, models, ai, graphs, knowledge, analysis, dl, natural, processing, language"
  },
  {
    "faculty_id":58,
    "name":"Sreeja rajendran",
    "faculty_type":"Faculty",
    "education":"PhD (Electrical and Electronics Engineering), Birla Institute of Technology and Science, Pilani, Dubai Campus",
    "bio":"Dr. Sreeja Rajendran completed her PhD in Microelectronics (Hardware Security) from Birla Institute of Technology and Science, Pilani. She joined DA-IICT in October 2021. Prior to joining DA-IICT she has taught in engineering colleges in India, Bahrain and Oman. Her areas of research interest include Hardware Security, MEMS, Quantum Dot Cellular Automata, Test based and Fault Tolerant Circuit Architecture Design. She teaches courses on Digital Logic Design, Computer Organization and VLSI Test. She has authored papers in various international journals and presented works at IEEE and Springer conferences.",
    "specialization_list":[
      "vlsi",
      "embedded systems and mems",
      "hardware security",
      "vlsi test"
    ],
    "research_tags":[
      "systems",
      "vlsi",
      "ai",
      "test",
      "security",
      "mems",
      "embedded",
      "and",
      "hardware"
    ],
    "email":"sreeja_rajendran@dau.ac.in",
    "phone":"07968261707",
    "address":"#3108, FB-3, DA-IICT, Gandhinagar, Gujarat, India – 382007",
    "combined_text":"Name: Sreeja rajendran | Role: Faculty | Education: PhD (Electrical and Electronics Engineering), Birla Institute of Technology and Science, Pilani, Dubai Campus | Biography: Dr. Sreeja Rajendran completed her PhD in Microelectronics (Hardware Security) from Birla Institute of Technology and Science, Pilani. She joined DA-IICT in October 2021. Prior to joining DA-IICT she has taught in engineering colleges in India, Bahrain and Oman. Her areas of research interest include Hardware Security, MEMS, Quantum Dot Cellular Automata, Test based and Fault Tolerant Circuit Architecture Design. She teaches courses on Digital Logic Design, Computer Organization and VLSI Test. She has authored papers in various international journals and presented works at IEEE and Springer conferences. | Research Areas: vlsi, embedded systems and mems, hardware security, vlsi test | Research Keywords: systems, vlsi, ai, test, security, mems, embedded, and, hardware"
  },
  {
    "faculty_id":59,
    "name":"Srimanta mandal",
    "faculty_type":"Faculty",
    "education":"PhD (Computing and Electrical Engineering), IIT Mandi",
    "bio":"Dr. Srimanta Mandal received his Ph.D. from IIT Mandi, India, in 2017. He has been a postdoctoral fellow with the Department of Electrical Engineering, IIT Madras, India, from 2017 to 2018. Since October 2018, he has been with DA-IICT, Gandhinagar, where he is currently an associate professor. During his PhD, he received a travel grant from IIT Mandi for presenting work at the International Conference on Image Processing 2014, Paris, France. So far, he supervised 20 master’s students in their dissertation\/project work and co-supervised 1 PhD student. He has published several articles in national\/international journals and conferences. He received the best paper award (runner-up) at the Indian Conference on Computer Vision, Graphics and Image Processing 2018. He served as a reviewer for various conferences and journals. He is a senior member of IEEE and served as an executive committee member of the IEEE SPS Gujarat chapter from 2019 to 2022. He served as an Advisory Group Member, Department of Technical Education, Gujarat. He is a life member of IUPRAI and ISRS. His research interests include image processing, computer vision, and machine learning.",
    "specialization_list":[
      "image processing",
      "computer vision",
      "machine learning"
    ],
    "research_tags":[
      "vision",
      "ai",
      "computer",
      "machine",
      "machine learning",
      "image",
      "processing",
      "learning",
      "computer vision"
    ],
    "email":"srimanta_mandal@dau.ac.in",
    "phone":"07968261621",
    "address":"# 4203, FB-4, DA-IICT, Gandhinagar, Gujarat, India – 382007",
    "combined_text":"Name: Srimanta mandal | Role: Faculty | Education: PhD (Computing and Electrical Engineering), IIT Mandi | Biography: Dr. Srimanta Mandal received his Ph.D. from IIT Mandi, India, in 2017. He has been a postdoctoral fellow with the Department of Electrical Engineering, IIT Madras, India, from 2017 to 2018. Since October 2018, he has been with DA-IICT, Gandhinagar, where he is currently an associate professor. During his PhD, he received a travel grant from IIT Mandi for presenting work at the International Conference on Image Processing 2014, Paris, France. So far, he supervised 20 master’s students in their dissertation\/project work and co-supervised 1 PhD student. He has published several articles in national\/international journals and conferences. He received the best paper award (runner-up) at the Indian Conference on Computer Vision, Graphics and Image Processing 2018. He served as a reviewer for various conferences and journals. He is a senior member of IEEE and served as an executive committee member of the IEEE SPS Gujarat chapter from 2019 to 2022. He served as an Advisory Group Member, Department of Technical Education, Gujarat. He is a life member of IUPRAI and ISRS. His research interests include image processing, computer vision, and machine learning. | Research Areas: image processing, computer vision, machine learning | Research Keywords: vision, ai, computer, machine, machine learning, image, processing, learning, computer vision"
  },
  {
    "faculty_id":60,
    "name":"Subhasish basak",
    "faculty_type":"Faculty",
    "education":"PhD (Statistics), Indian Statistical Institute, Kolkata",
    "bio":"I completed my Bachelor's and Master's degrees in Statistics with a specialization in Probability from the Indian Statistical Institute (ISI). In 2019, I returned to ISI as a Research Scholar, where I began working in the field of image processing. My research focuses on areas such as denoising, segmentation, and monitoring. In 2025, I joined Dhirubhai Ambani Institute of Information and Communication Technology, where I continue to pursue my research interests and contribute to teaching and academic development.",
    "specialization_list":[
      "image processing",
      "statistical learning",
      "nonparametric methods",
      "decision trees",
      "bayesian techniques",
      "quality monitoring"
    ],
    "research_tags":[
      "decision",
      "techniques",
      "ai",
      "statistical",
      "monitoring",
      "image",
      "bayesian",
      "methods",
      "processing",
      "learning",
      "nonparametric",
      "quality",
      "trees"
    ],
    "email":"subhasish_basak@dau.ac.in",
    "phone":"07968261671",
    "address":"# 3206, FB-3, DAU, Gandhinagar, Gujarat, India – 382007",
    "combined_text":"Name: Subhasish basak | Role: Faculty | Education: PhD (Statistics), Indian Statistical Institute, Kolkata | Biography: I completed my Bachelor's and Master's degrees in Statistics with a specialization in Probability from the Indian Statistical Institute (ISI). In 2019, I returned to ISI as a Research Scholar, where I began working in the field of image processing. My research focuses on areas such as denoising, segmentation, and monitoring. In 2025, I joined Dhirubhai Ambani Institute of Information and Communication Technology, where I continue to pursue my research interests and contribute to teaching and academic development. | Research Areas: image processing, statistical learning, nonparametric methods, decision trees, bayesian techniques, quality monitoring | Research Keywords: decision, techniques, ai, statistical, monitoring, image, bayesian, methods, processing, learning, nonparametric, quality, trees"
  },
  {
    "faculty_id":61,
    "name":"Sudip bera",
    "faculty_type":"Faculty",
    "education":"PhD (Mathematics), Visva-Bharati University, Shantiniketan, West Bengal",
    "bio":"I am an Assistant Professor from 02 nd January, 2023-Present in the Department of Mathematics, DA-IICT, Gandhinagar, Gujrat India. Earlier, I was a Postdoctoral fellow in Mathematics at Harish-Chandra Research Institute from 16 th September, 2022 to 31 st December, 2022. Before that, I was a Visiting fellow in Mathematics at TIFR Mumbai from 2 nd August, 2022 to 15 th September, 2022. My mentor was Prof. Amitava Bhattacharya. Before that, I was a Postdoctoral fellow in Mathematics at IISc, Bangalore from 1 st July, 2019 to 30 th June, 2022. My mentor was Prof. Arvind Ayyer. I finished my Ph.D in Visva-Bharati University. I defended my Ph.D. thesis in June, 2019.",
    "specialization_list":[
      "algebraic graph theory",
      "algebraic combinatorics"
    ],
    "research_tags":[
      "ai",
      "algebraic",
      "combinatorics",
      "graph",
      "theory"
    ],
    "email":"sudip_bera@dau.ac.in",
    "phone":"07968261632",
    "address":"# 4201, FB-4, DA-IICT, Gandhinagar, Gujarat, India – 382007",
    "combined_text":"Name: Sudip bera | Role: Faculty | Education: PhD (Mathematics), Visva-Bharati University, Shantiniketan, West Bengal | Biography: I am an Assistant Professor from 02 nd January, 2023-Present in the Department of Mathematics, DA-IICT, Gandhinagar, Gujrat India. Earlier, I was a Postdoctoral fellow in Mathematics at Harish-Chandra Research Institute from 16 th September, 2022 to 31 st December, 2022. Before that, I was a Visiting fellow in Mathematics at TIFR Mumbai from 2 nd August, 2022 to 15 th September, 2022. My mentor was Prof. Amitava Bhattacharya. Before that, I was a Postdoctoral fellow in Mathematics at IISc, Bangalore from 1 st July, 2019 to 30 th June, 2022. My mentor was Prof. Arvind Ayyer. I finished my Ph.D in Visva-Bharati University. I defended my Ph.D. thesis in June, 2019. | Research Areas: algebraic graph theory, algebraic combinatorics | Research Keywords: ai, algebraic, combinatorics, graph, theory"
  },
  {
    "faculty_id":62,
    "name":"Sujay kadam",
    "faculty_type":"Faculty",
    "education":"PhD (Electrical Engineering), IIT Gandhinagar",
    "bio":"Sujay Kadam is an Assistant Professor in DA-IICT. Prior to his joining at DA-IICT he was a faculty member in the Department of Electrical and Electronics Engineering, NIT Sikkim. NIT Sikkim. He was a Post-Doctoral Fellow in Mechanical Engineering, working with Prof. Harish Palanthandalam-Madapusi, and was associated with the SysIDEA Robotics Lab at IIT Gandhinagar, prior to his teaching appointments, where he worked on ‘learning controllers that show ‘human-like’ learning characteristics. He completed his doctoral work in control theory with a thesis on “Right Invertibility and Relative Degree in Tracking Control: Theory and Tools”, under the supervision of Prof. Harish Palanthandalam-Madapusi at IIT Gandhinagar in Electrical Engineering. He has a background in Instrumentation and Control from his bachelor’s and master’s degrees. His current work and interests focus on the intersecting areas of Control, Neuroscience, and Robotics.",
    "specialization_list":[
      "instrumentation",
      "systems and control theory",
      "human-motor learning",
      "robotics"
    ],
    "research_tags":[
      "systems",
      "instrumentation",
      "robotics",
      "learning",
      "control",
      "and",
      "human-motor",
      "theory"
    ],
    "email":"sujay_kadam@dau.ac.in",
    "phone":"07968261584",
    "address":"# 1210, FB-1, DA-IICT, Gandhinagar, Gujarat, India – 382007",
    "combined_text":"Name: Sujay kadam | Role: Faculty | Education: PhD (Electrical Engineering), IIT Gandhinagar | Biography: Sujay Kadam is an Assistant Professor in DA-IICT. Prior to his joining at DA-IICT he was a faculty member in the Department of Electrical and Electronics Engineering, NIT Sikkim. NIT Sikkim. He was a Post-Doctoral Fellow in Mechanical Engineering, working with Prof. Harish Palanthandalam-Madapusi, and was associated with the SysIDEA Robotics Lab at IIT Gandhinagar, prior to his teaching appointments, where he worked on ‘learning controllers that show ‘human-like’ learning characteristics. He completed his doctoral work in control theory with a thesis on “Right Invertibility and Relative Degree in Tracking Control: Theory and Tools”, under the supervision of Prof. Harish Palanthandalam-Madapusi at IIT Gandhinagar in Electrical Engineering. He has a background in Instrumentation and Control from his bachelor’s and master’s degrees. His current work and interests focus on the intersecting areas of Control, Neuroscience, and Robotics. | Research Areas: instrumentation, systems and control theory, human-motor learning, robotics | Research Keywords: systems, instrumentation, robotics, learning, control, and, human-motor, theory"
  },
  {
    "faculty_id":63,
    "name":"Sunitha v",
    "faculty_type":"Faculty",
    "education":"PhD (Mathematics), IIT Madras",
    "bio":"Dr. Sunitha has her research interest in graph theory, graph algorithms and their applications in Interconnection Networks of HPC, Computer and Communication Networks, Complex Networks",
    "specialization_list":[
      "theory",
      "algorithms (parallel",
      "distributed",
      "dynamic)",
      "applications of graphs"
    ],
    "research_tags":[
      "algorithms",
      "distributed",
      "theory",
      "graphs",
      "applications",
      "dynamic)",
      "(parallel"
    ],
    "email":"v_suni@dau.ac.in",
    "phone":"07968261563",
    "address":"# 1212, FB-1, DA-IICT, Gandhinagar, Gujarat, India – 382007",
    "combined_text":"Name: Sunitha v | Role: Faculty | Education: PhD (Mathematics), IIT Madras | Biography: Dr. Sunitha has her research interest in graph theory, graph algorithms and their applications in Interconnection Networks of HPC, Computer and Communication Networks, Complex Networks | Research Areas: theory, algorithms (parallel, distributed, dynamic), applications of graphs | Research Keywords: algorithms, distributed, theory, graphs, applications, dynamic), (parallel"
  },
  {
    "faculty_id":64,
    "name":"Supantha pandit",
    "faculty_type":"Faculty",
    "education":"PhD (Computer Science), IIT Ropar",
    "bio":"Supantha Pandit is an Assistant Professor at the Dhirubhai Ambani Institute of Information and Communication Technology (DA-IICT), Gandhinagar, Gujarat, India. Before joining DA-IICT, he was a SERB Indo-US Post Doctoral Fellow at the SUNY Stony Brook, New York, USA. He was also a SERB National Post Doctoral Fellow at the Indian Statistical Institute Kolkata, India. He obtained his Ph.D. degree in Computer Science and Engineering from the Indian Institute of Technology Ropar, Punjab, India. His current research concentrates on theoretical computer science, mainly focused on computational geometry, approximation algorithms, distributed network algorithms, and graph algorithms. Personal Website: Click me",
    "specialization_list":[
      "theoretical computer science mainly focused on: computational geometry approximation algorithms distributed network and agent algorithms graph algorithms"
    ],
    "research_tags":[
      "science",
      "algorithms",
      "mainly",
      "agent",
      "ai",
      "approximation",
      "theoretical",
      "computer",
      "geometry",
      "computational",
      "on:",
      "network",
      "distributed",
      "and",
      "graph",
      "focused"
    ],
    "email":"supantha_pandit@dau.ac.in",
    "phone":"07968261546",
    "address":"# 2205, FB-2, DA-IICT, Gandhinagar, Gujarat, India – 382007",
    "combined_text":"Name: Supantha pandit | Role: Faculty | Education: PhD (Computer Science), IIT Ropar | Biography: Supantha Pandit is an Assistant Professor at the Dhirubhai Ambani Institute of Information and Communication Technology (DA-IICT), Gandhinagar, Gujarat, India. Before joining DA-IICT, he was a SERB Indo-US Post Doctoral Fellow at the SUNY Stony Brook, New York, USA. He was also a SERB National Post Doctoral Fellow at the Indian Statistical Institute Kolkata, India. He obtained his Ph.D. degree in Computer Science and Engineering from the Indian Institute of Technology Ropar, Punjab, India. His current research concentrates on theoretical computer science, mainly focused on computational geometry, approximation algorithms, distributed network algorithms, and graph algorithms. Personal Website: Click me | Research Areas: theoretical computer science mainly focused on: computational geometry approximation algorithms distributed network and agent algorithms graph algorithms | Research Keywords: science, algorithms, mainly, agent, ai, approximation, theoretical, computer, geometry, computational, on:, network, distributed, and, graph, focused"
  },
  {
    "faculty_id":65,
    "name":"Tapas kumar maiti",
    "faculty_type":"Faculty",
    "education":"PhD (Electronics & Telecommunication Engineering), Jadavpur University, Kolkata",
    "bio":"Dr. Tapas Kumar Maiti, a former associate professor at Hiroshima University Japan, moved to DA-IICT India where he is a faculty member, from June 2019. He has held various positions at Hiroshima University, Japan; McMaster University, Canada; IIT-Kharagpur, and IIEST-Shibpur, India. He took active role in the development and expansion of teaching and research programs in robotics, automation, embedded-AI at DA-IICT. He became coordinator of MTech program in 2022, played the key role to start BTech Robotics (RAS minor) program, and founded Robotics Lab in 2021. He led a research group in challenging Research and Development activities, in the areas of Intelligent Devices and Systems, Robotics, and Cybernetics, sponsored by various agencies. He has published more than 120 papers in reputed journals and conferences, and also co-authored a book. He received ICMM Excellent Award, IAAM Scientist Medal, and University Gold Medal. He is a member of IEEE, and Life member of Institution of Engineers (India).",
    "specialization_list":[
      "meet dr. tapas kumar maiti: pioneering research in robotics and cybernetics intelligent devices and  systems robotics ai-chip cyber…"
    ],
    "research_tags":[
      "research",
      "kumar",
      "meet",
      "systems",
      "devices",
      "ai",
      "intelligent",
      "pioneering",
      "tapas",
      "cybernetics",
      "maiti:",
      "and",
      "ai-chip",
      "robotics",
      "cyber…",
      "dr."
    ],
    "email":"tapas_kumar@dau.ac.in",
    "phone":"07968261637",
    "address":"# 2206, FB-2, DA-IICT, Gandhinagar, Gujarat, India – 382007",
    "combined_text":"Name: Tapas kumar maiti | Role: Faculty | Education: PhD (Electronics & Telecommunication Engineering), Jadavpur University, Kolkata | Biography: Dr. Tapas Kumar Maiti, a former associate professor at Hiroshima University Japan, moved to DA-IICT India where he is a faculty member, from June 2019. He has held various positions at Hiroshima University, Japan; McMaster University, Canada; IIT-Kharagpur, and IIEST-Shibpur, India. He took active role in the development and expansion of teaching and research programs in robotics, automation, embedded-AI at DA-IICT. He became coordinator of MTech program in 2022, played the key role to start BTech Robotics (RAS minor) program, and founded Robotics Lab in 2021. He led a research group in challenging Research and Development activities, in the areas of Intelligent Devices and Systems, Robotics, and Cybernetics, sponsored by various agencies. He has published more than 120 papers in reputed journals and conferences, and also co-authored a book. He received ICMM Excellent Award, IAAM Scientist Medal, and University Gold Medal. He is a member of IEEE, and Life member of Institution of Engineers (India). | Research Areas: meet dr. tapas kumar maiti: pioneering research in robotics and cybernetics intelligent devices and  systems robotics ai-chip cyber… | Research Keywords: research, kumar, meet, systems, devices, ai, intelligent, pioneering, tapas, cybernetics, maiti:, and, ai-chip, robotics, cyber…, dr."
  },
  {
    "faculty_id":66,
    "name":"Tathagata bandyopadhyay",
    "faculty_type":"Faculty",
    "education":"PhD (Statistics), University of Calcutta, Kolkata",
    "bio":"Dr. Tathagata Bandyopadhyay has been in the academics for more than 35 years. He received his Masters and Ph.D. degrees in Statistics from the University of Calcutta. He spent 21 years in the Department of Statistics, University of Calcutta as a Faculty, next 16 and half years in the Indian Institute of Management Ahmedabad as Professor and also as the Dean (Faculty) for the last few years. He visited\/ taught in the University of Nebraska, The University of Connecticut, The University of Georgia, Iowa State University, Michigan State University, University of Windsor, National University of Singapore, Umea University, University of Birmingham. He delivered invited talks in various universities in India and Abroad. He published more than 50 research articles in journals, besides others in edited volumes and conference proceedings. He is the Editor of Calcutta Statistical Association Bulletin Since 2009, and Member of the Editorial Board of Sankhya. He is a life member of the Calcutta Statistical Association, The Indian Association for Productivity Quality and Reliability and The Indian Statistical Institute.",
    "specialization_list":[
      "statistical inference",
      "survey sampling",
      "discrete data modeling and analysis",
      "applications of statistical methodologies in various fields"
    ],
    "research_tags":[
      "sampling",
      "methodologies",
      "discrete",
      "data",
      "inference",
      "statistical",
      "fields",
      "various",
      "survey",
      "analysis",
      "applications",
      "and",
      "modeling"
    ],
    "email":"tathagata_b@dau.ac.in",
    "phone":"07968261572",
    "address":"Not Available",
    "combined_text":"Name: Tathagata bandyopadhyay | Role: Faculty | Education: PhD (Statistics), University of Calcutta, Kolkata | Biography: Dr. Tathagata Bandyopadhyay has been in the academics for more than 35 years. He received his Masters and Ph.D. degrees in Statistics from the University of Calcutta. He spent 21 years in the Department of Statistics, University of Calcutta as a Faculty, next 16 and half years in the Indian Institute of Management Ahmedabad as Professor and also as the Dean (Faculty) for the last few years. He visited\/ taught in the University of Nebraska, The University of Connecticut, The University of Georgia, Iowa State University, Michigan State University, University of Windsor, National University of Singapore, Umea University, University of Birmingham. He delivered invited talks in various universities in India and Abroad. He published more than 50 research articles in journals, besides others in edited volumes and conference proceedings. He is the Editor of Calcutta Statistical Association Bulletin Since 2009, and Member of the Editorial Board of Sankhya. He is a life member of the Calcutta Statistical Association, The Indian Association for Productivity Quality and Reliability and The Indian Statistical Institute. | Research Areas: statistical inference, survey sampling, discrete data modeling and analysis, applications of statistical methodologies in various fields | Research Keywords: sampling, methodologies, discrete, data, inference, statistical, fields, various, survey, analysis, applications, and, modeling"
  },
  {
    "faculty_id":67,
    "name":"Vinay palaparthy",
    "faculty_type":"Faculty",
    "education":"PhD (Electrical Engineering), IIT Bombay",
    "bio":"Vinay Palaparthy is working as the associate professor in DA-IICT. He has received Ph.D degree from Indian institute of Technology Bombay (IIT Bombay). During the course of his research, he has developed the soil moisture\/ leaf wetness sensors and system for the in-situ agriculture applications. Micro\/Nano soil moisture sensors are developed for the agriculture applications by using carbon nanomaterials like graphene oxide, graphene quantum dots, MOFs, MoS2 and Mxene. He is widely focused on identifying the issues and problem faced in Indian agriculture\/space applications and provide an IT\/ECE based solutions. He has around 7 years of research experience in the field of MEMS and System design. He has 23 international journals, 11 conference papers and 7 patent filed on his work. He has one best paper award in international journal. He is a co-recipient of Millennium Alliance award for the start-up name Proximal Soilsens Technologies Pvt. Ltd, where he is a co-founder and director.",
    "specialization_list":[
      "micro-electro-mechanical systems (mems)",
      "physics of sensors",
      "2d materials",
      "memristor",
      "self-healing system design",
      "embedded system design",
      "iot",
      "ai\/ml"
    ],
    "research_tags":[
      "systems",
      "materials",
      "sensors",
      "design",
      "system",
      "iot",
      "micro-electro-mechanical",
      "(mems)",
      "ai\/ml",
      "physics",
      "embedded",
      "memristor",
      "self-healing"
    ],
    "email":"vinay_shrinivas@dau.ac.in",
    "phone":"07968261677",
    "address":"# 1208, FB-1, DA-IICT, Gandhinagar, Gujarat, India – 382007",
    "combined_text":"Name: Vinay palaparthy | Role: Faculty | Education: PhD (Electrical Engineering), IIT Bombay | Biography: Vinay Palaparthy is working as the associate professor in DA-IICT. He has received Ph.D degree from Indian institute of Technology Bombay (IIT Bombay). During the course of his research, he has developed the soil moisture\/ leaf wetness sensors and system for the in-situ agriculture applications. Micro\/Nano soil moisture sensors are developed for the agriculture applications by using carbon nanomaterials like graphene oxide, graphene quantum dots, MOFs, MoS2 and Mxene. He is widely focused on identifying the issues and problem faced in Indian agriculture\/space applications and provide an IT\/ECE based solutions. He has around 7 years of research experience in the field of MEMS and System design. He has 23 international journals, 11 conference papers and 7 patent filed on his work. He has one best paper award in international journal. He is a co-recipient of Millennium Alliance award for the start-up name Proximal Soilsens Technologies Pvt. Ltd, where he is a co-founder and director. | Research Areas: micro-electro-mechanical systems (mems), physics of sensors, 2d materials, memristor, self-healing system design, embedded system design, iot, ai\/ml | Research Keywords: systems, materials, sensors, design, system, iot, micro-electro-mechanical, (mems), ai\/ml, physics, embedded, memristor, self-healing"
  },
  {
    "faculty_id":68,
    "name":"Yash agrawal",
    "faculty_type":"Faculty",
    "education":"PhD (Electronics & Communication), NIT Hamirpur",
    "bio":"Dr. Yash Agrawal received his Ph.D. and M.Tech. Degrees in VLSI Design Automation and Techniques in E&CE Department from National Institute of Technology, Hamirpur, Himachal Pradesh, India. Dr. Yash has been expert and distinguished guest at various places. He is Editor and Reviewer of several reputed Journals. He has been Secretary and Coordiantor of various forums and events. He has organized several workshops and part of the organizing committee in various Trainings, Seminars, and Conferences. He has been the Chairman and awarded with best forum member of IETE Forum at KITS Ramtek, Nagpur Division during 2008-2009. He has been awarded with prestigious IETEâ€”K S Krishnan Memorial Award-2017 for the Best System Oriented research paper. He achieved third place in All India Mentor Graphics design contest held at Bangalore, India in 2011. He has received 2nd Runner up and Cash Prize of Rs. 50,000\/- in All India Mentor Graphics Design Contest held at Bangalore. He has several publications in Book Chapters of Springer, Journals including IEEE Transactions in Electromagnetic Compatibility, Nanotechnology, Springer, Taylor and Francis and several national and international reputed Conferences.",
    "specialization_list":[
      "vlsi",
      "nanotechnology",
      "numerical method techniques--fdtd",
      "design techniques and modelling schemes of high-speed on-chip vlsi interconnects",
      "modeling and simulation schemes",
      "advanced devices and their modeling",
      "analysis"
    ],
    "research_tags":[
      "on-chip",
      "devices",
      "analysis",
      "high-speed",
      "advanced",
      "techniques--fdtd",
      "techniques",
      "nanotechnology",
      "design",
      "interconnects",
      "numerical",
      "modeling",
      "and",
      "method",
      "vlsi",
      "ai",
      "simulation",
      "schemes",
      "their",
      "modelling"
    ],
    "email":"yash_agrawal@dau.ac.in,mr.yashagrawal@gmail.com",
    "phone":"079682616299882114669",
    "address":"# 1101, FB-1, DA-IICT, Gandhinagar, Gujarat, India – 382007",
    "combined_text":"Name: Yash agrawal | Role: Faculty | Education: PhD (Electronics & Communication), NIT Hamirpur | Biography: Dr. Yash Agrawal received his Ph.D. and M.Tech. Degrees in VLSI Design Automation and Techniques in E&CE Department from National Institute of Technology, Hamirpur, Himachal Pradesh, India. Dr. Yash has been expert and distinguished guest at various places. He is Editor and Reviewer of several reputed Journals. He has been Secretary and Coordiantor of various forums and events. He has organized several workshops and part of the organizing committee in various Trainings, Seminars, and Conferences. He has been the Chairman and awarded with best forum member of IETE Forum at KITS Ramtek, Nagpur Division during 2008-2009. He has been awarded with prestigious IETEâ€”K S Krishnan Memorial Award-2017 for the Best System Oriented research paper. He achieved third place in All India Mentor Graphics design contest held at Bangalore, India in 2011. He has received 2nd Runner up and Cash Prize of Rs. 50,000\/- in All India Mentor Graphics Design Contest held at Bangalore. He has several publications in Book Chapters of Springer, Journals including IEEE Transactions in Electromagnetic Compatibility, Nanotechnology, Springer, Taylor and Francis and several national and international reputed Conferences. | Research Areas: vlsi, nanotechnology, numerical method techniques--fdtd, design techniques and modelling schemes of high-speed on-chip vlsi interconnects, modeling and simulation schemes, advanced devices and their modeling, analysis | Research Keywords: on-chip, devices, analysis, high-speed, advanced, techniques--fdtd, techniques, nanotechnology, design, interconnects, numerical, modeling, and, method, vlsi, ai, simulation, schemes, their, modelling"
  },
  {
    "faculty_id":69,
    "name":"Yash vasavada",
    "faculty_type":"Faculty",
    "education":"PhD (Electrical Engineering), Virginia Polytechnic Institute and State University, USA",
    "bio":"Yash Vasavada is currently a Professor at DAIICT, and he works in the areas of communication system design and development and application of machine learning algorithms to communications and signal processing. He has over twenty years of experience at Hughes Networks systems in Germantown, Maryland, USA, where he has worked on design, development and deployment of a number of GEO, MEO and LEO satellite systems. At Hughes, Yash has published several journal and conference papers, and he has been granted twelve US Patents. Yash has obtained B. E. degree in Electronics and Communications from L. D. Engineering College, Ahmedabad, and M.S. and Ph.D. degree from Virginia Polytechnic Institute and State University (Virginia Tech) in USA.",
    "specialization_list":[
      "communication",
      "signal processing",
      "machine learning meet prof. yash vasavada: a passionate researcher in wireless communications and signal processing …"
    ],
    "research_tags":[
      "yash",
      "meet",
      "researcher",
      "communication",
      "signal processing",
      "signal",
      "ai",
      "machine",
      "prof.",
      "machine learning",
      "wireless",
      "vasavada:",
      "processing",
      "learning",
      "passionate",
      "and",
      "communications"
    ],
    "email":"yash_vasavada@dau.ac.in",
    "phone":"07968261634",
    "address":"# 1224, FB-1, DA-IICT, Gandhinagar, Gujarat, India – 382007",
    "combined_text":"Name: Yash vasavada | Role: Faculty | Education: PhD (Electrical Engineering), Virginia Polytechnic Institute and State University, USA | Biography: Yash Vasavada is currently a Professor at DAIICT, and he works in the areas of communication system design and development and application of machine learning algorithms to communications and signal processing. He has over twenty years of experience at Hughes Networks systems in Germantown, Maryland, USA, where he has worked on design, development and deployment of a number of GEO, MEO and LEO satellite systems. At Hughes, Yash has published several journal and conference papers, and he has been granted twelve US Patents. Yash has obtained B. E. degree in Electronics and Communications from L. D. Engineering College, Ahmedabad, and M.S. and Ph.D. degree from Virginia Polytechnic Institute and State University (Virginia Tech) in USA. | Research Areas: communication, signal processing, machine learning meet prof. yash vasavada: a passionate researcher in wireless communications and signal processing … | Research Keywords: yash, meet, researcher, communication, signal processing, signal, ai, machine, prof., machine learning, wireless, vasavada:, processing, learning, passionate, and, communications"
  },
  {
    "faculty_id":70,
    "name":"Abhijit mukherjee",
    "faculty_type":"Adjunct Faculty",
    "education":"MBA in Systems from Vinayaka Mission University",
    "bio":"Not Available",
    "specialization_list":[
      "enterprise computing and sap systems (is-u",
      "s\/4 hana)",
      "data privacy and compliance (dpdp act 2023)",
      "it strategy",
      "governance",
      "and data analytics"
    ],
    "research_tags":[
      "systems",
      "computing",
      "data",
      "2023)",
      "sap",
      "strategy",
      "enterprise",
      "hana)",
      "(is-u",
      "privacy",
      "act",
      "analytics",
      "compliance",
      "governance",
      "and",
      "(dpdp",
      "s\/4"
    ],
    "email":"abhijit_mukherjee@dau.ac.in",
    "phone":"Not Available",
    "address":"Not Available",
    "combined_text":"Name: Abhijit mukherjee | Role: Adjunct Faculty | Education: MBA in Systems from Vinayaka Mission University | Biography: Not Available | Research Areas: enterprise computing and sap systems (is-u, s\/4 hana), data privacy and compliance (dpdp act 2023), it strategy, governance, and data analytics | Research Keywords: systems, computing, data, 2023), sap, strategy, enterprise, hana), (is-u, privacy, act, analytics, compliance, governance, and, (dpdp, s\/4"
  },
  {
    "faculty_id":71,
    "name":"Aditi nath sarkar",
    "faculty_type":"Adjunct Faculty",
    "education":"MA (South Asian Languages and Civilizations), University of Chicago, USA",
    "bio":"Not Available",
    "specialization_list":[
      "literature",
      "religious",
      "cultural history; south asian civilization studies"
    ],
    "research_tags":[
      "civilization",
      "literature",
      "south",
      "history;",
      "asian",
      "cultural",
      "religious",
      "studies"
    ],
    "email":"aditinath_sarkar@dau.ac.in",
    "phone":"Not Available",
    "address":"Not Available",
    "combined_text":"Name: Aditi nath sarkar | Role: Adjunct Faculty | Education: MA (South Asian Languages and Civilizations), University of Chicago, USA | Biography: Not Available | Research Areas: literature, religious, cultural history; south asian civilization studies | Research Keywords: civilization, literature, south, history;, asian, cultural, religious, studies"
  },
  {
    "faculty_id":72,
    "name":"Ajeet kumar singh",
    "faculty_type":"Adjunct Faculty",
    "education":"MS by Research in Computer Science and Engineering",
    "bio":"Not Available",
    "specialization_list":[
      "computer vision",
      "natural language processing",
      "adversarial machine learning"
    ],
    "research_tags":[
      "vision",
      "computer",
      "machine",
      "adversarial",
      "natural",
      "processing",
      "learning",
      "language"
    ],
    "email":"ajeetkumar_singh@dau.ac.in",
    "phone":"Not Available",
    "address":"Not Available",
    "combined_text":"Name: Ajeet kumar singh | Role: Adjunct Faculty | Education: MS by Research in Computer Science and Engineering | Biography: Not Available | Research Areas: computer vision, natural language processing, adversarial machine learning | Research Keywords: vision, computer, machine, adversarial, natural, processing, learning, language"
  },
  {
    "faculty_id":73,
    "name":"Amishal modi",
    "faculty_type":"Adjunct Faculty",
    "education":"PhD (English), Gujarat University",
    "bio":"Not Available",
    "specialization_list":[
      "indian literature",
      "the english novel",
      "sexuality studies",
      "19th century literature"
    ],
    "research_tags":[
      "english",
      "literature",
      "novel",
      "the",
      "sexuality",
      "19th",
      "century",
      "indian",
      "studies"
    ],
    "email":"amishal_modi@dau.ac.in",
    "phone":"07968261594",
    "address":"Not Available",
    "combined_text":"Name: Amishal modi | Role: Adjunct Faculty | Education: PhD (English), Gujarat University | Biography: Not Available | Research Areas: indian literature, the english novel, sexuality studies, 19th century literature | Research Keywords: english, literature, novel, the, sexuality, 19th, century, indian, studies"
  },
  {
    "faculty_id":74,
    "name":"Anjan ghosh",
    "faculty_type":"Adjunct Faculty",
    "education":"PhD (Electrical Engineering), Carnegie Mellon University, Pittsburgh, Pennsylvania",
    "bio":"Dr. Anjan K Ghosh has 35 years of research and teaching experience in the areas of optical information processing, optical communications and photonic sensors. He obtained his PhD in Electrical Eng. in 1984 from Carnegie-Mellon Univ., Pittsburgh and his MS from the SUNY at Stony Brook. He is an alumnus of IIT Kharagpur, India. At present, he is a Professor in DA-IICT, Gandhinagar, India. Dr. Ghosh was a member of technical staff in AT&T Bell Laboratories for 2 years. Then he served as a faculty member in the Univ. of Iowa, Iowa City, USA, IIT Kanpur, India, Nanyang Tech. Univ., Singapore, the University of Oklahoma, Tulsa, USA and DA-IICT, Gandhinagar, India. Dr. Ghosh has served as the Vice Chancellor of Tripura (Central) University in Agartala, Tripura, India for 5.5 years. He was the Head of the Dept. of Electrical Eng., Adv. Center for Electronic Sciences, Laser Tech. Program and the Center for Laser Tech., all at IIT Kanpur. He published over 160 papers in journals and conference proceedings and delivered several invited talks. He is a Senior Member of IEEE, a fellow of the IETE(India), IE (India), and the Optical Soc. of India and a member of SPIE, and OSA. He is also a member of the honor societies: Eta-Kappa-Nu and Sigma-Xi in USA.",
    "specialization_list":[
      "optical communication - fiber optic and free space",
      "photonic devices and subsystems",
      "sensors",
      "image and signal processing",
      "nonlinear systems and chaos",
      "system dynamics modelling of education"
    ],
    "research_tags":[
      "space",
      "systems",
      "education",
      "communication",
      "devices",
      "dynamics",
      "optic",
      "fiber",
      "sensors",
      "free",
      "subsystems",
      "system",
      "and",
      "image",
      "processing",
      "photonic",
      "optical",
      "nonlinear",
      "signal",
      "ai",
      "chaos",
      "modelling"
    ],
    "email":"anjan_ghosh@dau.ac.in",
    "phone":"07968261645",
    "address":"# 1111, FB-1, DA-IICT, Gandhinagar, Gujarat, India – 382007",
    "combined_text":"Name: Anjan ghosh | Role: Adjunct Faculty | Education: PhD (Electrical Engineering), Carnegie Mellon University, Pittsburgh, Pennsylvania | Biography: Dr. Anjan K Ghosh has 35 years of research and teaching experience in the areas of optical information processing, optical communications and photonic sensors. He obtained his PhD in Electrical Eng. in 1984 from Carnegie-Mellon Univ., Pittsburgh and his MS from the SUNY at Stony Brook. He is an alumnus of IIT Kharagpur, India. At present, he is a Professor in DA-IICT, Gandhinagar, India. Dr. Ghosh was a member of technical staff in AT&T Bell Laboratories for 2 years. Then he served as a faculty member in the Univ. of Iowa, Iowa City, USA, IIT Kanpur, India, Nanyang Tech. Univ., Singapore, the University of Oklahoma, Tulsa, USA and DA-IICT, Gandhinagar, India. Dr. Ghosh has served as the Vice Chancellor of Tripura (Central) University in Agartala, Tripura, India for 5.5 years. He was the Head of the Dept. of Electrical Eng., Adv. Center for Electronic Sciences, Laser Tech. Program and the Center for Laser Tech., all at IIT Kanpur. He published over 160 papers in journals and conference proceedings and delivered several invited talks. He is a Senior Member of IEEE, a fellow of the IETE(India), IE (India), and the Optical Soc. of India and a member of SPIE, and OSA. He is also a member of the honor societies: Eta-Kappa-Nu and Sigma-Xi in USA. | Research Areas: optical communication - fiber optic and free space, photonic devices and subsystems, sensors, image and signal processing, nonlinear systems and chaos, system dynamics modelling of education | Research Keywords: space, systems, education, communication, devices, dynamics, optic, fiber, sensors, free, subsystems, system, and, image, processing, photonic, optical, nonlinear, signal, ai, chaos, modelling"
  },
  {
    "faculty_id":75,
    "name":"Binay bhushan chakrabarti",
    "faculty_type":"Adjunct Faculty",
    "education":"PhD (Economics), Jadavpur University Calcutta",
    "bio":"Not Available",
    "specialization_list":[
      "finance"
    ],
    "research_tags":[
      "finance"
    ],
    "email":"binaybhushan_chakrabarti@dau.ac.in",
    "phone":"Not Available",
    "address":"Not Available",
    "combined_text":"Name: Binay bhushan chakrabarti | Role: Adjunct Faculty | Education: PhD (Economics), Jadavpur University Calcutta | Biography: Not Available | Research Areas: finance | Research Keywords: finance"
  },
  {
    "faculty_id":76,
    "name":"Deepak ghodgaonkar",
    "faculty_type":"Adjunct Faculty",
    "education":"PhD (Electrical Engineering), University of Utah, USA",
    "bio":"Dr. Ghodgaonkar specialize in research areas of microwave nondestructive testing of composite materials and microwave imaging of human body. He has published more than 140 papers in reputed journal and conference proceedings. He supervised thesis work 4 PhD students and many MTech\/BTech students. Also, he is a professor involved in teaching and research in areas of applied electromagnetics for more than 30 years. He has organized more than 14 international conferences. He is Senior Member IEEE, Fellow IETE and Fellow IEM, Malaysia.",
    "specialization_list":[
      "rf and microwave engineering",
      "microwave nondestructive testing of composite materials",
      "biomedical applications of microwaves",
      "electromagnetic imaging of complex dielectric bodies",
      "microwave measurements and characterization of nonlinear dielectric…"
    ],
    "research_tags":[
      "microwaves",
      "biomedical",
      "complex",
      "applications",
      "dielectric…",
      "engineering",
      "characterization",
      "dielectric",
      "and",
      "bodies",
      "materials",
      "nondestructive",
      "nonlinear",
      "testing",
      "microwave",
      "electromagnetic",
      "composite",
      "imaging",
      "measurements"
    ],
    "email":"deepak_ghodgaonkar@dau.ac.in",
    "phone":"07968261623",
    "address":"# 1103, FB-1, DA-IICT, Gandhinagar, Gujarat, India – 382007",
    "combined_text":"Name: Deepak ghodgaonkar | Role: Adjunct Faculty | Education: PhD (Electrical Engineering), University of Utah, USA | Biography: Dr. Ghodgaonkar specialize in research areas of microwave nondestructive testing of composite materials and microwave imaging of human body. He has published more than 140 papers in reputed journal and conference proceedings. He supervised thesis work 4 PhD students and many MTech\/BTech students. Also, he is a professor involved in teaching and research in areas of applied electromagnetics for more than 30 years. He has organized more than 14 international conferences. He is Senior Member IEEE, Fellow IETE and Fellow IEM, Malaysia. | Research Areas: rf and microwave engineering, microwave nondestructive testing of composite materials, biomedical applications of microwaves, electromagnetic imaging of complex dielectric bodies, microwave measurements and characterization of nonlinear dielectric… | Research Keywords: microwaves, biomedical, complex, applications, dielectric…, engineering, characterization, dielectric, and, bodies, materials, nondestructive, nonlinear, testing, microwave, electromagnetic, composite, imaging, measurements"
  },
  {
    "faculty_id":77,
    "name":"Dhaval joshi",
    "faculty_type":"Adjunct Faculty",
    "education":"Masters in Design (PGDPD): National Institute of Design, Gandhinagar",
    "bio":"Not Available",
    "specialization_list":[
      "design research",
      "artificial intelligence",
      "gaming",
      "customer engagement"
    ],
    "research_tags":[
      "research",
      "gaming",
      "intelligence",
      "engagement",
      "design",
      "customer",
      "artificial"
    ],
    "email":"dhaval_joshi@dau.ac.in",
    "phone":"Not Available",
    "address":"Not Available",
    "combined_text":"Name: Dhaval joshi | Role: Adjunct Faculty | Education: Masters in Design (PGDPD): National Institute of Design, Gandhinagar | Biography: Not Available | Research Areas: design research, artificial intelligence, gaming, customer engagement | Research Keywords: research, gaming, intelligence, engagement, design, customer, artificial"
  },
  {
    "faculty_id":78,
    "name":"Dipankar nagchoudhuri",
    "faculty_type":"Adjunct Faculty",
    "education":"PhD (Electrical Engineering), Michigan State University, USA",
    "bio":"Not Available",
    "specialization_list":[
      "vlsi design",
      "cmos circuits and technology",
      "biomedical signal processing chip design"
    ],
    "research_tags":[
      "vlsi",
      "chip",
      "signal",
      "cmos",
      "design",
      "technology",
      "circuits",
      "biomedical",
      "processing",
      "and"
    ],
    "email":"dnc@dau.ac.in",
    "phone":"07968261654",
    "address":"Not Available",
    "combined_text":"Name: Dipankar nagchoudhuri | Role: Adjunct Faculty | Education: PhD (Electrical Engineering), Michigan State University, USA | Biography: Not Available | Research Areas: vlsi design, cmos circuits and technology, biomedical signal processing chip design | Research Keywords: vlsi, chip, signal, cmos, design, technology, circuits, biomedical, processing, and"
  },
  {
    "faculty_id":79,
    "name":"Gangeya mukherji",
    "faculty_type":"Adjunct Faculty",
    "education":"PhD (The Vision of India in Tagore and Vivekananda), University of Allahabad",
    "bio":"Not Available",
    "specialization_list":[
      "intellectual history",
      "19th century india",
      "post-colonialism",
      "vivekananda",
      "tagore",
      "gandhi",
      "mahabharata."
    ],
    "research_tags":[
      "intellectual",
      "post-colonialism",
      "india",
      "gandhi",
      "tagore",
      "history",
      "19th",
      "vivekananda",
      "century",
      "mahabharata."
    ],
    "email":"gangeya_mukherji@dau.ac.in",
    "phone":"07968261683",
    "address":"Not Available",
    "combined_text":"Name: Gangeya mukherji | Role: Adjunct Faculty | Education: PhD (The Vision of India in Tagore and Vivekananda), University of Allahabad | Biography: Not Available | Research Areas: intellectual history, 19th century india, post-colonialism, vivekananda, tagore, gandhi, mahabharata. | Research Keywords: intellectual, post-colonialism, india, gandhi, tagore, history, 19th, vivekananda, century, mahabharata."
  },
  {
    "faculty_id":80,
    "name":"Jayprakash lalchandani",
    "faculty_type":"Adjunct Faculty",
    "education":"PhD (Computer Science), IIT Kharagpur",
    "bio":"Not Available",
    "specialization_list":[
      "software engineering"
    ],
    "research_tags":[
      "engineering",
      "software"
    ],
    "email":"jayprakash_lalchandani@dau.ac.in",
    "phone":"07968261610",
    "address":"Not Available",
    "combined_text":"Name: Jayprakash lalchandani | Role: Adjunct Faculty | Education: PhD (Computer Science), IIT Kharagpur | Biography: Not Available | Research Areas: software engineering | Research Keywords: engineering, software"
  },
  {
    "faculty_id":81,
    "name":"K narayana chandran",
    "faculty_type":"Adjunct Faculty",
    "education":"PhD, Indian Institute of Technology Bombay",
    "bio":"Not Available",
    "specialization_list":[
      "major areas of specialization: english poetry and theory; english pedagogy and politics of the discipline; indian and western narrative traditions minor specialization: translation; allusion",
      "intertextuality and interge…"
    ],
    "research_tags":[
      "interge…",
      "english",
      "intertextuality",
      "translation;",
      "poetry",
      "the",
      "discipline;",
      "minor",
      "theory;",
      "narrative",
      "major",
      "and",
      "traditions",
      "western",
      "pedagogy",
      "specialization:",
      "allusion",
      "politics",
      "areas",
      "indian"
    ],
    "email":"knarayana_chandran@dau.ac.in",
    "phone":"Not Available",
    "address":"Not Available",
    "combined_text":"Name: K narayana chandran | Role: Adjunct Faculty | Education: PhD, Indian Institute of Technology Bombay | Biography: Not Available | Research Areas: major areas of specialization: english poetry and theory; english pedagogy and politics of the discipline; indian and western narrative traditions minor specialization: translation; allusion, intertextuality and interge… | Research Keywords: interge…, english, intertextuality, translation;, poetry, the, discipline;, minor, theory;, narrative, major, and, traditions, western, pedagogy, specialization:, allusion, politics, areas, indian"
  },
  {
    "faculty_id":82,
    "name":"Kalgi gandhi",
    "faculty_type":"Adjunct Faculty",
    "education":"PhD - Thesis Submitted, DA-IICT Gandhinagar",
    "bio":"Not Available",
    "specialization_list":[
      "database management",
      "distributed database management",
      "edge computing"
    ],
    "research_tags":[
      "management",
      "computing",
      "distributed",
      "edge",
      "database"
    ],
    "email":"kalgi_gandhi@dau.ac.in",
    "phone":"Not Available",
    "address":"Not Available",
    "combined_text":"Name: Kalgi gandhi | Role: Adjunct Faculty | Education: PhD - Thesis Submitted, DA-IICT Gandhinagar | Biography: Not Available | Research Areas: database management, distributed database management, edge computing | Research Keywords: management, computing, distributed, edge, database"
  },
  {
    "faculty_id":83,
    "name":"Kripabandhu ghosh",
    "faculty_type":"Adjunct Faculty",
    "education":"",
    "bio":"Not Available",
    "specialization_list":[
      "information retrieval\/data mining\/ai on legal domain"
    ],
    "research_tags":[
      "information",
      "mining\/ai",
      "domain",
      "legal",
      "retrieval\/data"
    ],
    "email":"kripaghosh@iiserkol.ac.in",
    "phone":"Not Available",
    "address":"Department of Computational and Data Sciences, Indian Institute of Science Education and Research (IISER) Kolkata",
    "combined_text":"Name: Kripabandhu ghosh | Role: Adjunct Faculty | Education:  | Biography: Not Available | Research Areas: information retrieval\/data mining\/ai on legal domain | Research Keywords: information, mining\/ai, domain, legal, retrieval\/data"
  },
  {
    "faculty_id":84,
    "name":"Kuntala dasgupta",
    "faculty_type":"Adjunct Faculty",
    "education":"BSc, Calcutta University",
    "bio":"Not Available",
    "specialization_list":[
      "rabindra sangeet",
      "north indian",
      "classical",
      "india film music and history"
    ],
    "research_tags":[
      "rabindra",
      "classical",
      "music",
      "india",
      "film",
      "north",
      "history",
      "sangeet",
      "indian",
      "and"
    ],
    "email":"sdg.dau@gmail.com",
    "phone":"Not Available",
    "address":"Not Available",
    "combined_text":"Name: Kuntala dasgupta | Role: Adjunct Faculty | Education: BSc, Calcutta University | Biography: Not Available | Research Areas: rabindra sangeet, north indian, classical, india film music and history | Research Keywords: rabindra, classical, music, india, film, north, history, sangeet, indian, and"
  },
  {
    "faculty_id":85,
    "name":"Nandini banerjee",
    "faculty_type":"Adjunct Faculty",
    "education":"MA, M.Phil, PhD (International Economics), MA psychology in Psychotherapy and Counselling",
    "bio":"I have done MPhil, PhD in Economics. with specialization in ” India ASEAN Trade Relations.” I have also done MA in Psychology. Have 23+ years of Teaching and Counselling experience. I have worked in different projects in TISS Mumbai. Have conducted workshops, sessions in Stress Management, Guided Meditation, Self-Grooming and preparing students for placement for HR interviews, Emotional Intelligence, 6 Thinking Hats. Work as Psychotherapist and Counselling Psychologist. I am a passionate learner, having good communication skills, Peoples skill and problem solving skills.",
    "specialization_list":[
      "economics",
      "psychology",
      "soft skills. certifications in basic counseling course – counseling development program (cdp)",
      "advanced counseling course (adp)",
      "theoretical and experiential training on fundamentals of cognitive behavior therapy (cbt)…"
    ],
    "research_tags":[
      "theoretical",
      "training",
      "therapy",
      "cognitive",
      "advanced",
      "course",
      "psychology",
      "(cbt)…",
      "basic",
      "and",
      "soft",
      "development",
      "certifications",
      "economics",
      "(cdp)",
      "fundamentals",
      "program",
      "(adp)",
      "counseling",
      "ai",
      "behavior",
      "experiential",
      "skills."
    ],
    "email":"nandini_banerjee@dau.ac.in",
    "phone":"07968261620",
    "address":"# 2110, FB-2, DA-IICT, Gandhinagar, Gujarat, India – 382007",
    "combined_text":"Name: Nandini banerjee | Role: Adjunct Faculty | Education: MA, M.Phil, PhD (International Economics), MA psychology in Psychotherapy and Counselling | Biography: I have done MPhil, PhD in Economics. with specialization in ” India ASEAN Trade Relations.” I have also done MA in Psychology. Have 23+ years of Teaching and Counselling experience. I have worked in different projects in TISS Mumbai. Have conducted workshops, sessions in Stress Management, Guided Meditation, Self-Grooming and preparing students for placement for HR interviews, Emotional Intelligence, 6 Thinking Hats. Work as Psychotherapist and Counselling Psychologist. I am a passionate learner, having good communication skills, Peoples skill and problem solving skills. | Research Areas: economics, psychology, soft skills. certifications in basic counseling course – counseling development program (cdp), advanced counseling course (adp), theoretical and experiential training on fundamentals of cognitive behavior therapy (cbt)… | Research Keywords: theoretical, training, therapy, cognitive, advanced, course, psychology, (cbt)…, basic, and, soft, development, certifications, economics, (cdp), fundamentals, program, (adp), counseling, ai, behavior, experiential, skills."
  },
  {
    "faculty_id":86,
    "name":"Nikita desai",
    "faculty_type":"Adjunct Faculty",
    "education":"PhD (Design), DA-IICT Gandhinagar",
    "bio":"I received my M.Des and Ph.D from DAIICT, and have been teaching courses as an adjunct faculty with the M.Des program since 2017. I am also the Co-Founder and Creative Technology Director of Myth Interactives, a design agency specializing in the creation of Interactive and Immersive Experiences for Cultural Spaces since 2009.",
    "specialization_list":[
      "interaction design immersive experience design"
    ],
    "research_tags":[
      "ai",
      "design",
      "interaction",
      "experience",
      "immersive"
    ],
    "email":"nikita_d@dau.ac.in,nikitadesai82@gmail.com",
    "phone":"919825169337",
    "address":"Not Available",
    "combined_text":"Name: Nikita desai | Role: Adjunct Faculty | Education: PhD (Design), DA-IICT Gandhinagar | Biography: I received my M.Des and Ph.D from DAIICT, and have been teaching courses as an adjunct faculty with the M.Des program since 2017. I am also the Co-Founder and Creative Technology Director of Myth Interactives, a design agency specializing in the creation of Interactive and Immersive Experiences for Cultural Spaces since 2009. | Research Areas: interaction design immersive experience design | Research Keywords: ai, design, interaction, experience, immersive"
  },
  {
    "faculty_id":87,
    "name":"Parth mehta",
    "faculty_type":"Adjunct Faculty",
    "education":"PhD (Information and Communication Technology), DA-IICT Gandhinagar",
    "bio":"Not Available",
    "specialization_list":[
      "natural language processing",
      "large language models",
      "information retrieval",
      "deep learning"
    ],
    "research_tags":[
      "large",
      "models",
      "retrieval",
      "information",
      "deep",
      "natural",
      "processing",
      "learning",
      "language"
    ],
    "email":"parth_mehta@dau.ac.in",
    "phone":"Not Available",
    "address":"Not Available",
    "combined_text":"Name: Parth mehta | Role: Adjunct Faculty | Education: PhD (Information and Communication Technology), DA-IICT Gandhinagar | Biography: Not Available | Research Areas: natural language processing, large language models, information retrieval, deep learning | Research Keywords: large, models, retrieval, information, deep, natural, processing, learning, language"
  },
  {
    "faculty_id":88,
    "name":"Prashant grover",
    "faculty_type":"Adjunct Faculty",
    "education":"B.Sc (Hons) - Animation & Multi., Birla Institute of Technology",
    "bio":"I am a Artist professionally working in this industry for past 11 years. I am specialized in Motion graphics Animation Compositing, character design and storyboarding. I thrive on learning new things everyday and make an effort to explore different aspects of a job just to be more versatile.",
    "specialization_list":[
      "animation"
    ],
    "research_tags":[
      "animation"
    ],
    "email":"prashant_grover@dau.ac.in",
    "phone":"Not Available",
    "address":"Not Available",
    "combined_text":"Name: Prashant grover | Role: Adjunct Faculty | Education: B.Sc (Hons) - Animation & Multi., Birla Institute of Technology | Biography: I am a Artist professionally working in this industry for past 11 years. I am specialized in Motion graphics Animation Compositing, character design and storyboarding. I thrive on learning new things everyday and make an effort to explore different aspects of a job just to be more versatile. | Research Areas: animation | Research Keywords: animation"
  },
  {
    "faculty_id":89,
    "name":"Prosenjit ganguly",
    "faculty_type":"Adjunct Faculty",
    "education":"4yr Diploma (now B.Des) in Animation Film Design, NID",
    "bio":"Not Available",
    "specialization_list":[
      "animation film making",
      "screenwriting",
      "story-telling",
      "character design",
      "photography",
      "illustration",
      "voice acting"
    ],
    "research_tags":[
      "voice",
      "character",
      "design",
      "animation",
      "film",
      "acting",
      "illustration",
      "making",
      "story-telling",
      "screenwriting",
      "photography"
    ],
    "email":"prosenjit_ganguly@dau.ac.in",
    "phone":"Not Available",
    "address":"Not Available",
    "combined_text":"Name: Prosenjit ganguly | Role: Adjunct Faculty | Education: 4yr Diploma (now B.Des) in Animation Film Design, NID | Biography: Not Available | Research Areas: animation film making, screenwriting, story-telling, character design, photography, illustration, voice acting | Research Keywords: voice, character, design, animation, film, acting, illustration, making, story-telling, screenwriting, photography"
  },
  {
    "faculty_id":90,
    "name":"Rudranil das",
    "faculty_type":"Adjunct Faculty",
    "education":"Post Graduate Diploma in Textile Design, National Institute of Design (NID), Ahmedabad",
    "bio":"Not Available",
    "specialization_list":[
      "photography",
      "traveling",
      "research & documentation on various crafts"
    ],
    "research_tags":[
      "research",
      "various",
      "traveling",
      "documentation",
      "crafts",
      "photography"
    ],
    "email":"rudranil_das@dau.ac.in",
    "phone":"Not Available",
    "address":"Not Available",
    "combined_text":"Name: Rudranil das | Role: Adjunct Faculty | Education: Post Graduate Diploma in Textile Design, National Institute of Design (NID), Ahmedabad | Biography: Not Available | Research Areas: photography, traveling, research & documentation on various crafts | Research Keywords: research, various, traveling, documentation, crafts, photography"
  },
  {
    "faculty_id":91,
    "name":"Samit bhattacharya",
    "faculty_type":"Adjunct Faculty",
    "education":"PhD (Computer Science & Engineering), IIT Kharagpur",
    "bio":"Not Available",
    "specialization_list":[
      "extended reality (virtual",
      "augmented & mixed reality) affective & ubiquitous systems mobile & wearable systems & interactions ict applications in education",
      "agriculture",
      "& h…"
    ],
    "research_tags":[
      "systems",
      "education",
      "(virtual",
      "reality)",
      "interactions",
      "mobile",
      "ubiquitous",
      "mixed",
      "augmented",
      "ict",
      "applications",
      "extended",
      "wearable",
      "reality",
      "affective",
      "agriculture"
    ],
    "email":"samit_bhattacharya@dau.ac.in",
    "phone":"Not Available",
    "address":"Not Available",
    "combined_text":"Name: Samit bhattacharya | Role: Adjunct Faculty | Education: PhD (Computer Science & Engineering), IIT Kharagpur | Biography: Not Available | Research Areas: extended reality (virtual, augmented & mixed reality) affective & ubiquitous systems mobile & wearable systems & interactions ict applications in education, agriculture, & h… | Research Keywords: systems, education, (virtual, reality), interactions, mobile, ubiquitous, mixed, augmented, ict, applications, extended, wearable, reality, affective, agriculture"
  },
  {
    "faculty_id":92,
    "name":"Subhas chandra nandy",
    "faculty_type":"Adjunct Faculty",
    "education":"PhD (Computer Science), University of Calcutta",
    "bio":"Subhas C Nandy received the M.Sc. degree in Statistics from University of Calcutta in the year 1982, M.Tech.(CS) degree from Indian Statistical Institute in the year 1985, and Ph.D. degrees in Computer Science from University of Calcutta in the year 1996. Since 1986, he was an employee of Indian Statistical Institute, Kolkata. He retired as Professor HAG in July 2024. At the time of retirement he was attached with the Advanced Computing and Microelectronics Unit of the institute. He held visiting scientist positions in Japan Advance Institute of Science and Technology (JAIST) during 1998-1999 and City University of Hong Kong during May-August 2000. During August-December 2014 and August-September 2015, he served Carleton University as a visiting professor. He served in the Programme Committee of ISAAC (2006,2022), FSTTCS (2006, 2014), WALCOM (2008, 2010, 2011,2015, 2017, 2018, 2021, 2024, 2025, 2026). He is the Steering Committee member of the Workshop on Algorithms and Computation (WALCOM). He also served as a Guest Editor of two issues of the journal Theoretical Computer Science, and the special issue of WALCOM 2021 in J. on Graph Algorithms and Applications. He supervised 7 Doctoral students and more than 30 M.Tech.(CS) students during the tenure of his service as a faculty member in ISI. The research areas of interest of Dr. Nandy are computational and combinatorial geometry and algorithmic graph theory with applications in VLSI physical design, wireless communication, robot path planning, etc. He collaborates with researchers in IIT KGP, IIT Guwahati, IIT Delhi, etc. in the country, and Carleton University, Simon Fraser University, abroad. He published more than 100 research articles in reputed international journals and peer reviewed conferences.",
    "specialization_list":[
      "algorithms",
      "data structure",
      "graph applications",
      "computational and combinatorial geometry"
    ],
    "research_tags":[
      "algorithms",
      "data",
      "ai",
      "geometry",
      "computational",
      "combinatorial",
      "structure",
      "applications",
      "and",
      "graph"
    ],
    "email":"subhas_nandy@dau.ac.in",
    "phone":"07968261717",
    "address":"# 4105, FB-4, DAU, Gandhinagar, Gujarat, India – 382007",
    "combined_text":"Name: Subhas chandra nandy | Role: Adjunct Faculty | Education: PhD (Computer Science), University of Calcutta | Biography: Subhas C Nandy received the M.Sc. degree in Statistics from University of Calcutta in the year 1982, M.Tech.(CS) degree from Indian Statistical Institute in the year 1985, and Ph.D. degrees in Computer Science from University of Calcutta in the year 1996. Since 1986, he was an employee of Indian Statistical Institute, Kolkata. He retired as Professor HAG in July 2024. At the time of retirement he was attached with the Advanced Computing and Microelectronics Unit of the institute. He held visiting scientist positions in Japan Advance Institute of Science and Technology (JAIST) during 1998-1999 and City University of Hong Kong during May-August 2000. During August-December 2014 and August-September 2015, he served Carleton University as a visiting professor. He served in the Programme Committee of ISAAC (2006,2022), FSTTCS (2006, 2014), WALCOM (2008, 2010, 2011,2015, 2017, 2018, 2021, 2024, 2025, 2026). He is the Steering Committee member of the Workshop on Algorithms and Computation (WALCOM). He also served as a Guest Editor of two issues of the journal Theoretical Computer Science, and the special issue of WALCOM 2021 in J. on Graph Algorithms and Applications. He supervised 7 Doctoral students and more than 30 M.Tech.(CS) students during the tenure of his service as a faculty member in ISI. The research areas of interest of Dr. Nandy are computational and combinatorial geometry and algorithmic graph theory with applications in VLSI physical design, wireless communication, robot path planning, etc. He collaborates with researchers in IIT KGP, IIT Guwahati, IIT Delhi, etc. in the country, and Carleton University, Simon Fraser University, abroad. He published more than 100 research articles in reputed international journals and peer reviewed conferences. | Research Areas: algorithms, data structure, graph applications, computational and combinatorial geometry | Research Keywords: algorithms, data, ai, geometry, computational, combinatorial, structure, applications, and, graph"
  },
  {
    "faculty_id":93,
    "name":"Swati priya",
    "faculty_type":"Adjunct Faculty",
    "education":"PhD (Heavy Metal Detection in Crops and Soil Clay Mineral Abundance Mapping using Hyperspectral Data),  DA-IICT Gandhinagar",
    "bio":"Not Available",
    "specialization_list":[
      "remote sensing and gis",
      "precision agriculture",
      "and crop modelling precision agriculture"
    ],
    "research_tags":[
      "agriculture",
      "remote",
      "crop",
      "precision",
      "sensing",
      "and",
      "gis",
      "modelling"
    ],
    "email":"swati_priya@dau.ac.in",
    "phone":"Not Available",
    "address":"Not Available",
    "combined_text":"Name: Swati priya | Role: Adjunct Faculty | Education: PhD (Heavy Metal Detection in Crops and Soil Clay Mineral Abundance Mapping using Hyperspectral Data),  DA-IICT Gandhinagar | Biography: Not Available | Research Areas: remote sensing and gis, precision agriculture, and crop modelling precision agriculture | Research Keywords: agriculture, remote, crop, precision, sensing, and, gis, modelling"
  },
  {
    "faculty_id":94,
    "name":"Troy vasanth",
    "faculty_type":"Adjunct Faculty",
    "education":"PGDPD (Animation Film Design), NID, Ahmedabad",
    "bio":"Not Available",
    "specialization_list":[
      "sound design",
      "3d",
      "animation and motion design"
    ],
    "research_tags":[
      "motion",
      "design",
      "animation",
      "and",
      "sound"
    ],
    "email":"troy_vasanth@dau.ac.in",
    "phone":"Not Available",
    "address":"Not Available",
    "combined_text":"Name: Troy vasanth | Role: Adjunct Faculty | Education: PGDPD (Animation Film Design), NID, Ahmedabad | Biography: Not Available | Research Areas: sound design, 3d, animation and motion design | Research Keywords: motion, design, animation, and, sound"
  },
  {
    "faculty_id":95,
    "name":"Umang shah",
    "faculty_type":"Adjunct Faculty",
    "education":"PDP Programme, Aalto University, Finland",
    "bio":"Not Available",
    "specialization_list":[
      "a. integrated interdisciplinary design b. design and technology c. aesthetic detailings and manufacturing d. radical and incremental innovation."
    ],
    "research_tags":[
      "innovation.",
      "design",
      "aesthetic",
      "incremental",
      "technology",
      "interdisciplinary",
      "manufacturing",
      "and",
      "radical",
      "detailings",
      "integrated"
    ],
    "email":"umang_shah@dau.ac.in",
    "phone":"Not Available",
    "address":"Not Available",
    "combined_text":"Name: Umang shah | Role: Adjunct Faculty | Education: PDP Programme, Aalto University, Finland | Biography: Not Available | Research Areas: a. integrated interdisciplinary design b. design and technology c. aesthetic detailings and manufacturing d. radical and incremental innovation. | Research Keywords: innovation., design, aesthetic, incremental, technology, interdisciplinary, manufacturing, and, radical, detailings, integrated"
  },
  {
    "faculty_id":96,
    "name":"Jayanth varma",
    "faculty_type":"Distinguished Professor",
    "education":"Doctorate in Management, IIM Ahmedabad",
    "bio":"Prof. Jayanth R. Varma has extensive experience in financial markets, regulation, and academia; he has served on the RBI Monetary Policy Committee, been a member of SEBI, chaired multiple regulatory committees, held board positions in major organizations, and taught courses on capital markets, risk management, and corporate finance.",
    "specialization_list":[
      "financial markets and pricing models",
      "the financial sector",
      "international finance",
      "and quantitative modeling."
    ],
    "research_tags":[
      "models",
      "sector",
      "ai",
      "modeling.",
      "the",
      "quantitative",
      "and",
      "financial",
      "markets",
      "international",
      "finance",
      "pricing"
    ],
    "email":"jayanth_varma@dau.ac.in",
    "phone":"07968261679",
    "address":"# 2208, FB-2, DAU, Gandhinagar, Gujarat, India – 382007",
    "combined_text":"Name: Jayanth varma | Role: Distinguished Professor | Education: Doctorate in Management, IIM Ahmedabad | Biography: Prof. Jayanth R. Varma has extensive experience in financial markets, regulation, and academia; he has served on the RBI Monetary Policy Committee, been a member of SEBI, chaired multiple regulatory committees, held board positions in major organizations, and taught courses on capital markets, risk management, and corporate finance. | Research Areas: financial markets and pricing models, the financial sector, international finance, and quantitative modeling. | Research Keywords: models, sector, ai, modeling., the, quantitative, and, financial, markets, international, finance, pricing"
  },
  {
    "faculty_id":97,
    "name":"Vishvajit pandya",
    "faculty_type":"Distinguished Professor",
    "education":"PhD (Anthropology), University of Chicago, USA",
    "bio":"Not Available",
    "specialization_list":[
      "material culture",
      "design and communication culture",
      "visual anthropology",
      "anthropology of space",
      "rituals and history with specific reference to colonialism south east asia"
    ],
    "research_tags":[
      "space",
      "material",
      "communication",
      "design",
      "colonialism",
      "south",
      "culture",
      "east",
      "history",
      "specific",
      "asia",
      "rituals",
      "anthropology",
      "reference",
      "with",
      "and",
      "visual"
    ],
    "email":"vishvajit_pandya@dau.ac.in",
    "phone":"07968261543",
    "address":"# 2105, FB-2, DA-IICT, Gandhinagar, Gujarat, India – 382007",
    "combined_text":"Name: Vishvajit pandya | Role: Distinguished Professor | Education: PhD (Anthropology), University of Chicago, USA | Biography: Not Available | Research Areas: material culture, design and communication culture, visual anthropology, anthropology of space, rituals and history with specific reference to colonialism south east asia | Research Keywords: space, material, communication, design, colonialism, south, culture, east, history, specific, asia, rituals, anthropology, reference, with, and, visual"
  },
  {
    "faculty_id":98,
    "name":"Ajay tomar",
    "faculty_type":"Professor of Practice",
    "education":"I.P.S, (1989)",
    "bio":"Not Available",
    "specialization_list":[
      "mr. ajay tomar was retired as the commissioner of police",
      "surat. he was recipient of police medal for meritorious service 2005 and also the president's medal for distinguished service-2014. know more"
    ],
    "research_tags":[
      "the",
      "medal",
      "police",
      "was",
      "ajay",
      "surat.",
      "service",
      "meritorious",
      "tomar",
      "and",
      "know",
      "distinguished",
      "commissioner",
      "retired",
      "more",
      "recipient",
      "also",
      "service-2014.",
      "for",
      "mr.",
      "president's",
      "2005"
    ],
    "email":"ajay_tomar@dau.ac.in",
    "phone":"Not Available",
    "address":"Not Available",
    "combined_text":"Name: Ajay tomar | Role: Professor of Practice | Education: I.P.S, (1989) | Biography: Not Available | Research Areas: mr. ajay tomar was retired as the commissioner of police, surat. he was recipient of police medal for meritorious service 2005 and also the president's medal for distinguished service-2014. know more | Research Keywords: the, medal, police, was, ajay, surat., service, meritorious, tomar, and, know, distinguished, commissioner, retired, more, recipient, also, service-2014., for, mr., president's, 2005"
  },
  {
    "faculty_id":99,
    "name":"Anirban dutta gupta",
    "faculty_type":"Professor of Practice",
    "education":"Graduate in Visual Communication Design, NID Ahmedabad",
    "bio":"Not Available",
    "specialization_list":[
      "natural history & ethnographic documentary",
      "photography",
      "communication design",
      "design for development & conservation"
    ],
    "research_tags":[
      "ethnographic",
      "communication",
      "conservation",
      "documentary",
      "design",
      "history",
      "natural",
      "for",
      "photography",
      "development"
    ],
    "email":"anirban_dutta@dau.ac.in",
    "phone":"Not Available",
    "address":"Not Available",
    "combined_text":"Name: Anirban dutta gupta | Role: Professor of Practice | Education: Graduate in Visual Communication Design, NID Ahmedabad | Biography: Not Available | Research Areas: natural history & ethnographic documentary, photography, communication design, design for development & conservation | Research Keywords: ethnographic, communication, conservation, documentary, design, history, natural, for, photography, development"
  },
  {
    "faculty_id":100,
    "name":"Harpreet singh jattana",
    "faculty_type":"Professor of Practice",
    "education":"PhD - Pursuing (Microelectronics – SOI CMOS Process Integration & Modelling), IIT Roorkee",
    "bio":"Have hands-on experience (more than 37 years) in the following areas of microelectronics: CMOS Process development and Integration (SOI, HV, BiPolar, NVM, OTP) VLSI Design for Space\/Military applications Radiation hardened Technology for VLSI products. CMOS fabrication and Mass production Device reliability and failure modes IC testing, characterization, Packaging and Qualification Failure Analysis of CMOS Project planning, execution and Management Materials management, procurement. Equipment specifications formulation, technical comparison ToT related issues – Device types, process details, unit recipes, Tech vehicle, IPs, design flows etc. MEMS Cantilever and Z-measurement MEMS device for Biomedical applications Subject Knowledge & Understanding Non conventional MOS devices Lower Node Technology (incl products and markets) VLSI Packaging ( Ceramic, Plastic, Small-outline, 2D, MCM,2.5D) MEMS Design MEMS Fabrication (Surface & Bulk Micromachining, LEGA) Compound Semiconductors (GaN, GaAs based devices) Medical Devices Clinical Validation Teaching Semiconductor courses (MTech, BTech )",
    "specialization_list":[
      "cmos process development",
      "device reliability",
      "cmos design",
      "compound semiconductors",
      "vlsi testing & packaging",
      "wafer fabrication"
    ],
    "research_tags":[
      "process",
      "fabrication",
      "testing",
      "vlsi",
      "ai",
      "cmos",
      "design",
      "reliability",
      "semiconductors",
      "device",
      "packaging",
      "wafer",
      "compound",
      "development"
    ],
    "email":"harpreetsingh_jattana@dau.ac.in",
    "phone":"07968261718",
    "address":"# 3110, FB-3, DA-IICT, Gandhinagar, Gujarat, India – 382007",
    "combined_text":"Name: Harpreet singh jattana | Role: Professor of Practice | Education: PhD - Pursuing (Microelectronics – SOI CMOS Process Integration & Modelling), IIT Roorkee | Biography: Have hands-on experience (more than 37 years) in the following areas of microelectronics: CMOS Process development and Integration (SOI, HV, BiPolar, NVM, OTP) VLSI Design for Space\/Military applications Radiation hardened Technology for VLSI products. CMOS fabrication and Mass production Device reliability and failure modes IC testing, characterization, Packaging and Qualification Failure Analysis of CMOS Project planning, execution and Management Materials management, procurement. Equipment specifications formulation, technical comparison ToT related issues – Device types, process details, unit recipes, Tech vehicle, IPs, design flows etc. MEMS Cantilever and Z-measurement MEMS device for Biomedical applications Subject Knowledge & Understanding Non conventional MOS devices Lower Node Technology (incl products and markets) VLSI Packaging ( Ceramic, Plastic, Small-outline, 2D, MCM,2.5D) MEMS Design MEMS Fabrication (Surface & Bulk Micromachining, LEGA) Compound Semiconductors (GaN, GaAs based devices) Medical Devices Clinical Validation Teaching Semiconductor courses (MTech, BTech ) | Research Areas: cmos process development, device reliability, cmos design, compound semiconductors, vlsi testing & packaging, wafer fabrication | Research Keywords: process, fabrication, testing, vlsi, ai, cmos, design, reliability, semiconductors, device, packaging, wafer, compound, development"
  },
  {
    "faculty_id":101,
    "name":"K c supekar",
    "faculty_type":"Professor of Practice",
    "education":"PhD (Agricultural Economics), Gokhale Institute of Politics and Economics, Pune (GIPE)",
    "bio":"Not Available",
    "specialization_list":[
      "dr. supekar has an extensive experience of about 40 years of cooperative dairy sector in india which ranges from small and marginal farmers at grassroots level to serving as managing director of ncdfi for about 13 years. the key areas of interest include upliftment of the rural farmers & women empowerment to bring social and cultural change and bringing in the digital technologies to revamp the indian rural ecosystem."
    ],
    "research_tags":[
      "sector",
      "cooperative",
      "include",
      "women",
      "from",
      "ranges",
      "the",
      "farmers",
      "upliftment",
      "revamp",
      "ecosystem.",
      "years",
      "about",
      "years.",
      "supekar",
      "bring",
      "interest",
      "level",
      "rural",
      "digital",
      "ncdfi",
      "and",
      "which",
      "cultural",
      "dr.",
      "grassroots",
      "social",
      "marginal",
      "bringing",
      "india",
      "experience",
      "extensive",
      "change",
      "managing",
      "for",
      "director",
      "areas",
      "dairy",
      "technologies",
      "empowerment",
      "serving",
      "small",
      "indian",
      "has",
      "key"
    ],
    "email":"kc_supekar@dau.ac.in",
    "phone":"Not Available",
    "address":"Not Available",
    "combined_text":"Name: K c supekar | Role: Professor of Practice | Education: PhD (Agricultural Economics), Gokhale Institute of Politics and Economics, Pune (GIPE) | Biography: Not Available | Research Areas: dr. supekar has an extensive experience of about 40 years of cooperative dairy sector in india which ranges from small and marginal farmers at grassroots level to serving as managing director of ncdfi for about 13 years. the key areas of interest include upliftment of the rural farmers & women empowerment to bring social and cultural change and bringing in the digital technologies to revamp the indian rural ecosystem. | Research Keywords: sector, cooperative, include, women, from, ranges, the, farmers, upliftment, revamp, ecosystem., years, about, years., supekar, bring, interest, level, rural, digital, ncdfi, and, which, cultural, dr., grassroots, social, marginal, bringing, india, experience, extensive, change, managing, for, director, areas, dairy, technologies, empowerment, serving, small, indian, has, key"
  },
  {
    "faculty_id":102,
    "name":"Anil maheshwari",
    "faculty_type":"Adjunct faculty international",
    "education":"PhD, TIFR Bombay",
    "bio":"Dr. Maheshwari received his bachelor’s and master’s from Birla Institute of Technology and Sciences and his Ph.D. from Tata Institute of Fundamental Research in India. He was a postdoctoral fellow at the Max-Planck Institute for Computer Science in Saarbrücken, Germany from 1993-94 and Research Associate at Carleton from 1994-95. He joined the School of Computer Science as an Assistant Professor in 1996 and has been a professor with the school since 2007.",
    "specialization_list":[
      "design",
      "analysis and implementation of algorithms for problems arising in computational geometry",
      "graph theory",
      "discrete mathematics",
      "and data science."
    ],
    "research_tags":[
      "algorithms",
      "discrete",
      "data",
      "problems",
      "implementation",
      "design",
      "geometry",
      "theory",
      "arising",
      "computational",
      "analysis",
      "science.",
      "for",
      "and",
      "graph",
      "mathematics"
    ],
    "email":"anil_maheshwari@dau.ac.in",
    "phone":"Not Available",
    "address":"Not Available",
    "combined_text":"Name: Anil maheshwari | Role: Adjunct faculty international | Education: PhD, TIFR Bombay | Biography: Dr. Maheshwari received his bachelor’s and master’s from Birla Institute of Technology and Sciences and his Ph.D. from Tata Institute of Fundamental Research in India. He was a postdoctoral fellow at the Max-Planck Institute for Computer Science in Saarbrücken, Germany from 1993-94 and Research Associate at Carleton from 1994-95. He joined the School of Computer Science as an Assistant Professor in 1996 and has been a professor with the school since 2007. | Research Areas: design, analysis and implementation of algorithms for problems arising in computational geometry, graph theory, discrete mathematics, and data science. | Research Keywords: algorithms, discrete, data, problems, implementation, design, geometry, theory, arising, computational, analysis, science., for, and, graph, mathematics"
  },
  {
    "faculty_id":103,
    "name":"Anthony r. noerpel",
    "faculty_type":"Adjunct faculty international",
    "education":"MSc (Electrical Engineering), New Jersey Institute of Technology, USA",
    "bio":"Not Available",
    "specialization_list":[
      "cellular and satellite communication system design",
      "rf propagation",
      "earth systems sciences."
    ],
    "research_tags":[
      "systems",
      "communication",
      "design",
      "system",
      "cellular",
      "propagation",
      "satellite",
      "and",
      "sciences.",
      "earth"
    ],
    "email":"anthony_noerpel@dau.ac.in",
    "phone":"Not Available",
    "address":"Not Available",
    "combined_text":"Name: Anthony r. noerpel | Role: Adjunct faculty international | Education: MSc (Electrical Engineering), New Jersey Institute of Technology, USA | Biography: Not Available | Research Areas: cellular and satellite communication system design, rf propagation, earth systems sciences. | Research Keywords: systems, communication, design, system, cellular, propagation, satellite, and, sciences., earth"
  },
  {
    "faculty_id":104,
    "name":"Gabriella pasi",
    "faculty_type":"Adjunct faculty international",
    "education":"PhD (Computer Science), University of Rennes, France",
    "bio":"Not Available",
    "specialization_list":[
      "information retrieval",
      "information filtering",
      "data science",
      "fuzzy logic"
    ],
    "research_tags":[
      "science",
      "filtering",
      "data",
      "retrieval",
      "fuzzy",
      "information",
      "logic"
    ],
    "email":"gabriella_pasi@dau.ac.in",
    "phone":"Not Available",
    "address":"Not Available",
    "combined_text":"Name: Gabriella pasi | Role: Adjunct faculty international | Education: PhD (Computer Science), University of Rennes, France | Biography: Not Available | Research Areas: information retrieval, information filtering, data science, fuzzy logic | Research Keywords: science, filtering, data, retrieval, fuzzy, information, logic"
  },
  {
    "faculty_id":105,
    "name":"Gaurav sharma",
    "faculty_type":"Adjunct faculty international",
    "education":"",
    "bio":"Not Available",
    "specialization_list":[
      "data analytics",
      "cyber physical systems",
      "signal and image processing",
      "computer vision",
      "media security",
      "communications"
    ],
    "research_tags":[
      "systems",
      "vision",
      "cyber",
      "data",
      "signal",
      "computer",
      "media",
      "security",
      "image",
      "physical",
      "processing",
      "analytics",
      "and",
      "communications"
    ],
    "email":"gaurav.sharma@rochester.edu",
    "phone":"Not Available",
    "address":"Professor of Electrical and Computer Engineering, University of Rochester, CSB 725, Box 270231, Rochester, NY 14627-0231 USA",
    "combined_text":"Name: Gaurav sharma | Role: Adjunct faculty international | Education:  | Biography: Not Available | Research Areas: data analytics, cyber physical systems, signal and image processing, computer vision, media security, communications | Research Keywords: systems, vision, cyber, data, signal, computer, media, security, image, physical, processing, analytics, and, communications"
  },
  {
    "faculty_id":106,
    "name":"Nicholas belkin",
    "faculty_type":"Adjunct faculty international",
    "education":"PhD (Information Studies), University College, University of London",
    "bio":"Not Available",
    "specialization_list":[
      "information retrieval",
      "and interaction design"
    ],
    "research_tags":[
      "design",
      "interaction",
      "retrieval",
      "information",
      "and"
    ],
    "email":"nicholas_belkin@dau.ac.in",
    "phone":"Not Available",
    "address":"Not Available",
    "combined_text":"Name: Nicholas belkin | Role: Adjunct faculty international | Education: PhD (Information Studies), University College, University of London | Biography: Not Available | Research Areas: information retrieval, and interaction design | Research Keywords: design, interaction, retrieval, information, and"
  },
  {
    "faculty_id":107,
    "name":"Nilotpal chakravarti",
    "faculty_type":"Adjunct faculty international",
    "education":"PhD (Combinatorics and Optimization), University of Waterloo, USA",
    "bio":"Not Available",
    "specialization_list":[

    ],
    "research_tags":[

    ],
    "email":"nilotpal_chakravarti@dau.ac.in",
    "phone":"Not Available",
    "address":"Not Available",
    "combined_text":"Name: Nilotpal chakravarti | Role: Adjunct faculty international | Education: PhD (Combinatorics and Optimization), University of Waterloo, USA | Biography: Not Available | Research Areas:  | Research Keywords: "
  },
  {
    "faculty_id":108,
    "name":"Ranjan pal",
    "faculty_type":"Adjunct faculty international",
    "education":"PhD (Computer Science), Provost PhD Fellow (Highest Graduate Honor), University of Southern California (USC), Los Angeles, California, USA",
    "bio":"Not Available",
    "specialization_list":[
      "cyber risk management",
      "cyber resilience",
      "cybersecurity",
      "decision science",
      "algorithmics",
      "applied probability"
    ],
    "research_tags":[
      "decision",
      "management",
      "cybersecurity",
      "science",
      "cyber",
      "algorithmics",
      "resilience",
      "probability",
      "applied",
      "risk"
    ],
    "email":"ranjanpal9@gmail.com,ranjanp@mit.edu",
    "phone":"Not Available",
    "address":"Not Available",
    "combined_text":"Name: Ranjan pal | Role: Adjunct faculty international | Education: PhD (Computer Science), Provost PhD Fellow (Highest Graduate Honor), University of Southern California (USC), Los Angeles, California, USA | Biography: Not Available | Research Areas: cyber risk management, cyber resilience, cybersecurity, decision science, algorithmics, applied probability | Research Keywords: decision, management, cybersecurity, science, cyber, algorithmics, resilience, probability, applied, risk"
  },
  {
    "faculty_id":109,
    "name":"Rita chakravarti",
    "faculty_type":"Adjunct faculty international",
    "education":"PhD (Multivariate Analysis), University of Pittsburgh",
    "bio":"Not Available",
    "specialization_list":[

    ],
    "research_tags":[

    ],
    "email":"rita_chakravarti@dau.ac.in",
    "phone":"Not Available",
    "address":"Not Available",
    "combined_text":"Name: Rita chakravarti | Role: Adjunct faculty international | Education: PhD (Multivariate Analysis), University of Pittsburgh | Biography: Not Available | Research Areas:  | Research Keywords: "
  },
  {
    "faculty_id":110,
    "name":"S. lakshmivarahan",
    "faculty_type":"Adjunct faculty international",
    "education":"PhD (Electrical Engineering), Indian Institute of Science, Bangalore",
    "bio":"Not Available",
    "specialization_list":[
      "big data analytics",
      "dynamic data assimilation and its applications",
      "multi-agent dynamics and network science",
      "interconnection networks for parallel computers",
      "learning algorithms and computational finance."
    ],
    "research_tags":[
      "interconnection",
      "data",
      "dynamics",
      "computational",
      "its",
      "applications",
      "computers",
      "big",
      "finance.",
      "and",
      "network",
      "assimilation",
      "algorithms",
      "dynamic",
      "learning",
      "analytics",
      "for",
      "science",
      "parallel",
      "networks",
      "multi-agent"
    ],
    "email":"s_lakshmivarahan@dau.ac.in",
    "phone":"Not Available",
    "address":"Not Available",
    "combined_text":"Name: S. lakshmivarahan | Role: Adjunct faculty international | Education: PhD (Electrical Engineering), Indian Institute of Science, Bangalore | Biography: Not Available | Research Areas: big data analytics, dynamic data assimilation and its applications, multi-agent dynamics and network science, interconnection networks for parallel computers, learning algorithms and computational finance. | Research Keywords: interconnection, data, dynamics, computational, its, applications, computers, big, finance., and, network, assimilation, algorithms, dynamic, learning, analytics, for, science, parallel, networks, multi-agent"
  },
  {
    "faculty_id":111,
    "name":"Stefano mizzaro",
    "faculty_type":"Adjunct faculty international",
    "education":"PhD (Information Engineering), University of Trieste, Italy",
    "bio":"Not Available",
    "specialization_list":[
      "information retrieval",
      "artificial intelligence"
    ],
    "research_tags":[
      "information",
      "artificial",
      "intelligence",
      "retrieval"
    ],
    "email":"mizzaro@uniud.it",
    "phone":"Not Available",
    "address":"Not Available",
    "combined_text":"Name: Stefano mizzaro | Role: Adjunct faculty international | Education: PhD (Information Engineering), University of Trieste, Italy | Biography: Not Available | Research Areas: information retrieval, artificial intelligence | Research Keywords: information, artificial, intelligence, retrieval"
  },
  {
    "faculty_id":112,
    "name":"Thomas mandl",
    "faculty_type":"Adjunct faculty international",
    "education":"PhD (Information Science), University of Hildesheim, Germany",
    "bio":"Not Available",
    "specialization_list":[
      "information science",
      "cognitive similarity learning in information retrieval and information management"
    ],
    "research_tags":[
      "management",
      "science",
      "cognitive",
      "similarity",
      "retrieval",
      "information",
      "learning",
      "and"
    ],
    "email":"thomas_mandl@dau.ac.in",
    "phone":"Not Available",
    "address":"Not Available",
    "combined_text":"Name: Thomas mandl | Role: Adjunct faculty international | Education: PhD (Information Science), University of Hildesheim, Germany | Biography: Not Available | Research Areas: information science, cognitive similarity learning in information retrieval and information management | Research Keywords: management, science, cognitive, similarity, retrieval, information, learning, and"
  }
]